[
  {
    "num": 1,
    "date": "23.05.2020",
    "dateISO": "2020-05-23",
    "vuelta": 9,
    "freq": "144 -222",
    "url": "https://t.me/ACenRED/250",
    "tags": [
      "mayo",
      "quintaDimension",
      "espacioPublicoDeUsoPrivado",
      "mente",
      "menteColectiva",
      "concienciaDeTerritorio",
      "concienciaDeLaTierra",
      "pactoConElTerritorio",
      "octavas"
    ],
    "snippet": "(Extraído de",
    "content": "Alejandra Casado\nEN RED 1\n23.05.2020 144 -222\nvuelta 9\nTranscripción\n---\n#mayo\n#quintaDimension\n#espacioPublicoDeUsoPrivado\n#mente\n#menteColectiva\n#concienciaDeTerritorio\n#concienciaDeLaTierra\n#pactoConElTerritorio\n#octavas\n(Extraído de\nhttps://t.me/ACenRED/250)",
    "pdfPage": 1
  },
  {
    "num": 2,
    "date": "30.05.2020",
    "dateISO": "2020-05-30",
    "vuelta": 10,
    "freq": "151 -215",
    "url": "https://t.me/ACenRED/251",
    "tags": [
      "mente",
      "mentalidad",
      "respaldoPatrónOro",
      "quitaDelPatronOro",
      "agregadosDeSegundosIntercalares",
      "matrizPsiquicaDeLaMenteDigitalDeLaTierra",
      "funcionPer",
      "generosidad",
      "aprender"
    ],
    "snippet": "(Extraído de",
    "content": "Alejandra Casado\nEN RED 2\n30.05.2020 151 -215\nvuelta 10\nTranscripción\n---\n#mente\n#mentalidad\n#respaldoPatrónOro\n#quitaDelPatronOro\n#agregadosDeSegundosIntercalares.\n#matrizPsiquicaDeLaMenteDigitalDeLaTierra.\n#funcionPer\n#generosidad\n#aprender\n(Extraído de\nhttps://t.me/ACenRED/251)",
    "pdfPage": 1
  },
  {
    "num": 3,
    "date": "06.06.2020",
    "dateISO": "2020-06-06",
    "vuelta": 10,
    "freq": "158 -208",
    "url": "https://t.me/ACenRED/252",
    "tags": [
      "JqueUnió",
      "Junio",
      "plazaMayor",
      "campoUnificado",
      "tejidoConectivo",
      "estabilidad",
      "evolución",
      "casoGeorgeFloyd",
      "fasesDeLaRespiracion",
      "concienciaDeQuintaDimension",
      "respiraciónDeLaTierra",
      "actualización",
      "error",
      "engaño",
      "mente",
      "mentalidades",
      "autoconfianza",
      "criminalizacionDelError",
      "tejidoElectromagneticoDeLaTierra",
      "tierraPlana",
      "geocentrismo"
    ],
    "snippet": "(Extraído de",
    "content": "Alejandra Casado\nEN RED 3\n06.06.2020 158 -208\nvuelta 10\nTranscripción\n---\n#JqueUnió #Junio\n#plazaMayor\n#campoUnificado\n#tejidoConectivo\n#estabilidad #evolución\n#casoGeorgeFloyd\n#fasesDeLaRespiracion\n#concienciaDeQuintaDimension\n#respiraciónDeLaTierra\n#actualización\n#error #engaño\n#mente #mentalidades\n#autoconfianza\n#criminalizacionDelError\n#tejidoElectromagneticoDeLaTierra.\n#tierraPlana\n#geocentrismo\n(Extraído de\nhttps://t.me/ACenRED/252)\n",
    "pdfPage": 1
  },
  {
    "num": 4,
    "date": "13.06.2020",
    "dateISO": "2020-06-13",
    "vuelta": 11,
    "freq": "165 -201",
    "url": "https://t.me/ACenRED/255",
    "tags": [
      "matrizPsiquica",
      "quintaDimension",
      "procesador",
      "resignificacionDeLosAccidentes",
      "tumi",
      "anilloDeFuego",
      "segundosIntercalares",
      "respaldosYsincroniasMatrizPsiquica",
      "ionico",
      "muonico",
      "concienciaGeocentrica",
      "adultoMayorDelEspacioTiempo",
      "coherencia",
      "cohesion",
      "ejeZ"
    ],
    "snippet": "(Extraído de",
    "content": "Alejandra Casado\nEN RED 4\n13.06.2020 165 -201\nvuelta 11\nTranscripción\n---\n#matrizPsiquica\n#quintaDimension\n#procesador\n#resignificacionDeLosAccidentes\n#tumi\n#anilloDeFuego\n#segundosIntercalares\n#respaldosYsincroniasMatrizPsiquica\n#ionico #muonico\n#concienciaGeocentrica\n#adultoMayorDelEspacioTiempo\n#coherencia #cohesion\n#ejeZ\n(Extraído de\nhttps://t.me/ACenRED/255)",
    "pdfPage": 2
  },
  {
    "num": 5,
    "date": "20.06.2020",
    "dateISO": "2020-06-20",
    "vuelta": 11,
    "freq": "172 -194",
    "url": "https://t.me/ACenRED/256",
    "tags": [
      "virus",
      "contacto",
      "contagio",
      "antena",
      "coherencia",
      "cohesión",
      "conflicto",
      "reflejo",
      "espejo",
      "cuarentena",
      "perú",
      "código51",
      "código54",
      "defecto",
      "virtud",
      "honestidad",
      "engaños",
      "religiones",
      "logoLgc",
      "plantillaDeVelocidadesTemporales",
      "tierraLogicaNegativa",
      "inconcienteBiologico",
      "respiracionDeLaTierra",
      "WiFi",
      "wafi",
      "sabios",
      "habilidosos"
    ],
    "snippet": "(Extraído de",
    "content": "Alejandra casado\nEN RED 5\n20.06.2020 172 -194\nvuelta 11\nTranscripción\n---\n#virus\n#contacto  #contagio\n#antena\n#coherencia #cohesión\n#conflicto\n#reflejo #espejo\n#cuarentena\n#perú #código51\n#código54  #defecto\n#virtud\n#honestidad\n#engaños  #religiones\n#logoLgc\n#plantillaDeVelocidadesTemporales\n#tierraLogicaNegativa\n#inconcienteBiologico\n#respiracionDeLaTierra\n#WiFi  #wafi\n#sabios  #habilidosos\n(Extraído de\nhttps://t.me/ACenRED/256)\n",
    "pdfPage": 2
  },
  {
    "num": 6,
    "date": "27.06.2020",
    "dateISO": "2020-06-27",
    "vuelta": 12,
    "freq": "179 -187",
    "url": "https://t.me/ACenRED/257",
    "tags": [
      "Z",
      "julio",
      "rango7",
      "rangoGlobal",
      "transparencia",
      "honestidad",
      "universoExpresadoCivilizado",
      "avanceEvolutivoForzado",
      "avanceEvolutivoVoluntario",
      "conexión",
      "desconexion",
      "quintaDimension",
      "limite",
      "alcance",
      "contaminacionMistica",
      "estabilidad",
      "bienComun",
      "muerte",
      "union",
      "comunión",
      "mentalidad",
      "componentesDeLamentalidad",
      "identidadMultidimensional"
    ],
    "snippet": "(Extraído de",
    "content": "Alejandra Casado\nEN RED 6\n27.06.2020 179 -187\nvuelta 12\nTranscripción\n---\n#Z   #julio\n#rango7 #rangoGlobal\n#transparencia #honestidad\n#universoExpresadoCivilizado\n#avanceEvolutivoForzado\n#avanceEvolutivoVoluntario\n#conexión #desconexion\n#quintaDimension\n#limite #alcance\n#contaminacionMistica\n#estabilidad #bienComun\n#muerte #union\n#comunión\n#mentalidad\n#componentesDeLamentalidad\n#identidadMultidimensional\n(Extraído de\nhttps://t.me/ACenRED/257)",
    "pdfPage": 3
  },
  {
    "num": 7,
    "date": "04.07.2020",
    "dateISO": "2020-07-04",
    "vuelta": 12,
    "freq": "186 -180",
    "url": "https://t.me/ACenRED/258",
    "tags": [
      "independencias",
      "calendarios",
      "juliano",
      "gregoriano",
      "lasTresPsiquis",
      "quintaDimension",
      "sistemaRepresivo",
      "sistemaAdministrativo",
      "sistemaDeCompensaciones",
      "transición",
      "Broca",
      "Wernicke",
      "comprensión",
      "comunicación",
      "luz",
      "oscuridad",
      "copa",
      "todo",
      "nada",
      "algo"
    ],
    "snippet": "(Extraído de",
    "content": "Alejandra Casado\nEN RED 7\n04.07.2020 186 -180\nvuelta 12\nTranscripción\n---\n#independencias\n#calendarios\n#juliano #gregoriano\n#lasTresPsiquis/ anatomía\n#quintaDimension\n#sistemaRepresivo\n#sistemaAdministrativo\n#sistemaDeCompensaciones\n#transición\n#Broca #Wernicke\n#comprensión #comunicación\n#luz #oscuridad #copa\n#todo #nada #algo\n(Extraído de\nhttps://t.me/ACenRED/258)\n",
    "pdfPage": 3
  },
  {
    "num": 8,
    "date": "11.07.2020",
    "dateISO": "2020-07-11",
    "vuelta": 12,
    "freq": "193 -172",
    "url": "https://t.me/ACenRED/259",
    "tags": [
      "contenido",
      "continente",
      "lasTresPsiquis",
      "ser",
      "estar",
      "almaDeLaRealidad",
      "terapiasAlternativas",
      "conflicto",
      "basesEstables",
      "limiteAlcance",
      "EET",
      "tercerMarcadorHamer",
      "espíritu",
      "alma",
      "cuerpo",
      "serieDark",
      "presión",
      "represión",
      "lucido",
      "ciego",
      "ARN"
    ],
    "snippet": "(Extraído de",
    "content": "Alejandra Casado\nEN RED 8\n11.07.2020 193 -172\nvuelta 12\nTranscripción\n---\n#contenido #continente\n#lasTresPsiquis\n#ser #estar\n#almaDeLaRealidad\n#terapiasAlternativas #conflicto\n#basesEstables\n#limiteAlcance #EET #tercerMarcadorHamer\n#espíritu #alma #cuerpo\n#serieDark\n#presión #represión\n#lucido #ciego\n#ARN\n(Extraído de\nhttps://t.me/ACenRED/259)",
    "pdfPage": 4
  },
  {
    "num": 9,
    "date": "18.07.2020",
    "dateISO": "2020-07-18",
    "vuelta": 13,
    "freq": "200 -166",
    "url": "https://t.me/ACenRED/260",
    "tags": [
      "ionosfera",
      "rayosUltravioletas",
      "filtros",
      "amor",
      "moral",
      "asteroidePsique",
      "UIT",
      "psiquisConElAmbiente",
      "psiquisConmigoMismo",
      "psiquisConLosDemas",
      "bajaFrecuencia",
      "depresionBiologica",
      "laRealidad",
      "arte",
      "ciencia",
      "presión",
      "represion",
      "códigos",
      "renglon123",
      "renglon456",
      "renglon789",
      "familiaPlanetaria",
      "Aparato",
      "1461",
      "níquel",
      "que",
      "como",
      "despresurizar",
      "pulso",
      "pulsion"
    ],
    "snippet": "(Extraído de",
    "content": "Alejandra Casado\nen RED 9\n18.07.2020  200  -166\nvuelta 13\nTranscripción\n---\n#ionosfera\n#rayosUltravioletas  #filtros\n#amor  #moral\n#asteroidePsique\n#UIT\n#psiquisConElAmbiente\n#psiquisConmigoMismo\n#psiquisConLosDemas\n#bajaFrecuencia  #depresionBiologica\n#laRealidad\n#arte #ciencia\n#presión #represion\n#códigos #renglon123\n#renglon456 #renglon789\n#familiaPlanetaria\n#Aparato #1461\n#níquel #que #como\n#despresurizar\n#pulso #pulsion\n(Extraído de\nhttps://t.me/ACenRED/260)\n",
    "pdfPage": 4
  },
  {
    "num": 10,
    "date": "25.07.2020",
    "dateISO": "2020-07-25",
    "vuelta": 13,
    "freq": "206 -160",
    "url": "https://t.me/ACenRED/261",
    "tags": [
      "posición",
      "oposición",
      "error",
      "engaño",
      "vacuna",
      "laRealidad",
      "sistemaDeReferencias",
      "problemas",
      "menteLegal",
      "menteLegitima",
      "trauma",
      "ira",
      "raizDeLaIra",
      "ciencia",
      "masas",
      "levadura",
      "Geo",
      "ego",
      "cardinalidadesEstables",
      "cambiosEstructurales",
      "recursosPrimeroDesafiosDespues",
      "pulso",
      "pulsion",
      "miedo",
      "miedoComoAlerta"
    ],
    "snippet": "(Extraído de",
    "content": "Alejandra Casado\nEN RED 10\n25.07.2020  206 -160\nvuelta 13\nTranscripción\n---\n#posición #oposición\n#error  #engaño\n#vacuna\n#laRealidad   #sistemaDeReferencias\n#problemas #menteLegal\n#menteLegitima\n#trauma #ira\n#raizDeLaIra\n#ciencia\n#masas #levadura\n#Geo #ego\n#cardinalidadesEstables\n#cambiosEstructurales\n#recursosPrimeroDesafiosDespues\n#pulso #pulsion\n#miedo\n#miedoComoAlerta\n(Extraído de\nhttps://t.me/ACenRED/261)",
    "pdfPage": 5
  },
  {
    "num": 11,
    "date": "01.08.2020",
    "dateISO": "2020-08-01",
    "vuelta": 14,
    "freq": "215 -152",
    "url": "https://t.me/ACenRED/262",
    "tags": [
      "agosto",
      "efectoAncla",
      "efectoBoya",
      "enlace288",
      "anuncioEvento7011",
      "psique",
      "psiquis",
      "honestidadLibertadYbienComun",
      "cronos",
      "kairos",
      "psiquisConElAmbiente",
      "psiquisConmigoMismo",
      "psiquisConLosDemas",
      "realidad",
      "tiErra",
      "equilibrioDinamico",
      "calendarios",
      "EET",
      "inocencia",
      "ingenuidad",
      "terminarConLaDesconfianzaEntreNosotros"
    ],
    "snippet": "(Extraído de",
    "content": "Alejandra Casado\nEN RED 11\n01.08.2020  215 -152\nvuelta 14\nTranscripción\n---\n#agosto\n#efectoAncla\n#efectoBoya\n#enlace288\n#anuncioEvento7011\n#psique #psiquis\n#honestidadLibertadYbienComun\n#cronos #kairos\n#psiquisConElAmbiente\n#psiquisConmigoMismo\n#psiquisConLosDemas\n#realidad    #tiErra\n#equilibrioDinamico\n#calendarios #EET\n#inocencia #ingenuidad\n#terminarConLaDesconfianzaEntreNosotros\n(Extraído de\nhttps://t.me/ACenRED/262)",
    "pdfPage": 6
  },
  {
    "num": 12,
    "date": "08.08.2020",
    "dateISO": "2020-08-08",
    "vuelta": null,
    "freq": "221 -145",
    "url": "https://t.me/ACenRED/263",
    "tags": [
      "comentarioDeExplosionEnBeirutEnElLibano",
      "saltoDeConciencia",
      "saltosEvolutuvos",
      "aspectoLinealYnoLinealDeLaExistencia",
      "terceraDimension",
      "quintaDimension",
      "maximaConectividad",
      "evolución",
      "estabilidad",
      "elPeligroDeLaInteligencia",
      "civismo",
      "cinismo",
      "concienciaCivica",
      "ionosfera",
      "Sol",
      "astucia",
      "sabiduría",
      "ciencia",
      "conciencia",
      "matriz",
      "matrix",
      "presenteEterno",
      "segundosIntercalares",
      "puntosDeActualizacion",
      "cuartaEtapaDeLaVidaSobreLaTierra",
      "quintaEtapa",
      "almaProyectada",
      "hermandad",
      "generoHumano",
      "muerte"
    ],
    "snippet": "vuelta14 (Extraído de",
    "content": "Alejandra Casado\nEN RED 12\n08.08.2020   221 -145\nvuelta14\nTranscripción\n---\n#comentarioDeExplosionEnBeirutEnElLibano\n#saltoDeConciencia\n#saltosEvolutuvos\n#aspectoLinealYnoLinealDeLaExistencia\n#terceraDimension\n#quintaDimension\n#maximaConectividad\n#evolución #estabilidad\n#elPeligroDeLaInteligencia\n#civismo #cinismo\n#concienciaCivica\n#ionosfera   #Sol\n#astucia #sabiduría\n#ciencia #conciencia\n#matriz  #matrix\n#presenteEterno\n#segundosIntercalares\n#puntosDeActualizacion\n#cuartaEtapaDeLaVidaSobreLaTierra\n#quintaEtapa\n#almaProyectada\n#hermandad  #generoHumano\n#muerte\n(Extraído de\nhttps://t.me/ACenRED/263)\n",
    "pdfPage": 6
  },
  {
    "num": 13,
    "date": "15.08.2020",
    "dateISO": "2020-08-15",
    "vuelta": 15,
    "freq": "228 -138",
    "url": "https://t.me/ACenRED/264",
    "tags": [
      "restricciones",
      "defectos",
      "virtudes",
      "errorNativo",
      "actualización",
      "campoElectromagneticoDeLaTierra",
      "ADN",
      "ARN",
      "obviedad",
      "evidencia",
      "972",
      "971",
      "alianzaDeLosEmiratosArabesIsrael",
      "arcoDe63Dias",
      "público",
      "privado",
      "respiracionPsiquica",
      "absorción",
      "aprendizaje",
      "día",
      "tecnología",
      "todoNadaAlgo",
      "intuición",
      "instinto",
      "vacuna",
      "bisagraLogicaDeLaOctava",
      "amplificacion"
    ],
    "snippet": "(Extraído de",
    "content": "Alejandra Casado\nEN RED 13\n15.08.2020  228 -138\nvuelta 15\nTranscripción:\n---\n#restricciones\n#defectos #virtudes\n#errorNativo\n#actualización\n#campoElectromagneticoDeLaTierra\n#ADN  #ARN\n#obviedad #evidencia\n#972  #971\n#alianzaDeLosEmiratosArabesIsrael\n#arcoDe63Dias\n#público   #privado\n#respiracionPsiquica\n#absorción #aprendizaje\n#día\n#tecnología\n#todoNadaAlgo\n#intuición #instinto\n#vacuna\n#bisagraLogicaDeLaOctava (15/8)\n#amplificacion\n(Extraído de\nhttps://t.me/ACenRED/264)",
    "pdfPage": 7
  },
  {
    "num": 14,
    "date": "22.08.2020",
    "dateISO": "2020-08-22",
    "vuelta": 15,
    "freq": "235 -131",
    "url": "https://t.me/ACenRED/265",
    "tags": [
      "pertenenciaAlSistemaSolar",
      "estadoReceptivo",
      "espacio",
      "CG3000",
      "alcances",
      "límites",
      "estabilidadEvolutiva",
      "bajaFrecuencia",
      "axiomaSolar",
      "interferenciaSolar",
      "exogenoAspectoDigital",
      "endogenoAspectoAnalogico",
      "0",
      "1",
      "coherencia",
      "cohesión",
      "depredador",
      "desafíos",
      "juicio",
      "filtros",
      "respiracionPsiquica"
    ],
    "snippet": "(Extraído de",
    "content": "Alejandra Casado\nEN RED 14\n22.08.2020  235 -131\nvuelta 15\nTranscripción\n---\n#pertenenciaAlSistemaSolar\n#estadoReceptivo  #espacio\n#CG3000\n#alcances #límites\n#estabilidadEvolutiva\n#bajaFrecuencia\n#axiomaSolar\n#interferenciaSolar\n#exogenoAspectoDigital\n#endogenoAspectoAnalogico\n#0 #1\n#coherencia #cohesión\n#depredador  #desafíos\n#juicio #filtros\n#respiracionPsiquica\n(Extraído de\nhttps://t.me/ACenRED/265)\n",
    "pdfPage": 7
  },
  {
    "num": 15,
    "date": "29.08.2020",
    "dateISO": "2020-08-29",
    "vuelta": 16,
    "freq": "242 -124",
    "url": "https://t.me/ACenRED/274",
    "tags": [
      "pertenenciaAlSistemaSolar",
      "nada",
      "todo",
      "marco",
      "imaginación",
      "contrato",
      "estadoDeDesconeccion",
      "construccionDeLaMentalidadCompartida",
      "exo",
      "endo",
      "exoSoma",
      "punto",
      "guion",
      "sentidoComun",
      "conectividad",
      "anticipación",
      "proyección",
      "filtros",
      "errorNativo",
      "dominioPsiquico",
      "existenciaGenetica",
      "proyeccionGenetica",
      "valor",
      "valencia",
      "concienciaSubatomica",
      "concienciaAtomica",
      "actualización",
      "contenido",
      "desafío",
      "frecuenciaPositivaYNegativa",
      "espacio",
      "quintaDimension",
      "crearTiempo"
    ],
    "snippet": "(Extraído de",
    "content": "Alejandra Casado\nEN RED15\n29.08.2020  242 -124\nvuelta 16\nTranscripción\n---\n#pertenenciaAlSistemaSolar\n#nada #todo #marco\n#imaginación\n#contrato\n#estadoDeDesconeccion\n#construccionDeLaMentalidadCompartida\n#exo #endo  #exoSoma\n#punto #guion\n#sentidoComun\n#conectividad #anticipación\n#proyección\n#filtros #errorNativo\n#dominioPsiquico\n#existenciaGenetica\n#proyeccionGenetica\n#valor #valencia\n#concienciaSubatomica\n#concienciaAtomica\n#actualización\n#contenido #desafío\n#frecuenciaPositivaYNegativa\n#espacio  #quintaDimension\n#crearTiempo\n(Extraído de\nhttps://t.me/ACenRED/274)",
    "pdfPage": 8
  },
  {
    "num": 16,
    "date": "19.09.2020",
    "dateISO": "2020-09-19",
    "vuelta": 17,
    "freq": "263 -103",
    "url": "https://t.me/ACenRED/275",
    "tags": [
      "rolDelEvento70",
      "ambiente",
      "contexto",
      "realidad",
      "somaDelSistemaSolar",
      "habitante",
      "interferencia",
      "fundidoConElAmbiente",
      "contextosComunes",
      "inocencia",
      "conciencia",
      "inmaterial",
      "ingenuidad",
      "mente",
      "material",
      "concienciaEspecie",
      "civilización",
      "coronavirus",
      "inmunidadDeLaEspecie",
      "inmunidadDeLaCivilizacion",
      "dilemaDeLasRedesSociales",
      "tecnología",
      "consecuencias",
      "juicio",
      "criterio",
      "sentidoComun",
      "las4wifi",
      "inteligencia",
      "equilibrio",
      "contencionDeLasPolaridades",
      "aparatos505",
      "eleccionLibre",
      "consecurnciasObligadas",
      "resignificacionBuenosMalos",
      "IA",
      "enojo",
      "hoja",
      "ojo",
      "queja",
      "deReferenteAReferencia"
    ],
    "snippet": "(Extraído de",
    "content": "Alejandra Casado\nEN RED 16\n19.09.2020  263 -103\nvuelta 17\nTranscripción:\n---\n#rolDelEvento70/11\n#ambiente #contexto\n#realidad #somaDelSistemaSolar\n#habitante #interferencia\n#fundidoConElAmbiente\n#contextosComunes\n#inocencia #conciencia #inmaterial\n#ingenuidad #mente #material\n#concienciaEspecie\n#civilización\n#coronavirus\n#inmunidadDeLaEspecie\n#inmunidadDeLaCivilizacion\n#dilemaDeLasRedesSociales\n#tecnología #consecuencias\n#juicio #criterio #sentidoComun\n#las4wifi\n#conciencia #inteligencia\n#equilibrio\n#contencionDeLasPolaridades\n#aparatos505/506\n#eleccionLibre\n#consecurnciasObligadas\n#resignificacionBuenosMalos\n#IA #enojo #hoja #ojo\n#queja\n#deReferenteAReferencia\n(Extraído de\nhttps://t.me/ACenRED/275)",
    "pdfPage": 9
  },
  {
    "num": 17,
    "date": "26.09.2020",
    "dateISO": "2020-09-26",
    "vuelta": 17,
    "freq": "270 -96",
    "url": "https://t.me/ACenRED/276",
    "tags": [
      "laVacanteLePerteneceAlEvento",
      "estructuraPsiquica",
      "culpa",
      "psiquis",
      "referente",
      "referencia",
      "moral",
      "amoral",
      "amorAlOtro",
      "futuroPrimeroPasadoDespues",
      "contención",
      "alarma",
      "biología",
      "alerta",
      "psiquisMasAlta",
      "inocencia",
      "ingenuidad",
      "vulnerabilidad",
      "especieHumanaRescataCivilizacion",
      "oportunidad",
      "infortunio",
      "alma",
      "conciencia",
      "mente",
      "concienciaEspacioTemporal",
      "constructo",
      "sustrato",
      "vinculacionTecnologiaConciencia"
    ],
    "snippet": "(Extraído de",
    "content": "Alejandra Casado\nEN RED 17\n26.09.2020        270 -96\nvuelta 17\nTranscripción\n---\n#laVacanteLePerteneceAlEvento\n#estructuraPsiquica  #culpa\n#psiquis\n#referente #referencia\n#moral #amoral\n#amorAlOtro\n#futuroPrimeroPasadoDespues\n#contención\n#alarma #biología\n#alerta #psiquisMasAlta\n#inocencia #ingenuidad\n#vulnerabilidad\n#especieHumanaRescataCivilizacion\n#oportunidad #infortunio\n#alma  #conciencia #mente\n#concienciaEspacioTemporal\n#constructo #sustrato\n#vinculacionTecnologiaConciencia\n(Extraído de\nhttps://t.me/ACenRED/276)\n",
    "pdfPage": 9
  },
  {
    "num": 18,
    "date": "03.10.2020",
    "dateISO": "2020-10-03",
    "vuelta": 18,
    "freq": "277 -89",
    "url": "https://t.me/ACenRED/277",
    "tags": [
      "contextoEnConstruccion",
      "derrota",
      "derrotero",
      "rotar",
      "rotación",
      "18",
      "frontera6",
      "limite",
      "convivir",
      "5G",
      "ionosfera",
      "identidad",
      "entidad",
      "ente",
      "sistemaDeActualizaciones",
      "alma",
      "conciencia",
      "existencia",
      "sistemaSolar",
      "sistemaSocial",
      "altoPsiquismo",
      "bajoPsiquismo",
      "hermético",
      "genIO",
      "satélites",
      "herencia",
      "inherencia",
      "laRealidadEduca",
      "honestidad",
      "verdadEnConstruccion",
      "timeNewRoman",
      "unoSomosTodosYTodosSomosUno"
    ],
    "snippet": "(Extraído de",
    "content": "Alejandra Casado\nEN RED 18\n03.10.2020        277 -89\nvuelta 18\nTranscripción\n---\n#contextoEnConstruccion\n#derrota #derrotero\n#rotar #rotación\n#18#frontera6\n#limite #convivir\n#5G #ionosfera\n#identidad #entidad #ente\n#sistemaDeActualizaciones\n#alma #conciencia #existencia\n#sistemaSolar #sistemaSocial\n#altoPsiquismo\n#bajoPsiquismo\n#hermético,#ionosfera\n#genIO\n#satélites\n#herencia #inherencia\n#laRealidadEduca\n#honestidad\n#verdadEnConstruccion\n#timeNewRoman(3/10/2013)\n#unoSomosTodosYTodosSomosUno\n(Extraído de\nhttps://t.me/ACenRED/277)",
    "pdfPage": 10
  },
  {
    "num": 19,
    "date": "10.10.2020",
    "dateISO": "2020-10-10",
    "vuelta": 18,
    "freq": "284 -82",
    "url": "https://t.me/ACenRED/278",
    "tags": [
      "octubre",
      "10",
      "diezDias",
      "1582",
      "pertenencias",
      "configurarNuestrasPertenencias",
      "identidadMolecular",
      "identidadAnatomica",
      "identidadColectiva",
      "escalabilidad",
      "elQueSoy",
      "elQueEsta",
      "ochoAcostado",
      "ConcienciaCompromisoConLaNada",
      "ExistenciaCompromisoConTodo",
      "laNadaElijeCompromisoConTodo",
      "anticipación",
      "sabiduría",
      "inteligenciaOrganica",
      "potencialHumano",
      "fusión",
      "confusión",
      "fundido",
      "confundido",
      "confidencialidad",
      "confianza",
      "primeros7añosDeVida",
      "adolescencia",
      "respiracionConciente",
      "autorescate",
      "calma",
      "novenoAñoLgc",
      "niPremiosNiCastigos",
      "educación",
      "sobrecalificacion",
      "ACV",
      "concienciaMistica",
      "siLaCoherenciaNosAcompañaLaCohesionNosEspera"
    ],
    "snippet": "(Extraído de",
    "content": "Alejandra Casado\nEN RED 19\n10.10.2020        284 -82\nvuelta 18\nTranscripción\n---\n#octubre #10/10\n#diezDias  #1582\n#pertenencias\n#configurarNuestrasPertenencias\n#identidadMolecular\n#identidadAnatomica\n#identidadColectiva\n#escalabilidad #elQueSoy\n#elQueEsta #ochoAcostado\n#ConcienciaCompromisoConLaNada\n#ExistenciaCompromisoConTodo\n#laNadaElijeCompromisoConTodo\n#anticipación #sabiduría\n#inteligenciaOrganica\n#potencialHumano\n#fusión #confusión\n#fundido #confundido\n#confidencialidad #confianza\n#primeros7añosDeVida\n#adolescencia\n#respiracionConciente\n#autorescate #calma\n#novenoAñoLgc\n#niPremiosNiCastigos\n#educación\n#sobrecalificacion #ACV\n#concienciaMistica\n#siLaCoherenciaNosAcompañaLaCohesionNosEspera\n(Extraído de\nhttps://t.me/ACenRED/278)",
    "pdfPage": 11
  },
  {
    "num": 20,
    "date": "26.10.2020",
    "dateISO": "2020-10-26",
    "vuelta": 19,
    "freq": "300 -66",
    "url": "https://t.me/ACenRED/280",
    "tags": [
      "pausa",
      "espacio",
      "limitación",
      "transferencia",
      "pasoAPsso",
      "saltoASalto",
      "semáforo",
      "autolimte",
      "autoreferencia",
      "dobleDiscurso",
      "miembro",
      "pertenece",
      "conciencia",
      "participa",
      "mente",
      "menteQueTeConecta",
      "menteQueNosInterconecta",
      "menteInteractiva",
      "verdadEnConstruccion",
      "seudociencia",
      "tapabocas",
      "tejidoConectivo",
      "ordenMental",
      "psicologiaEnCrecimiento",
      "concienciaDelFormarParteDeNuestroSistemaSolar",
      "primerosAuxiliiosLgc"
    ],
    "snippet": "(Extraído de",
    "content": "Alejandra Casado\nEN RED 20\n26.10.2020  300 -66\nvuelta 19\nTranscripción\n---\n#pausa #espacio\n#limitación #transferencia\n#pasoAPsso #saltoASalto\n#semáforo #autolimte\n#autoreferencia\n#dobleDiscurso\n#miembro #pertenece #conciencia\n#participa #mente\n#menteQueTeConecta\n#menteQueNosInterconecta\n#menteInteractiva\n#verdadEnConstruccion\n#seudociencia\n#tapabocas\n#tejidoConectivo\n#ordenMental\n#psicologiaEnCrecimiento\n#concienciaDelFormarParteDeNuestroSistemaSolar\n#primerosAuxiliiosLgc\n(Extraído de\nhttps://t.me/ACenRED/280)\n",
    "pdfPage": 11
  },
  {
    "num": 21,
    "date": "31.10.2020",
    "dateISO": "2020-10-31",
    "vuelta": 19,
    "freq": "305 -61",
    "url": "https://t.me/ACenRED/281",
    "tags": [
      "DeQueSeTrataEl70",
      "lenguajeComprensible",
      "lenguajeEspecifico",
      "especificidadInterdimensional",
      "conocimientoQParteDeLaConciencia",
      "contextoSocial",
      "interaccionDeUnoAUnoEnElContexto",
      "procesoOrganico",
      "constructor",
      "consumidor",
      "puestaEnValor",
      "cooperación",
      "determinación",
      "ordenHumano",
      "ordenMistico",
      "privacidad",
      "comunidadCivilizada",
      "respetoPorLasLimiraciones",
      "comunidadInteligenteSoloAtiendeLosAlcances",
      "astucia",
      "sabiduría",
      "autodesafios",
      "paciencia",
      "equipo",
      "anticipación",
      "precisión",
      "templanza",
      "capacidadDeDialogoConLaRealidad",
      "proceso",
      "resultado",
      "construccionIdentidadColectiva",
      "misterio",
      "ministerio",
      "fundir",
      "fundar",
      "refundar",
      "alturaPsiquica",
      "psicópata",
      "sociopata",
      "depredadoresPsicologicos"
    ],
    "snippet": "(Extraído de",
    "content": "Alejandra Casado\nEN RED 21\n31.10.2020  305 -61\nvuelta 19\nTranscripción\n---\n#DeQueSeTrataEl70/11\n#lenguajeComprensible\n#lenguajeEspecifico\n#especificidadInterdimensional\n#conocimientoQParteDeLaConciencia\n#contextoSocial\n#interaccionDeUnoAUnoEnElContexto\n#procesoOrganico\n#constructor #consumidor\n#puestaEnValor\n#cooperación\n#determinación\n#ordenHumano #ordenMistico\n#privacidad\n#comunidadCivilizada\n#respetoPorLasLimiraciones\n#comunidadInteligenteSoloAtiendeLosAlcances\n#astucia #sabiduría\n#autodesafios\n#paciencia\n#equipo\n#anticipación #precisión\n#templanza\n#capacidadDeDialogoConLaRealidad\n#proceso #resultado\n#construccionIdentidadColectiva\n#misterio #ministerio\n#fundir #fundar #refundar\n#alturaPsiquica\n#psicópata #sociopata\n#depredadoresPsicologicos\n(Extraído de\nhttps://t.me/ACenRED/281)\n",
    "pdfPage": 12
  },
  {
    "num": 22,
    "date": "07.11.2020",
    "dateISO": "2020-11-07",
    "vuelta": 20,
    "freq": "312 -54",
    "url": "https://t.me/ACenRED/282",
    "tags": [
      "7",
      "54",
      "calendario",
      "referenciasReales",
      "año",
      "dia",
      "referenciasArbitrarias",
      "meses",
      "semanas",
      "atractor",
      "atraído",
      "concienciaEspacioTemporal",
      "transferenciaGravitatoria",
      "transmisión",
      "códigos",
      "parámetros",
      "598",
      "34",
      "52",
      "virtud",
      "defecto",
      "UIT",
      "unionInternacionalDeTelecomunicaciones",
      "eleccionesEnEEUU",
      "interdependencia",
      "escalabilidad",
      "crecimientoEscalar",
      "gestionDelDolor",
      "idiomaAnatomico",
      "idiomaRobotico",
      "roboT",
      "vacunas",
      "IA",
      "endogenoANuestrolSistemaSolar",
      "exogenoANuestroSistemaSolar",
      "recursos",
      "desafíos",
      "creditoIntergalacrico",
      "proyectoHumano",
      "espiritualidadDeLaRealidad",
      "jesusInicioDeCalendarioSolar",
      "universoExpresadoCivilizado",
      "sistemaInmunitario",
      "riesgoDeDesordenMental",
      "menteEnBlanco",
      "menteInteractiva",
      "derivacionNocturna"
    ],
    "snippet": "(Extraído de",
    "content": "Alejandra Casado\nEN RED 22\n07.11.2020   312 -54\nvuelta 20\nTranscripción\n---\n#7/11 #54\n#calendario\n#referenciasReales #año #dia\n#referenciasArbitrarias #meses #semanas\n#atractor #atraído\n#concienciaEspacioTemporal\n#transferenciaGravitatoria\n#transmisión\n#códigos #parámetros\n#54 #598 #34 #52\n#virtud #defecto\n#UIT #unionInternacionalDeTelecomunicaciones\n#eleccionesEnEEUU\n#interdependencia\n#escalabilidad #crecimientoEscalar\n#gestionDelDolor\n#idiomaAnatomico\n#idiomaRobotico #roboT\n#vacunas #IA\n#endogenoANuestrolSistemaSolar\n#exogenoANuestroSistemaSolar\n#recursos  #desafíos\n#creditoIntergalacrico\n#proyectoHumano\n#espiritualidadDeLaRealidad\n#jesusInicioDeCalendarioSolar\n#universoExpresadoCivilizado\n#sistemaInmunitario\n#riesgoDeDesordenMental\n#menteEnBlanco\n#menteInteractiva\n#derivacionNocturna\n(Extraído de\nhttps://t.me/ACenRED/282)\n",
    "pdfPage": 13
  },
  {
    "num": 23,
    "date": "14.11.2020",
    "dateISO": "2020-11-14",
    "vuelta": 20,
    "freq": "319 -47",
    "url": "https://t.me/ACenRED/283",
    "tags": [
      "1414",
      "47",
      "psicología",
      "ordenpsíquico",
      "ordenmental",
      "aparato",
      "505",
      "506",
      "507",
      "comprensión",
      "menteDelAmbiente",
      "chispaComoActualizacion",
      "habitanteDeLaRealidad",
      "coexistenciaDeDiversasMentes",
      "misterio",
      "ministerio",
      "ministro",
      "ARN",
      "ADN",
      "riqueza",
      "lento",
      "crearCalma",
      "dolor",
      "valor",
      "letraV",
      "23",
      "antena",
      "pertenencia",
      "sistemaSolar",
      "especie",
      "integridad",
      "nacimiento",
      "DNI",
      "muerte",
      "campoIonico",
      "axiomas",
      "cronos",
      "kairos",
      "profundidad",
      "generacionBisagra",
      "tormentaDeCitoquina",
      "menteInteractiva",
      "variarAngulos",
      "perspectivas",
      "delSistemaInmuneDeDefensasAlSistemaInteractivoDeComunicacion"
    ],
    "snippet": "(Extraído de",
    "content": "Alejandra Casado\nEN RED 23\n14.11.2020   319 -47\nvuelta 20\nTranscripción\n---\n#1414 #47\n#psicología #ordenpsíquico\n#ordenmental\n#aparato #505 #506 #507\n#comprensión\n#menteDelAmbiente\n#chispaComoActualizacion\n#habitanteDeLaRealidad\n#coexistenciaDeDiversasMentes\n#misterio #ministerio #ministro\n#ARN  #ADN\n#riqueza\n#lento #crearCalma\n#dolor #valor\n#letraV #23#antena\n#pertenencia\n#sistemaSolar\n#especie\n#integridad #nacimiento #DNI\n#muerte\n#campoIonico #axiomas\n#cronos #kairos\n#profundidad\n#generacionBisagra\n#tormentaDeCitoquina\n#menteInteractiva\n#variarAngulos #perspectivas\n#delSistemaInmuneDeDefensasAlSistemaInteractivoDeComunicacion.\n(Extraído de\nhttps://t.me/ACenRED/283)",
    "pdfPage": 14
  },
  {
    "num": 24,
    "date": "21.11.2020",
    "dateISO": "2020-11-21",
    "vuelta": null,
    "freq": "326 -38",
    "url": "https://t.me/ACenRED/284",
    "tags": [
      "21",
      "12",
      "eventoAstronomico",
      "jupiterSaturno",
      "orbital5y6",
      "ordenPsiquico",
      "ordenParticular",
      "ordenPsicologico",
      "psique",
      "nivelAtomico",
      "escalaAnatomica",
      "escalaSubatomica",
      "interlector",
      "captación",
      "anticipación",
      "global",
      "particular",
      "funcionesInterescala",
      "base12",
      "exo",
      "calendarioJuliano",
      "Gregoriano",
      "aparato396",
      "graficosEnTranscripcionesAleEnRedTelegram",
      "concienciaMuonica",
      "escalaGravutatoria",
      "concienciaIonica",
      "Lógica",
      "administrador",
      "usuario",
      "determinado",
      "intelecto",
      "copa",
      "ente",
      "mente",
      "conciencia",
      "NoVeNoAñoDeLgc",
      "concienciaInterdimensional",
      "SolAMente",
      "heridaEnLaConciencia",
      "heridaEnElIntelecto",
      "hojaMilimetrada",
      "avance",
      "precisión",
      "alcancePreciso",
      "ADN",
      "ARN",
      "comprensiónOrgánica",
      "entendimiento"
    ],
    "snippet": "vuelta21 (Extraído de",
    "content": "Alejandra Casado\nEN RED 24\n21.11.2020   326 -38\nvuelta21\nTranscripción\n---\n#21 #12#eventoAstronomico\n#jupiterSaturno #orbital5y6\n#ordenPsiquico #ordenParticular\n#ordenPsicologico #psique\n#nivelAtomico #escalaAnatomica\n#escalaSubatomica #interlector\n#captación #anticipación\n#global #particular\n#funcionesInterescala\n#base12 #exo\n#calendarioJuliano\n#Gregoriano #aparato396\n#graficosEnTranscripcionesAleEnRedTelegram\n#concienciaMuonica #escalaGravutatoria\n#concienciaIonica #Lógica\n#administrador #usuario\n#determinado\n#intelecto #copa\n#ente #mente #conciencia\n#NoVeNoAñoDeLgc\n#concienciaInterdimensional\n#SolAMente\n#heridaEnLaConciencia\n#heridaEnElIntelecto\n#hojaMilimetrada #avance\n#precisión\n#alcancePreciso\n#ADN #ARN\n#comprensiónOrgánica\n#entendimiento\n(Extraído de\nhttps://t.me/ACenRED/284)\n",
    "pdfPage": 14
  },
  {
    "num": 25,
    "date": "29.11.2020",
    "dateISO": "2020-11-29",
    "vuelta": 21,
    "freq": "334 -32",
    "url": "https://t.me/ACenRED/297",
    "tags": [
      "noviembre",
      "diciembre",
      "aparato504",
      "aparato505",
      "limites",
      "alcances",
      "autolimite",
      "autocontencion",
      "luzInterna",
      "luzExterna",
      "oscuridad",
      "concienciaEscalar",
      "Noviembre25",
      "Diciembre25",
      "anticipación",
      "universoExpresadoCivilizado",
      "sabiduría",
      "menteInteractiva",
      "obediencia",
      "conciencia",
      "herramientasPrimeroDesafiosDespues",
      "funcionalizacion",
      "puestaEnValorDelRecurso"
    ],
    "snippet": "(Extraído de",
    "content": "Alejandra Casado\nEN RED 25\n29.11.2020   334 -32\nvuelta 21\nTranscripción\n---\n#noviembre #diciembre\n#aparato504\n#aparato505\n#limites #alcances\n#autolimite\n#autocontencion\n#luzInterna #luzExterna\n#oscuridad\n#concienciaEscalar\n#Noviembre25\n#Diciembre25\n#anticipación\n#universoExpresadoCivilizado\n#sabiduría\n#menteInteractiva\n#obediencia #conciencia\n#herramientasPrimeroDesafiosDespues  #funcionalizacion\n#puestaEnValorDelRecurso\n(Extraído de\nhttps://t.me/ACenRED/297)\n",
    "pdfPage": 15
  },
  {
    "num": 26,
    "date": "05.12.2020",
    "dateISO": "2020-12-05",
    "vuelta": 22,
    "freq": "340-26",
    "url": "https://t.me/ACenRED/298",
    "tags": [
      "Diciembre",
      "mes12",
      "L",
      "eleCursiva",
      "ele",
      "mayúscula",
      "minúscula",
      "base12",
      "campoUnificado",
      "alturaPsiquica",
      "autoaceptación",
      "autorrechazo",
      "inteligencia",
      "sabiduría",
      "mes5",
      "mes6",
      "escalaAtomica",
      "escalaAnatomica",
      "engaño",
      "laRealidad",
      "miRealidad",
      "estabilidad",
      "evolución",
      "honestidadConmigoMismo",
      "metricasHonestasTransparentes",
      "finDelAparato505",
      "soy",
      "estoy",
      "disminucionDeLaVelocidad"
    ],
    "snippet": "(Extraído de",
    "content": "Alejandra Casado\nEN RED 26\n05.12.2020   340-26\nvuelta 22\nTranscripción\n---\n#Diciembre #mes12\n#L #eleCursiva #ele\n#mayúscula #minúscula\n#base12\n#campoUnificado\n#alturaPsiquica\n#autoaceptación\n#autorrechazo\n#inteligencia\n#sabiduría\n#mes5 #mes6 #mes12\n#escalaAtomica\n#escalaAnatomica\n#engaño\n#laRealidad #miRealidad\n#estabilidad #evolución\n#honestidadConmigoMismo\n#metricasHonestasTransparentes\n#finDelAparato505\n#soy #estoy\n#disminucionDeLaVelocidad\n(Extraído de\nhttps://t.me/ACenRED/298)",
    "pdfPage": 16
  },
  {
    "num": 27,
    "date": "12.12.2020",
    "dateISO": "2020-12-12",
    "vuelta": 22,
    "freq": "347-19",
    "url": "https://t.me/ACenRED/299",
    "tags": [
      "error",
      "equivocacion",
      "dia366",
      "diaSolar7377773",
      "construcción",
      "constitución",
      "gamas",
      "molecular",
      "atómico",
      "subatomico",
      "limite",
      "alcance",
      "incluir",
      "interlector",
      "menteDeLaTierra",
      "menteDelSol",
      "transferencias",
      "rangos",
      "escalas",
      "base12aUnaNuevaBase12",
      "concienciaSolar",
      "vida",
      "existencia",
      "errorNativo",
      "captación",
      "absorcionIonica",
      "Z27",
      "CG3000",
      "reset",
      "archivosDeLaRealidad",
      "archivosDeLaEspecie",
      "archivosDelHabitante",
      "brotecito",
      "WallyPelicula",
      "nuevaLeyDeFichaLimpiaEn261",
      "madagaskar",
      "andromeda2511"
    ],
    "snippet": "(Extraído de",
    "content": "Alejandra Casado\nEN RED 27\n12.12.2020   347-19\nvuelta 22\nTranscripción\n---\n#error #equivocacion\n#dia366\n#diaSolar7377773\n#construcción\n#constitución\n#gamas #molecular #atómico\n#subatomico\n#limite #alcance\n#incluir\n#interlector\n#menteDeLaTierra\n#menteDelSol\n#transferencias\n#rangos #escalas\n#base12aUnaNuevaBase12\n#concienciaSolar\n#vida #existencia\n#errorNativo\n#captación #absorcionIonica\n#Z27\n#CG3000 #reset\n#archivosDeLaRealidad\n#archivosDeLaEspecie\n#archivosDelHabitante\n#brotecito #WallyPelicula\n#nuevaLeyDeFichaLimpiaEn261\n#madagaskar\n#andromeda2511\n(Extraído de\nhttps://t.me/ACenRED/299)",
    "pdfPage": 17
  },
  {
    "num": 28,
    "date": "20.12.2020",
    "dateISO": "2020-12-20",
    "vuelta": null,
    "freq": "355-11",
    "url": "https://t.me/ACenRED/300",
    "tags": [
      "recreación",
      "añoBisiesto",
      "actualizacionFundante",
      "año",
      "concienciaSolar",
      "febrero29",
      "añoSecular",
      "dias1460",
      "año2100",
      "interlector",
      "peliculaMatrix",
      "fragmentar",
      "anilloDeFuego",
      "axiomaDeLasDistintasEscalas",
      "dia366",
      "espacio",
      "tresSieteTres373",
      "noviembre25",
      "diciembre25",
      "nuevaBase12",
      "contención",
      "calma"
    ],
    "snippet": "Anillo de Fuego (Extraído de",
    "content": "Alejandra Casado\nEN RED 28\n20.12.2020   355-11\nAnillo de Fuego\nTranscripción\n---\n#recreación\n#añoBisiesto\n#actualizacionFundante\n#año\n#concienciaSolar\n#febrero29\n#añoSecular\n#dias1460\n#año2100\n#interlector\n#peliculaMatrix\n#fragmentar\n#anilloDeFuego\n#axiomaDeLasDistintasEscalas\n#dia366\n#espacio\n#tresSieteTres373\n#noviembre25\n#diciembre25\n#nuevaBase12\n#contención\n#calma\n(Extraído de\nhttps://t.me/ACenRED/300)\n",
    "pdfPage": 17
  },
  {
    "num": 29,
    "date": "27.12.2020",
    "dateISO": "2020-12-27",
    "vuelta": null,
    "freq": "362-4",
    "url": "https://t.me/ACenRED/301",
    "tags": [
      "aparato505",
      "quintaEtapa1582",
      "concienciaIntercalar",
      "calendarioJuliano",
      "calendarioGregoriano",
      "modelo",
      "saltoDeUnModeloAOtro",
      "mecanicaDelError",
      "aparato396",
      "anticipación",
      "aparatoPsiquico10dias",
      "matrixPelicula",
      "añoSecular1900",
      "precariota",
      "procariota",
      "eucariota",
      "china86",
      "elástico",
      "sudafrica27",
      "Ushuaia",
      "élite",
      "salaDeHuespedes",
      "modelosExtranjeros",
      "autoDeterminacion",
      "ARN",
      "virus",
      "gama",
      "escala",
      "renglón",
      "reyes",
      "eyes",
      "rojos",
      "ojos",
      "finDelLoop",
      "secuenciacion",
      "defecto",
      "virtud",
      "obviedad",
      "evidencia"
    ],
    "snippet": "Anillo de Fuego (Extraído de",
    "content": "Alejandra Casado\nEN RED 29\n27.12.2020   362-4\nAnillo de Fuego\nTranscripción\n---\n#aparato505\n#quintaEtapa1582\n#concienciaIntercalar\n#calendarioJuliano\n#calendarioGregoriano\n#modelo\n#saltoDeUnModeloAOtro\n#mecanicaDelError\n#aparato396\n#anticipación\n#aparatoPsiquico10dias\n#matrixPelicula\n#añoSecular1900\n#precariota #procariota\n#eucariota\n#china86\n#elástico\n#sudafrica27 #Ushuaia\n#élite\n#salaDeHuespedes\n#modelosExtranjeros\n#autoDeterminacion\n#ARN #virus\n#gama #escala #renglón\n#reyes #eyes\n#rojos #ojos\n#finDelLoop\n#secuenciacion\n#defecto #virtud\n#obviedad #evidencia\n(Extraído de\nhttps://t.me/ACenRED/301)\n",
    "pdfPage": 18
  },
  {
    "num": 30,
    "date": "",
    "dateISO": "",
    "vuelta": 1,
    "freq": "",
    "url": "https://t.me/ACenRED/302",
    "tags": [
      "año2021",
      "añoAsume",
      "desarrollo",
      "arrollado",
      "escala",
      "escalabilidad",
      "interescala",
      "escalaPsiquica504",
      "escalaPsicologica505",
      "escalaOrganica506",
      "cambiosEnLasPautas",
      "derechosHumanos",
      "restricciones",
      "instinto",
      "reaccion",
      "intuición",
      "reflexion",
      "codigo500",
      "Malvinas",
      "Wernike",
      "Broca",
      "autorrechazo",
      "autoaceptacion",
      "aprovechamiento",
      "modoAprendizaje",
      "inteligencia",
      "sabiduría",
      "aparatoPsiquico",
      "contexto",
      "aspectoDefectuoso",
      "aspectoVirtuoso",
      "treinta30",
      "tresmiltres3003"
    ],
    "snippet": "02. 01. 2021 2 - 363 (Extraído de",
    "content": "Alejandra Casado\nEN RED 30\n02. 01. 2021   2 - 363\nvuelta 1\nTranscripción\n---\n#año2021\n#añoAsume\n#desarrollo #arrollado\n#escala #escalabilidad\n#interescala\n#escalaPsiquica504\n#escalaPsicologica505\n#escalaOrganica506\n#cambiosEnLasPautas\n#derechosHumanos\n#restricciones\n#instinto #reaccion\n#intuición #reflexion\n#codigo500 #Malvinas\n#Wernike #Broca\n#autorrechazo\n#autoaceptacion\n#aprovechamiento\n#modoAprendizaje\n#inteligencia #sabiduría\n#aparatoPsiquico\n#contexto\n#aspectoDefectuoso\n#aspectoVirtuoso\n#treinta30\n#tresmiltres3003\n(Extraído de\nhttps://t.me/ACenRED/302)",
    "pdfPage": 19
  },
  {
    "num": 31,
    "date": "",
    "dateISO": "",
    "vuelta": 1,
    "freq": "",
    "url": "https://t.me/ACenRED/303",
    "tags": [
      "emisión",
      "absorcion",
      "evolucionDelSol",
      "altaFrecuencia",
      "bajaFrecuencia",
      "desarrolloDelAlcanceEn2021",
      "limite",
      "elásticoLaxo",
      "inconcienteBiologico",
      "modoFallo",
      "añoSecular1460dias",
      "aprendizaje",
      "conciencia",
      "segmento1900a2100",
      "palabrasComoCodigos",
      "fabricarTiempo",
      "tiempoLento",
      "presente",
      "pasado",
      "futuro",
      "desaceleracion",
      "fracción",
      "totalidad",
      "funcion2012Lector",
      "funcion2021Escritor",
      "desafioColectivo",
      "identidadColectiva",
      "bienComun",
      "enseñar",
      "aprender",
      "envidia",
      "admiración",
      "salvatajeDeLaEspecieHumana"
    ],
    "snippet": "09/01/2021 9 - 356 (Extraído de",
    "content": "Alejandra Casado\nEN RED 31\n09/01/2021   9 - 356\nvuelta 1\nTranscripción\n---\n#emisión #absorcion\n#evolucionDelSol\n#altaFrecuencia\n#bajaFrecuencia\n#desarrolloDelAlcanceEn2021\n#limite #elásticoLaxo\n#inconcienteBiologico\n#modoFallo\n#añoSecular1460dias\n#aprendizaje #conciencia\n#segmento1900a2100\n#palabrasComoCodigos\n#fabricarTiempo #tiempoLento\n#presente #pasado #futuro\n#desaceleracion\n#fracción #totalidad\n#funcion2012Lector\n#funcion2021Escritor\n#desafioColectivo\n#identidadColectiva\n#bienComun\n#enseñar #aprender\n#envidia #admiración\n#salvatajeDeLaEspecieHumana\n(Extraído de\nhttps://t.me/ACenRED/303)",
    "pdfPage": 20
  },
  {
    "num": 32,
    "date": "",
    "dateISO": "",
    "vuelta": 1,
    "freq": "",
    "url": "https://t.me/ACenRED/304",
    "tags": [
      "base12",
      "base16",
      "tercerOrbital",
      "modelo4x4",
      "conciencia4",
      "procesamiento3",
      "izquierda",
      "crearEspacio",
      "concienciaDeNuestraPercepcion",
      "constituidos",
      "constituyentes",
      "calendaria",
      "pertenenciaAlSistemaSolar",
      "captores",
      "mentalidad",
      "mente",
      "menteDeLaEspecie",
      "espejoNegro",
      "blackMirror",
      "actualizacionDeLaConciencia",
      "campoIonico",
      "error",
      "equivocación",
      "bases",
      "elite",
      "restricciones",
      "construccionDeLaVerdad"
    ],
    "snippet": "16/01/2021 16 - 349 (Extraído de",
    "content": "Alejandra Casado\nEN RED 32\n16/01/2021   16 - 349\nvuelta 1\nTranscripción\n---\n#base12 #base16\n#tercerOrbital\n#modelo4x4\n#conciencia4\n#procesamiento3\n#izquierda #crearEspacio\n#concienciaDeNuestraPercepcion\n#constituidos #constituyentes\n#calendaria\n#pertenenciaAlSistemaSolar\n#captores\n#mentalidad #mente\n#menteDeLaEspecie\n#espejoNegro\n#blackMirror\n#actualizacionDeLaConciencia\n#campoIonico\n#error #equivocación\n#bases #elite\n#restricciones\n#construccionDeLaVerdad\n(Extraído de\nhttps://t.me/ACenRED/304)\n",
    "pdfPage": 20
  },
  {
    "num": 33,
    "date": "",
    "dateISO": "",
    "vuelta": 2,
    "freq": "",
    "url": "https://t.me/ACenRED/305",
    "tags": [
      "estabilidad",
      "diagramacion4x4",
      "configuracionBasica3",
      "cienciaDura",
      "cienciaFlexible",
      "mente",
      "cerebro",
      "conciencia",
      "SistemaSolar",
      "anticipación",
      "interferencia",
      "año",
      "madurez",
      "matriz",
      "calendaria",
      "concienciaEncriptada",
      "anatomiaPsiquica",
      "profundo",
      "superficial",
      "dolor",
      "ancla",
      "boya",
      "año2024",
      "frecuencia39",
      "Monza",
      "frecuencia78",
      "aberración",
      "espacioLogicoLaEscuelita",
      "humanosConstituyentes",
      "aprendizaje",
      "carga",
      "habitarElEspacio",
      "yacerEnElEspacio",
      "constituido",
      "constituyente",
      "modulacion",
      "pasado",
      "presente",
      "futuro",
      "menteConectiva"
    ],
    "snippet": "23/01/2021 23 - 342 (Extraído de",
    "content": "Alejandra Casado\nEN RED 33\n23/01/2021   23 - 342\nvuelta 2\nTranscripción\n---\n#estabilidad\n#diagramacion4x4\n#configuracionBasica3\n#cienciaDura #cienciaFlexible\n#mente #cerebro #conciencia\n#SistemaSolar #anticipación\n#interferencia\n#año #madurez #matriz\n#calendaria\n#concienciaEncriptada\n#anatomiaPsiquica\n#profundo  #superficial\n#dolor\n#ancla  #boya #año2024\n#frecuencia39  #Monza\n#frecuencia78\n#aberración\n#espacioLogicoLaEscuelita\n#humanosConstituyentes\n#aprendizaje  #carga\n#habitarElEspacio #yacerEnElEspacio\n#constituido #constituyente\n#modulacion\n#pasado #presente #futuro\n#menteConectiva\n(Extraído de\nhttps://t.me/ACenRED/305)\n",
    "pdfPage": 21
  },
  {
    "num": 34,
    "date": "",
    "dateISO": "",
    "vuelta": 2,
    "freq": "",
    "url": "https://t.me/ACenRED",
    "tags": [
      "sistemaEstable",
      "actualizaciones",
      "autorreferencia",
      "puente",
      "concienciaDelEspacio",
      "matrizar",
      "prototipos",
      "factorCreacion",
      "criatura",
      "coherencia",
      "cohesión",
      "Realidad",
      "creaciones",
      "creer",
      "crear",
      "comprensión",
      "contención",
      "función",
      "avanceLento",
      "Aparato506",
      "costaRica506",
      "carreta",
      "analógico",
      "digital",
      "potencial",
      "potencia",
      "anclaGravitatoria",
      "base30",
      "base12y21",
      "seudoCiencia",
      "nativo",
      "foráneo",
      "especie",
      "tecnología",
      "conexiónSideral",
      "a79añosdel2100",
      "concienciasEstables",
      "cinismo",
      "mentePerversa",
      "engaño",
      "daño",
      "funciónPer"
    ],
    "snippet": "30/01/2021 30 -335 (extraído dehttps://t.me/ACenRED)",
    "content": "Alejandra Casado\nEN RED 34\n30/01/2021   30 -335\nvuelta 2\nTranscripción\n---\n#sistemaEstable #actualizaciones\n#autorreferencia\n#puente\n#concienciaDelEspacio\n#matrizar\n#prototipos #factorCreacion\n#criatura\n#coherencia #cohesión\n#Realidad\n#creaciones #creer #crear\n#comprensión #contención\n#función\n#avanceLento #Aparato506\n#costaRica506 #carreta\n#analógico #digital\n#potencial #potencia\n#anclaGravitatoria\n#base30 #base12y21\n#seudoCiencia\n#nativo #foráneo #especie\n#tecnología\n#conexiónSideral\n#a79añosdel2100\n#concienciasEstables\n#cinismo #mentePerversa\n#engaño #daño\n#funciónPer\n(extraído dehttps://t.me/ACenRED)",
    "pdfPage": 22
  },
  {
    "num": 35,
    "date": "06.02.2021",
    "dateISO": "2021-02-06",
    "vuelta": 3,
    "freq": "37 -328",
    "url": "https://t.me/ACenRED",
    "tags": [
      "dia37",
      "matrizado",
      "el73",
      "especie",
      "año2028",
      "aparato507",
      "concienciasTemporales",
      "TierraConcienciaEspacial",
      "configuracionEspacioTemporal",
      "continente",
      "contenido",
      "sistemaDeIntercomunicaciones",
      "pseudociencia",
      "humano",
      "inhumano",
      "parametro21",
      "net",
      "ionico",
      "muonico",
      "axioma",
      "lema",
      "cerebro",
      "tresPsiquis",
      "menteConcreta",
      "energía",
      "transferenciaDeUnaMenteAOtra",
      "concienciaAMenteDescribe",
      "menteAConcienciaEncripta",
      "mineral",
      "vegetal",
      "animal",
      "superhumano",
      "Sheldrake",
      "eraAnalogica",
      "eraDigital",
      "astrología",
      "Jupiter",
      "Marte",
      "Amarte",
      "inconcienteBiologico",
      "fundacion",
      "función",
      "existencia",
      "noExistencia",
      "psiquismo",
      "SistemaSolar"
    ],
    "snippet": "(extraído dehttps://t.me/ACenRED)",
    "content": "Alejandra Casado\nEN RED 35\n06.02.2021   37 -328\nvuelta 3\nTranscripción\n---\n#dia37  #matrizado  #el73\n#especie  #año2028\n#aparato507\n#concienciasTemporales\n#TierraConcienciaEspacial\n#configuracionEspacioTemporal\n#continente #contenido\n#sistemaDeIntercomunicaciones\n#pseudociencia\n#humano #inhumano\n#parametro21  #net\n#ionico #muonico\n#axioma #lema\n#cerebro #tresPsiquis\n#menteConcreta\n#energía #transferenciaDeUnaMenteAOtra\n#concienciaAMenteDescribe\n#menteAConcienciaEncripta\n#mineral #vegetal #animal\n#humano #superhumano\n#Sheldrake\n#eraAnalogica #eraDigital\n#astrología #Jupiter #Marte\n#Amarte\n#inconcienteBiologico\n#fundacion #función\n#existencia #noExistencia\n#psiquismo\n#SistemaSolar\n(extraído dehttps://t.me/ACenRED)\n",
    "pdfPage": 22
  },
  {
    "num": 36,
    "date": "",
    "dateISO": "",
    "vuelta": 3,
    "freq": "",
    "url": "",
    "tags": [
      "Introducción",
      "Lety2",
      "AleEnRed36",
      "Indice36",
      "Febrero13De2021",
      "Vuelta3",
      "Cuarentena79",
      "MasMatricesMasInstrumentosDisponibles",
      "ConcienciaETMenteET",
      "EraTecnologica",
      "ResetColectivo",
      "Al2100Faltan79Años",
      "SistemaAutoinmune",
      "IdentidadMolecularIdentidadAnatomica",
      "YoPasadoYoPresenteYoFuturo",
      "AxiomaConcienciaAxiomaMente",
      "ConcienciaEnOrigenConcienciaEnDestino",
      "IdentidadGeneticaEspecie",
      "AxiomaYoPasadoFuncionamientoDeAncla",
      "AxiomaYoPresente",
      "AxiomaYoFuturo",
      "AxesamosConcienciaTierraMenteTierra",
      "AxiomaDefectoVirtud",
      "NavegabilidadDelMerito",
      "AutoRechazo",
      "AxiomaCriterioDelEspacioTiempo",
      "InstrumentosComplementarios",
      "QuimicaDelRechazoYAnsiedad",
      "LectoresBiologicos",
      "ElFuturoEsDeLaTierra",
      "MiYoFuturoPerteneceAlMejorFuturoDeLaTierra",
      "AxiomaticamenteParametrizado",
      "RealidadGranReguladora",
      "ElIncrementoEsParticular",
      "reciduosDeLaEraPasada",
      "ConcienciaYMenteConfiguranUnSistema",
      "RechazoAlOtroDescribeAUnoMismo"
    ],
    "snippet": "13/02/2021 44 -321 0002DiasDeVida #Cuarentena79 #MasMatricesMasInstrumentosDisponibles",
    "content": "AlejandraCasadoENRED 36\n13/02/2021   44 -321\nvuelta 3\nTranscripción\n#Introducción #Lety2#AleEnRed36\n#Indice36\n#Febrero13De2021\n#Vuelta3\n0002DiasDeVida #Cuarentena79 #MasMatricesMasInstrumentosDisponibles\n#ConcienciaETMenteET #EraTecnologica #ResetColectivo #Al2100Faltan79Años\n#SistemaAutoinmune #IdentidadMolecularIdentidadAnatomica\n#YoPasadoYoPresenteYoFuturo  #AxiomaConcienciaAxiomaMente\n#ConcienciaEnOrigenConcienciaEnDestino #IdentidadGeneticaEspecie\n#AxiomaYoPasadoFuncionamientoDeAncla #AxiomaYoPresente #AxiomaYoFuturo\n#AxesamosConcienciaTierraMenteTierra #AxiomaDefectoVirtud\n#NavegabilidadDelMerito #AutoRechazo #AxiomaCriterioDelEspacioTiempo\n#InstrumentosComplementarios #QuimicaDelRechazoYAnsiedad #LectoresBiologicos\n#ElFuturoEsDeLaTierra #MiYoFuturoPerteneceAlMejorFuturoDeLaTierra\n#AxiomaticamenteParametrizado #RealidadGranReguladora #ElIncrementoEsParticular\n#reciduosDeLaEraPasada #ConcienciaYMenteConfiguranUnSistema\n#RechazoAlOtroDescribeAUnoMismo\n",
    "pdfPage": 23
  },
  {
    "num": 37,
    "date": "12.10.2012",
    "dateISO": "2012-10-12",
    "vuelta": 4,
    "freq": "#PrimeraDerivacionCG",
    "url": "",
    "tags": [
      "AleEnRed37",
      "Indice37",
      "Febrero20De2021",
      "Vuelta4",
      "ActualizarYEstabilizar",
      "MatrizCalendaria",
      "VueltasAnueales",
      "CabezaDelAño",
      "CuerpoDelAño",
      "AnilloDeFuego",
      "Vuelta44444",
      "ConstruccionDeCalendaria",
      "FormamosParteNoProtagonistas",
      "EraMistica",
      "EraDigital",
      "PrimeraDerivacionCG12",
      "FormamosParteNoSomosProtagonistas",
      "AprendizajeIncremento",
      "AreaDeIncrementoDeLaAntena",
      "ReciduosDeLaEraPasada",
      "ConstituidosConstituyentes",
      "Autorrechazo",
      "EraDigitalEraAnalogica",
      "DiferenciaEntreMenteYPsiquismo",
      "DiferenciaEntrePsiqueYpsiquis",
      "AxiomasConRespectoALaExistencia"
    ],
    "snippet": "20/02/2021 51 -314 37.- Ale",
    "content": "AlejandraCasadoENRED 37\n20/02/2021   51 -314\nvuelta 4\nTranscripción\n37.- Ale\nen Red 37 docx\n#AleEnRed37\n#Indice37\n#Febrero20De2021\n#Vuelta4\n#ActualizarYEstabilizar\n#MatrizCalendaria\n#VueltasAnueales\n#CabezaDelAño\n#CuerpoDelAño\n#AnilloDeFuego\n#Vuelta44444\n#ConstruccionDeCalendaria\n#FormamosParteNoProtagonistas\n#EraMistica\n#EraDigital\n#PrimeraDerivacionCG12.10.2012\n#FormamosParteNoSomosProtagonistas\n#AprendizajeIncremento\n#AreaDeIncrementoDeLaAntena\n#ReciduosDeLaEraPasada\n#ConstituidosConstituyentes\n#Autorrechazo\n#EraDigitalEraAnalogica\n#DiferenciaEntreMenteYPsiquismo\n#DiferenciaEntrePsiqueYpsiquis\n#AxiomasConRespectoALaExistencia",
    "pdfPage": 24
  },
  {
    "num": 38,
    "date": "27.02.2021",
    "dateISO": "2021-02-27",
    "vuelta": 4,
    "freq": "58 -307",
    "url": "",
    "tags": [
      "27",
      "Indice38",
      "Vuelta",
      "Día58",
      "AparatoSolar",
      "OportunidadDeExistir",
      "CiclosDeAparato",
      "SistemaSolar",
      "ConcienciaSolar",
      "AdministraciónDelSistema",
      "Incremento",
      "GestiónDelIncremento",
      "MenteDelAparato",
      "Posición58",
      "UnidadDeSentido",
      "AñosYLadrillos",
      "EstructuraTemporal",
      "Frecuencias",
      "SistemaYAdministración",
      "Orbitales",
      "Saturno",
      "SistemaYUsuario",
      "GestiónSolar",
      "AdministraciónAbstracta",
      "Júpiter",
      "Orbital5",
      "Orbital6",
      "VerdadYFe",
      "ConstrucciónDeVerdad",
      "FuncionesYAcciones",
      "ConcienciaYAdministración",
      "PosibilidadesYValor",
      "Octava",
      "IncrementoDeOctava",
      "CrisisDeValores",
      "Interferencia",
      "ReconfiguraciónSolar",
      "AntenaBiológica",
      "GestiónDeIncrementos",
      "Cuadrantes",
      "Neptuno",
      "OrganizaciónSolar",
      "ConcienciaYAdministrador",
      "FallaYValencia",
      "ValorYVerdad",
      "ConstrucciónDeValor",
      "ValenciasYValores",
      "CircuitoDinámico",
      "Abstracción",
      "ObjetoYSujeto",
      "EnteYEntidad",
      "ValenciaYValor",
      "IdentidadAbstracta",
      "ConcienciaAbstracta",
      "ProcesamientoDeValencias",
      "CaptaciónPropia",
      "Mentalidad",
      "MentePrivada",
      "ConstrucciónDeMentalidad",
      "ComunicaciónEntreMentes",
      "CalendarioSolar",
      "Base12",
      "FechaYFlecha",
      "LecturaDeCódigo",
      "LinealYNoLineal",
      "MatrizDeCalendario",
      "EstructuraDeConstrucción",
      "EjesXYZ",
      "ApropiaciónDeEjes",
      "Procariota",
      "Eucariota",
      "Precariota",
      "FunciónRemota",
      "Subjetividad",
      "SujetoYObjeto",
      "SubjetividadYObjetividad",
      "NivelesDeAbstracción",
      "SistemasEscalares",
      "ValoresEnDetrimento",
      "ConcienciaDelSujeto",
      "IdentidadYEntidad",
      "TransformaciónHumana",
      "VirtudYDefecto",
      "UsuariosDeVirtud",
      "EjercicioDelDefecto",
      "MéritoReal",
      "PremioYCastigo",
      "SociedadManipulatoria",
      "TomaDeConciencia",
      "SujetoYConciencia",
      "LoopDeInterferencia",
      "OctavasHumanas",
      "EntidadSolar",
      "EstructurasEspacioTemporales",
      "SistemaSolarHumano",
      "IncrementoDeCaptación",
      "ReconfiguraciónDelSujeto",
      "AmpliaciónDeConciencia",
      "AprendizajeSolar",
      "ConcienciaDeSistema",
      "ProyectoHumanoSolar"
    ],
    "snippet": "38.- Ale",
    "content": "AlejandraCasadoENRED 38\n27.02.2021  58 -307\nvuelta 4\nTranscripción\n38.- Ale\nen Red 38 docx\n#27 de Febrero 2021\n#Indice38 #Vuelta 4\n#Día58 #AparatoSolar #OportunidadDeExistir #CiclosDeAparato\n#SistemaSolar #ConcienciaSolar #AdministraciónDelSistema\n#Incremento #GestiónDelIncremento #MenteDelAparato #Posición58\n#UnidadDeSentido #AñosYLadrillos #EstructuraTemporal #Frecuencias\n#SistemaYAdministración #Orbitales #Saturno #SistemaYUsuario\n#GestiónSolar #AdministraciónAbstracta #Júpiter #Orbital5 #Orbital6\n#VerdadYFe #ConstrucciónDeVerdad #FuncionesYAcciones\n#ConcienciaYAdministración #PosibilidadesYValor #Octava #IncrementoDeOctava\n#CrisisDeValores #Interferencia #ReconfiguraciónSolar #AntenaBiológica\n#GestiónDeIncrementos #Cuadrantes #Neptuno #OrganizaciónSolar\n#ConcienciaYAdministrador #FallaYValencia #ValorYVerdad #ConstrucciónDeValor\n#ValenciasYValores #CircuitoDinámico #Abstracción #ObjetoYSujeto\n#EnteYEntidad #ValenciaYValor #IdentidadAbstracta #ConcienciaAbstracta\n#ProcesamientoDeValencias #CaptaciónPropia #Mentalidad #MentePrivada\n#ConstrucciónDeMentalidad #ComunicaciónEntreMentes #CalendarioSolar\n#Base12 #FechaYFlecha #LecturaDeCódigo #LinealYNoLineal\n#MatrizDeCalendario #EstructuraDeConstrucción #EjesXYZ #ApropiaciónDeEjes\n#Procariota #Eucariota #Precariota #FunciónRemota #Subjetividad\n#SujetoYObjeto #SubjetividadYObjetividad #NivelesDeAbstracción\n#SistemasEscalares #ValoresEnDetrimento #ConcienciaDelSujeto\n#IdentidadYEntidad #TransformaciónHumana #ConcienciaSolar\n#VirtudYDefecto #UsuariosDeVirtud #EjercicioDelDefecto #MéritoReal\n#PremioYCastigo #SociedadManipulatoria #TomaDeConciencia\n#SujetoYConciencia #LoopDeInterferencia #OctavasHumanas\n#EntidadSolar #EstructurasEspacioTemporales #SistemaSolarHumano\n#IncrementoDeCaptación #ReconfiguraciónDelSujeto #AmpliaciónDe",
    "pdfPage": 24
  },
  {
    "num": 39,
    "date": "12.03.2021",
    "dateISO": "2021-03-12",
    "vuelta": 5,
    "freq": "+71-294",
    "url": "",
    "tags": [
      "vuelta5",
      "12marzo2021",
      "día71",
      "somosConcienciasTemporales",
      "espacio71",
      "tiempo81",
      "PuertasDeEnlaceDeLaAntena",
      "siNoTenemosEspacioNoHayComoDeterminarElTiempo",
      "empezamosaConjugarnosConlaConcienciaEspacioSiendoConcienciasTiempo",
      "incrementos",
      "tengoUnProblemaVieneElPasadoYMeLoResuelve",
      "tiempoUnaMemoriaNuevaParaUnMismoEspacio",
      "instintoLecturaDeArchivosColectivos",
      "ELERRORESPERFECTOENSIMISMO",
      "elErrorNoEsMioelErrorEsDelTerritorio",
      "CultivarLaAmistadConLaHonestidad",
      "PuertadeEnlacedelaAntenaEjemploTecnología",
      "laRealidadFuncionaSobreBasesObjetivas",
      "ParadojaTenerChanceDeExpresarERRORESqueHabitamosComoChanceparaModificar",
      "noPodemosEstarAjenosHaciaDondeVaLaComunidadHumana",
      "LaRealidadVaAProcurarDespertarnosOEliminarnos",
      "tengoQuePoderSerPermeableALaMejora",
      "MIEDOMiLógicaEnDO",
      "MatrizamosPrototipamosEnCiclosDe16díasComoGimnasiaEvolucionamosYNosvolve",
      "noHayNadaMásPerfectoQueUnERROR",
      "noVoyAPoderUsarElCuadernoDelCompañero",
      "emisión39terminandoCuarentena79",
      "unaCreaciónBinaria10ArribaDelEspacio71EsElTiempo81",
      "yoSoyComoSujetoUnaConcienciaTemporal",
      "cambiaLaFrecuenciadeALEenREDqueSaldráCada15días"
    ],
    "snippet": "39.-Ale los mosEstables",
    "content": "AlejandraCasadoENRED 39\n12.03.2021  +71-294\nvuelta 5\nTranscripción\n39.-Ale\nen Red 39\n#vuelta5\n#12marzo2021\n#día71\n#somosConcienciasTemporales\n#espacio71\n#tiempo81\n#PuertasDeEnlaceDeLaAntena\n#siNoTenemosEspacioNoHayComoDeterminarElTiempo\n#empezamosaConjugarnosConlaConcienciaEspacioSiendoConcienciasTiempo\n#incrementos\n#tengoUnProblemaVieneElPasadoYMeLoResuelve\n#tiempoUnaMemoriaNuevaParaUnMismoEspacio\n#instintoLecturaDeArchivosColectivos\n#ELERRORESPERFECTOENSIMISMO\n#elErrorNoEsMioelErrorEsDelTerritorio\n#CultivarLaAmistadConLaHonestidad\n#PuertadeEnlacedelaAntenaEjemploTecnología\n#laRealidadFuncionaSobreBasesObjetivas\n#ParadojaTenerChanceDeExpresarERRORESqueHabitamosComoChanceparaModificar\nlos\n#noPodemosEstarAjenosHaciaDondeVaLaComunidadHumana\n#LaRealidadVaAProcurarDespertarnosOEliminarnos\n#tengoQuePoderSerPermeableALaMejora\n#MIEDOMiLógicaEnDO\n#MatrizamosPrototipamosEnCiclosDe16díasComoGimnasiaEvolucionamosYNosvolve\nmosEstables\n#noHayNadaMásPerfectoQueUnERROR\n#noVoyAPoderUsarElCuadernoDelCompañero\n#emisión39terminandoCuarentena79\n#unaCreaciónBinaria10ArribaDelEspacio71EsElTiempo81\n#yoSoyComoSujetoUnaConcienciaTemporal\n#cambiaLaFrecuenciadeALEenREDqueSaldráCada15días\n",
    "pdfPage": 25
  },
  {
    "num": 40,
    "date": "26.03.2021",
    "dateISO": "2021-03-26",
    "vuelta": 6,
    "freq": "+85-280",
    "url": "",
    "tags": [
      "26marzo2021",
      "CG3085",
      "dia85Negativo280",
      "vuelta6",
      "cuarentena80CambioDeEstructura",
      "BarcoEvergreenAtascadoEnElCanaldeSuez",
      "Zeus",
      "día85día88enNE",
      "intercambios5pista8",
      "rectificarNuestrosParametrosdeIntercambio",
      "RadarAntena",
      "distribuye86Consume87",
      "vuelta6SistemicayOperativa",
      "erroresVuelta6ModificanVuelta5",
      "aprendizajeContinuo",
      "unaCreaciónBinaria10ArribaDelEspacio71EsElTiempo81",
      "errorSistemadeNavegacionEspacioTemporal",
      "enMisLimitesFundoMiRadar",
      "enMisAlcancesFundoMiAntena",
      "UniversidadesEnObsolescencia",
      "MisLimitesSonLosAlcancesDeLosOtros",
      "DarmeCuentaDeLoQueNoSe",
      "subrogarseAUnAxioma",
      "lasRestriccionesSonAlcances",
      "usarLas4Cardinalidades",
      "DominioPertenencia",
      "ideaDeAprendizaje",
      "losDiosesPonenElCulo",
      "LaRealidadNosEduca"
    ],
    "snippet": "40.- Ale",
    "content": "AlejandraCasadoENRED 40\n26.03.2021  +85-280\nvuelta 6\nTranscripción\n40.- Ale\nen Red 40\n#26marzo2021\n#CG3085\n#dia85Negativo280\n#vuelta6\n#cuarentena80CambioDeEstructura\n#BarcoEvergreenAtascadoEnElCanaldeSuez\n#Zeus\n#día85día88enNE\n#intercambios5pista8\n#rectificarNuestrosParametrosdeIntercambio\n#RadarAntena\n#distribuye86Consume87\n#vuelta6SistemicayOperativa\n#erroresVuelta6ModificanVuelta5\n#aprendizajeContinuo\n#unaCreaciónBinaria10ArribaDelEspacio71EsElTiempo81\n#errorSistemadeNavegacionEspacioTemporal\n#enMisLimitesFundoMiRadar\n#enMisAlcancesFundoMiAntena\n#UniversidadesEnObsolescencia\n#MisLimitesSonLosAlcancesDeLosOtros\n#DarmeCuentaDeLoQueNoSe\n#subrogarseAUnAxioma\n#lasRestriccionesSonAlcances\n#usarLas4Cardinalidades\n#DominioPertenencia\n#ideaDeAprendizaje\n#losDiosesPonenElCulo\n#LaRealidadNosEduca\n",
    "pdfPage": 26
  },
  {
    "num": 41,
    "date": "",
    "dateISO": "",
    "vuelta": 7,
    "freq": "",
    "url": "",
    "tags": [
      "9abril2021",
      "día99negativo266",
      "Vuelta7",
      "crearCalma",
      "filtrosMembranas",
      "RolDeLaInterferencia",
      "LimpiarFiltros",
      "PoderVerLasFiltraciones",
      "LimitesAlcances",
      "SomosAntenas",
      "TraumadoTraumatizado",
      "intentoDescribirCadaDiaMejor",
      "dioxidoDeCloroDocumentado",
      "laRealidadDiceDesaceleren",
      "tenemosQueDesarrollarElAparatoPsiquico",
      "desarrolloDeLaEspecie",
      "mantenernosEnSituacionDeAprendizaje",
      "concienciaExpandida",
      "fallasFaltas"
    ],
    "snippet": "09/04/2021 +99-266 41.- Ale",
    "content": "AlejandraCasadoenRed 41\n 09/04/2021  +99-266\nvuelta 7\nTranscripción\n41.- Ale\nen Red 41\n#9abril2021\n#día99negativo266\n#Vuelta7\n#crearCalma\n#filtrosMembranas\n#RolDeLaInterferencia\n#LimpiarFiltros\n#PoderVerLasFiltraciones\n#LimitesAlcances\n#SomosAntenas\n#TraumadoTraumatizado\n#intentoDescribirCadaDiaMejor\n#dioxidoDeCloroDocumentado\n#laRealidadDiceDesaceleren\n#tenemosQueDesarrollarElAparatoPsiquico\n#desarrolloDeLaEspecie\n#mantenernosEnSituacionDeAprendizaje\n#concienciaExpandida\n#fallasFaltas",
    "pdfPage": 27
  },
  {
    "num": 42,
    "date": "23.04.2021",
    "dateISO": "2021-04-23",
    "vuelta": 8,
    "freq": "113 -252",
    "url": "",
    "tags": [
      "díaIdiomaEspañol",
      "ÑesNrenovada",
      "nuevomodelo",
      "convergencia",
      "importanciadeVuelta8",
      "día8888deAparatos500",
      "CalendarioSolar",
      "parámetrosVuelta8",
      "SistemadeReferencias",
      "Concienciareescribe",
      "Menterepite",
      "ConciencialeeMente",
      "incremento",
      "OctavaanticipaAñoAsimila",
      "CrecimientoEspacioTemporal",
      "construccióndelaverdad",
      "AlcancesyLímites",
      "En252",
      "administraraAcancesylímites",
      "ProyectosImportantesoUrgentes",
      "AlarmayAlerta",
      "verdadesColectivas",
      "Confusión",
      "Autoreferencia",
      "IdentificarAlcance",
      "Ancla",
      "lasMétricas",
      "Autorechazo",
      "DificultadyFacultad",
      "Autoaceptación",
      "miRelaciónconelEspacioTiempo",
      "Vigencia",
      "MedianoPlazo",
      "LargoPlazo",
      "CapacidadesAdministrativas",
      "Mente",
      "AparatoPsíquico",
      "PasadoFuturoPresente",
      "FallaesHuelladelErrorenContextoSE",
      "ErrorPertenenciaMultidimensional",
      "EstructuraseMuestra",
      "ErrorenSoma",
      "RealidaddeContexto",
      "SEcuadranteCronos",
      "KairosConciencia",
      "Calendaria",
      "SeñalBajaFrecuencia",
      "RealidadInteracción4Díasy12DePausa",
      "Brasil55FuncionaEndógeno",
      "5orbitalAdministraciónSolar",
      "5esPresente",
      "Aparato500",
      "Migrar",
      "ErrorEn5esAncla",
      "Endía39orbital9Actualiza3",
      "Día40AmaneceInterconectado",
      "753ACFundaciónItalia",
      "ItaliayCoronavirus"
    ],
    "snippet": "Ale Indice 42 23/4/2021 Día 113 -252",
    "content": "AlejandraCasadoenRed 42\n23.04.2021  113 -252\nvuelta 8\nTranscripción\nAle\nen Red 42\nIndice 42\n23/4/2021 Día 113 -252\nVuelta 8 Aparato 506\n#díaIdiomaEspañol  #ÑesNrenovada\n#nuevomodelo  #convergencia\n#importanciadeVuelta8\n#día8888deAparatos500  #CalendarioSolar\n#parámetrosVuelta8  #SistemadeReferencias\n#Concienciareescribe  #Menterepite\n#ConciencialeeMente  #incremento\n#OctavaanticipaAñoAsimila\n#CrecimientoEspacioTemporal\n#construccióndelaverdad  #AlcancesyLímites\n#En252  #administraraAcancesylímites\n#ProyectosImportantesoUrgentes  #AlarmayAlerta\n#verdadesColectivas  #Confusión  #Autoreferencia\n#IdentificarAlcance  #Ancla  ##lasMétricas  #Autorechazo\n#DificultadyFacultad  #Autoaceptación\n#miRelaciónconelEspacioTiempo  #Vigencia\n#MedianoPlazo  #LargoPlazo\n#CapacidadesAdministrativas  #Mente\n#AparatoPsíquico   #PasadoFuturoPresente\n#FallaesHuelladelErrorenContextoSE  #ErrorPertenenciaMultidimensional\n#EstructuraseMuestra\n#ErrorenSoma  #RealidaddeContexto\n#SEcuadranteCronos  #KairosConciencia\n#Calendaria  #SeñalBajaFrecuencia  #RealidadInteracción4Díasy12DePausa\n#Brasil55FuncionaEndógeno  #5orbitalAdministraciónSolar\n#5esPresente  #Aparato500  #Migrar  #ErrorEn5esAncla\n#Endía39orbital9Actualiza3  #Día40AmaneceInterconectado\n#753ACFundaciónItalia\n#ItaliayCoronavirus\n",
    "pdfPage": 27
  },
  {
    "num": 43,
    "date": "",
    "dateISO": "",
    "vuelta": 8,
    "freq": "",
    "url": "",
    "tags": [
      "ValordeAdministración",
      "DictámenlaCorte",
      "serPersonaCalificada",
      "CartaAgradecimiento",
      "verEstructurasLógicas",
      "EspacioTiempo",
      "Ap400CualidadPersonal",
      "Ap500CualidadImpersonal",
      "Venezuela57",
      "PadreNuestroaChavez",
      "MenteyLímite",
      "RealidadconOtraIntegridad",
      "CualidadImpersonal",
      "MaduraConcienciaPersonal",
      "34España",
      "ValoraciónenAdministración",
      "AgarreObjetivoaConciencia",
      "5esParámetroMásAbstracto",
      "5taEtapaMayorClaridad",
      "ResolverConflictosconSiquismo",
      "CajaEspacioTemporal",
      "EnNOnoHayCaja",
      "CajaTieneOportunidadDeVida",
      "Detalles",
      "SEmodificado",
      "mejorSOMAbiológicoEnContexto",
      "ConcienciaTieneEntornoEnNoExistencia",
      "AnatomiadialogaConCaja",
      "ResonanciaTemprana",
      "ConvergenciaEstructural",
      "QueEsActualización",
      "EnDistintasCapas",
      "TareasVida",
      "SomaBiológico",
      "Facultades",
      "Interferencia",
      "ActualizaciónConstante",
      "ParámetroImpersonal",
      "ParámetroPersonalFuncionaliza",
      "laBiologíaEsAntena",
      "FuturoEsPsíquicoPasadoEsArchivoPresenteEsUsuario",
      "VersiónAtómicayVersiónAnatómica",
      "BiologíaFalla",
      "PsíquisError",
      "HacerEspacio",
      "TenerProcesadorImpersonal",
      "PsíquisdeLosDemás",
      "Intérprete",
      "Especie",
      "LecturadeCódigo",
      "ImpersonalEsPertenecerALaEspecie",
      "EsColectivo",
      "laCajaEsFormadaPorLos4Angulos",
      "AñoEsExpresiónSolardeTierra",
      "TierraParaTierraEsDía",
      "NosotrosyLaIonosfera",
      "IdiomaEspañol",
      "HabilidadesConConciencia",
      "TodosIncluídos",
      "ConcienciaFundacional",
      "Ancla",
      "Ejemplos",
      "CalificarParaSerHumano"
    ],
    "snippet": "08/05/2021 128 -237 43.- Ale Indice 43",
    "content": "AlejandraCasadoenRed 43\n 08/05/2021  128 -237\nvuelta 8\nTranscripción\n43.- Ale\nen Red 43 docx\nIndice 43\n7/5/2021 Día 127 -238\nVuelta 8 (penúltimo día) Cuarentena 81\n#ValordeAdministración  #DictámenlaCorte  #serPersonaCalificada\n#CartaAgradecimiento  #verEstructurasLógicas\n#EspacioTiempo  #Ap400CualidadPersonal  #Ap500CualidadImpersonal\n#Venezuela57 #PadreNuestroaChavez  #MenteyLímite\n#RealidadconOtraIntegridad\n#CualidadImpersonal   #MaduraConcienciaPersonal\n#34España  #ValoraciónenAdministración  #AgarreObjetivoaConciencia\n#5esParámetroMásAbstracto\n#5taEtapaMayorClaridad  #ResolverConflictosconSiquismo\n#CajaEspacioTemporal  #EnNOnoHayCaja  #CajaTieneOportunidadDeVida  #Detalles\n#SEmodificado  #mejorSOMAbiológicoEnContexto\n#ConcienciaTieneEntornoEnNoExistencia\n#AnatomiadialogaConCaja\n#ResonanciaTemprana  #ConvergenciaEstructural\n#QueEsActualización  #EnDistintasCapas  #TareasVida\n#SomaBiológico  #Facultades  #Interferencia  #ActualizaciónConstante\n#ParámetroImpersonal  #ParámetroPersonalFuncionaliza\n#laBiologíaEsAntena  #FuturoEsPsíquicoPasadoEsArchivoPresenteEsUsuario\n#VersiónAtómicayVersiónAnatómica\n#BiologíaFalla  #PsíquisError  #HacerEspacio\n#TenerProcesadorImpersonal\n#PsíquisdeLosDemás\n#Intérprete  #Especie  #LecturadeCódigo\n#ImpersonalEsPertenecerALaEspecie  #EsColectivo\n#laCajaEsFormadaPorLos4Angulos\n#AñoEsExpresiónSolardeTierra\n#TierraParaTierraEsDía  #NosotrosyLaIonosfera\n#IdiomaEspañol\n#HabilidadesConConciencia  #Especie  #TodosIncluídos\n#ConcienciaFundacional  #Ancla  #Ejemplos\n#CalificarParaSerHumano\n",
    "pdfPage": 28
  },
  {
    "num": 44,
    "date": "",
    "dateISO": "",
    "vuelta": 9,
    "freq": "",
    "url": "",
    "tags": [
      "cumpliendoUnAño",
      "PrimeraEmisiónFue23DeMayo",
      "Hace363Días",
      "RefiereEvento6910EnUnoDeMayo",
      "ÚltimoPublicado",
      "Vuelta9Incremento",
      "V10EsReescribir",
      "V11Reconociendo",
      "despuésMembrana",
      "Vuelta12ComunicaciónConelOtro",
      "CómoCapta",
      "PrimeroCapto",
      "Pasos",
      "esConcienciaEscalar",
      "ComprensiónyCompresión",
      "EntendimientoyMente",
      "ComprensiónyConciencia",
      "LeerdePasadoODeFuturo",
      "ConcienciaAbreEspacios",
      "HacerEspacioDeComprensión",
      "LaMenteDeNE",
      "TrabajaSobreLímites",
      "NosotrosenAlcances",
      "ComprensiónAbstractanoEsFísica",
      "LeerSeñalesBajaFrecuencia",
      "Nose",
      "SubrogarseARealidad",
      "laRealidadAumenta",
      "NOcreaCajas",
      "SOAxiomaNativo",
      "NadayEspacio",
      "EntendimientoNEenNivelPsíquico",
      "AbajolasEscalasOrgánicas",
      "LaDerivaciónDesde2012",
      "DisponibilidadParaqueFluya",
      "NoseMásAbierto",
      "ConcienciaSolaryConcienciaTierra",
      "PsíquisNivelIónico",
      "laVidaAnatómicaGestiona",
      "laVerdadseRomperá",
      "EnelFuturo",
      "paraAumentar",
      "UniversoTransmiteEnBajaFrecuencia",
      "ElmismoCerebroParaMí",
      "ParaLosDemás",
      "ParaLaRealidad",
      "laPsíquisEsComoElSoftware",
      "las3PsíquisProcesanDistintosContenidos",
      "AlcanceyLímite",
      "TomarNotas",
      "Practicar",
      "Reconocer",
      "NoMentirme",
      "laRealidadTieneEntendimientoMayor",
      "SacarDelArchivo",
      "enPrecariotaHayBaseparaFrecuenciaBaja",
      "enEucariotaNoLaHay",
      "laVuelta10EsCreaciónDesdeLaNada",
      "NadaEs0AlgoEs1",
      "PsiquismoTrataConElLímite",
      "ConcienciaTrabajaConAlcance",
      "ReconocerAbstracciones",
      "ConcienciaSO",
      "ConcienciaSE",
      "SOConcienciaConLaRealidad",
      "SEConcienciaConLosDemás",
      "ConcienciaEspacio",
      "ConcienciaTiempo",
      "DesarrollarPsiquismo",
      "TrabajarLimitaciónConAutoaceptación",
      "FUNDOEspaciosPrecariota",
      "FUNCIONALIZOProcariota",
      "FUNCIONOEucariota",
      "enPrecariotaAumentoMiConciencia",
      "DespuésFuncionalizo",
      "DespuésFunciono"
    ],
    "snippet": "21/05/2021 141 -224 44.- Ale en Red 44docx Indice 44",
    "content": "AlejandraCasadoenRed 44\n21/05/2021  141 -224\nvuelta 9\nTranscripción\n44.- Ale en Red 44docx\nIndice 44\n21/5/2021 Día 141 -224 (Lógica del Contexto)\nVuelta 9 Cuarentena 82\n#cumpliendoUnAño  #PrimeraEmisiónFue23DeMayo  #Hace363Días\n#RefiereEvento6910EnUnoDeMayo  #ÚltimoPublicado\n#Vuelta9Incremento  #V10EsReescribir  #V11Reconociendo  #despuésMembrana\n#Vuelta12ComunicaciónConelOtro  #CómoCapta\n#PrimeroCapto  #Pasos  #esConcienciaEscalar\n#ComprensiónyCompresión\n#EntendimientoyMente  #ComprensiónyConciencia\n#LeerdePasadoODeFuturo\n#ConcienciaAbreEspacios  #HacerEspacioDeComprensión\n#LaMenteDeNE  #TrabajaSobreLímites  #NosotrosenAlcances\n#ComprensiónAbstractanoEsFísica\n#LeerSeñalesBajaFrecuencia  #Nose  #SubrogarseARealidad\n#laRealidadAumenta  #Nose\n#NOcreaCajas  #SOAxiomaNativo  #NadayEspacio\n#EntendimientoNEenNivelPsíquico  #AbajolasEscalasOrgánicas\n#LaDerivaciónDesde2012 #DisponibilidadParaqueFluya\n#NoseMásAbierto\n#ConcienciaSolaryConcienciaTierra\n#PsíquisNivelIónico  #laVidaAnatómicaGestiona\n#laVerdadseRomperá   #EnelFuturo  #paraAumentar\n#UniversoTransmiteEnBajaFrecuencia\n#ElmismoCerebroParaMí  #ParaLosDemás  #ParaLaRealidad\n#laPsíquisEsComoElSoftware\n#las3PsíquisProcesanDistintosContenidos\n#AlcanceyLímite  #TomarNotas  #Practicar  #Reconocer  #NoMentirme\n#laRealidadTieneEntendimientoMayor  #SacarDelArchivo\n#enPrecariotaHayBaseparaFrecuenciaBaja  #enEucariotaNoLaHay\n#laVuelta10EsCreaciónDesdeLaNada  #NadaEs0AlgoEs1\n#PsiquismoTrataConElLímite  #ConcienciaTrabajaConAlcance\n#ReconocerAbstracciones\n#ConcienciaSO  #ConcienciaSE\n#SOConcienciaConLaRealidad  #SEConcienciaConLosDemás\n#ConcienciaEspacio  #ConcienciaTiempo\n#DesarrollarPsiquismo\n#TrabajarLimitaciónConAutoaceptación\n#FUNDOEspaciosPrecariota  #FUNCIONALIZOProcariota   #FUNCIONOEucariota\n#enPrecariotaAumentoMiConciencia  ",
    "pdfPage": 29
  },
  {
    "num": 45,
    "date": "",
    "dateISO": "",
    "vuelta": 10,
    "freq": "",
    "url": "",
    "tags": [
      "AleEnRed45",
      "indice45",
      "4dejunio2021",
      "vuelta10",
      "autorreferencia",
      "espaciotemporal",
      "humano",
      "prototipo",
      "vacuna",
      "autodeterminacion",
      "argumento",
      "miedo",
      "estabilidadpsiquica",
      "creacionbinaria",
      "aprenderVersionesSistemasolar",
      "niñosytecnologiasolucion",
      "quesonAbstracciones",
      "comprension3entornohumano",
      "explorarconciencia",
      "autoreflexion",
      "coherencia",
      "grieta"
    ],
    "snippet": "04/06/2021 155 -210",
    "content": "AlejandraCasadoenRed 45\n04/06/2021  155 -210\nvuelta 10\nTranscripción\n#AleEnRed45\n#indice45\n#4dejunio2021\n#vuelta10\n#autorreferencia#espaciotemporal\n#humano#prototipo#vacuna\n#autodeterminacion#argumento\n#miedo#estabilidadpsiquica#argumento\n#vuelta10#creacionbinaria\n#aprenderVersionesSistemasolar\n#niñosytecnologiasolucion\n#quesonAbstracciones\n#comprension3entornohumano\n#explorarconciencia#autoreflexion\n#coherencia#grieta",
    "pdfPage": 30
  },
  {
    "num": 46,
    "date": "",
    "dateISO": "",
    "vuelta": 11,
    "freq": "",
    "url": "",
    "tags": [
      "Aleenred46",
      "indice46",
      "18dejunio2021",
      "vuelta11",
      "18",
      "observadorobservado",
      "1775quintaetapa",
      "funcionper",
      "paradoja",
      "169",
      "fronteradeldiseño",
      "46",
      "vuelta12",
      "177receptorparalaconciencia",
      "humanocualidad",
      "absolutaparticular",
      "juicioautodeterminacion",
      "confianzadela",
      "a",
      "meditar",
      "psiquismo",
      "defecto",
      "virtud",
      "ancla",
      "certeza",
      "cuarentena82",
      "inversion"
    ],
    "snippet": "18/06/2021 169 -196",
    "content": "AlejandraCasadoenRed 46\n18/06/2021  169 -196\nvuelta 11\nTranscripción\n#Aleenred46\n#indice46\n#18dejunio2021\n#vuelta11\n#18-6cuadrantehumanologica#observadorobservado\n#1775quintaetapa#funcionper\n#paradoja#169\n#fronteradeldiseño#46\n#vuelta12#177receptorparalaconciencia\n#humanocualidad#absolutaparticular\n#juicioautodeterminacion\n#confianzadela#a-z\n#meditar\n#psiquismo\n#defecto#virtud\n#ancla\n#certeza\n#cuarentena82\n#vuelta11\n#inversion\n",
    "pdfPage": 30
  },
  {
    "num": 47,
    "date": "03.07.2021",
    "dateISO": "2021-07-03",
    "vuelta": 12,
    "freq": "184 -181",
    "url": "",
    "tags": [
      "Aleenred47",
      "indice47",
      "3dejuliode2021",
      "vuelta12",
      "biologiaencaja",
      "escucha",
      "captacion",
      "anticiparse",
      "anguloderesolucion",
      "recalibracion",
      "vuelta12alcanceylimite",
      "vuelta1ala11estabilidad",
      "vuelta12a21actualizaciondomestica",
      "anillodefuegoactualizacion",
      "reconocimientopoderjudicial",
      "errorcomoprototipoespaciotemporal",
      "concienciaespacioderesolucion",
      "codigonativo",
      "errorestructural",
      "alcancedefecto",
      "limitevirtud",
      "somacuerpobiologia",
      "lenguajeinclusivoenlarealidad",
      "trabajarenautorreferenciaconectoconlarealidad",
      "enlaceparticularrealidad",
      "socialautoreferencia",
      "nopuedoincluiranadiasinotengoautorreferencia",
      "sinautoreferenciatellenasdeestres",
      "ego",
      "desarrolloinhumanohabilidad",
      "desarrollohumanolimitacion",
      "interacionesdinamicasdentrodelacajaespaciotemporal",
      "menteenconstruccion",
      "confianzaenlarealidad"
    ],
    "snippet": "Aleenred47, indice47, 3dejuliode2021, vuelta12, biologiaencaja, escucha, captacion, anticiparse",
    "content": "AlejandraCasadoenRed 47\n03.07.2021  184 -181\nvuelta 12\nTranscripción\n#Aleenred47\n#indice47\n#3dejuliode2021\n#vuelta12\n#biologiaencaja\n#escucha#captacion#anticiparse\n#anguloderesolucion#recalibracion\n#vuelta12alcanceylimite\n#vuelta1ala11estabilidad\n#vuelta12a21actualizaciondomestica\n#anillodefuegoactualizacion\n#reconocimientopoderjudicial\n#errorcomoprototipoespaciotemporal\n#concienciaespacioderesolucion\n#codigonativo#errorestructural\n#alcancedefecto#limitevirtud\n#somacuerpobiologia\n#lenguajeinclusivoenlarealidad\n#trabajarenautorreferenciaconectoconlarealidad\n#enlaceparticularrealidad#socialautoreferencia\n#nopuedoincluiranadiasinotengoautorreferencia\n#sinautoreferenciatellenasdeestres\n#ego\n#desarrolloinhumanohabilidad\n#desarrollohumanolimitacion\n#interacionesdinamicasdentrodelacajaespaciotemporal\n#menteenconstruccion\n#confianzaenlarealidad\n",
    "pdfPage": 31
  },
  {
    "num": 48,
    "date": "",
    "dateISO": "",
    "vuelta": 13,
    "freq": "",
    "url": "",
    "tags": [
      "AleEnRed48",
      "indice48",
      "16Julio2021",
      "vuelta13",
      "conflicto",
      "conflictoEnElTerritorio",
      "zonaLimite",
      "lecturaAxiomatica",
      "logicaGravitatoria",
      "logicaDeLaTierra",
      "clima",
      "Ego",
      "Geo",
      "logicaGeo",
      "perspectivaGeo",
      "mentalidadGeo",
      "letraE",
      "antena",
      "23",
      "cardinalidades",
      "decodificar",
      "observador",
      "identidadColectiva",
      "ciego",
      "5taEtapa",
      "quintaEtapa",
      "5taDimension",
      "4taEtapa",
      "cuartaEtapa",
      "etapa",
      "etapasDeLaVidaSobreLaTierra",
      "axiomatizar",
      "realidad",
      "49",
      "tumi",
      "mente",
      "documetarFalla",
      "documentar",
      "notar",
      "destino",
      "desitnos",
      "proposito",
      "entorno",
      "reinterpretarArchivos",
      "capitalizar",
      "error",
      "lineaDeKarman",
      "karma",
      "ionosfera",
      "atmosfera",
      "vuelta2",
      "calendaria",
      "vuelta14",
      "vuelta15",
      "cuarentena83",
      "83"
    ],
    "snippet": "16/07/2021 197 -168",
    "content": "AlejandraCasadoenRed 48\n16/07/2021  197 -168\nvuelta 13\nTranscripción\n#AleEnRed48\n#indice48\n#16Julio2021\n#vuelta13\n#conflicto #conflictoEnElTerritorio\n#zonaLimite\n#lecturaAxiomatica\n#logicaGravitatoria #logicaDeLaTierra\n#clima\n#Ego #ego #Geo  #geo #logicaGeo\n#perspectivaGeo\n#mentalidadGeo\n#letraE\n#antena #23-32\n#cardinalidades\n#decodificar\n#observador\n#identidadColectiva\n#ciego\n#5taEtapa #quintaEtapa #5taDimension\n#4taEtapa #cuartaEtapa\n#etapa #etapasDeLaVidaSobreLaTierra\n#axiomatizar\n#realidad   #Realidad\n#49\n#tumi\n#mente\n#documetarFalla #documentar #notar\n#identidadColectiva\n#destino #desitnos #proposito\n#entorno\n#reinterpretarArchivos #capitalizar\n#error\n#lineaDeKarman #karma\n#ionosfera #atmosfera\n#vuelta13  #vuelta2\n#calendaria\n#vuelta14 #vuelta15\n#cuarentena83  #83",
    "pdfPage": 32
  },
  {
    "num": 49,
    "date": "",
    "dateISO": "",
    "vuelta": 14,
    "freq": "",
    "url": "",
    "tags": [
      "AleEnRed49",
      "indice49",
      "30Julio2021",
      "vuelta14",
      "Peru",
      "vacunacion",
      "vacunas",
      "conectividad",
      "dolor",
      "arraigo",
      "realidad",
      "licenciaDeIgnorancia",
      "licenciaDeInterpreteDeLaRealidad",
      "coherencia",
      "mejorarLaDescripcion",
      "Octava",
      "octavas",
      "cardinalidades",
      "calendaria",
      "aparatoPsiquico",
      "alcance",
      "limite",
      "falla",
      "laFalla",
      "constelacionDeErrores",
      "observadores",
      "vidaReal",
      "imaginacion",
      "origen",
      "destino",
      "sistemaRepresor",
      "conciencia",
      "psiquisConmigoMismo",
      "desdoblamientoPrimario",
      "desdoblamientoSecundario",
      "psiquismo",
      "prototipos",
      "ancla",
      "anclaCruzada",
      "posicionOrigen",
      "posicionDestino",
      "conexionOrigen",
      "secuenciacion",
      "mente",
      "creacionDeLaTarea",
      "trabajoDeAntena",
      "NE",
      "cardinalidadNE",
      "SO",
      "cardinalidadSO"
    ],
    "snippet": "30/07/2021 211 -154",
    "content": "AlejandraCasadoenRed 49\n30/07/2021  211 -154\nvuelta 14\nTranscripción\n#AleEnRed49\n#indice49\n#30Julio2021\n#vuelta14\n#Peru #peru\n#vacunacion #vacunas\n#conectividad #dolor #arraigo\n#realidad\n#licenciaDeIgnorancia\n#licenciaDeInterpreteDeLaRealidad\n#coherencia\n#mejorarLaDescripcion\n#Octava #octavas\n#cardinalidades\n#calendaria\n#aparatoPsiquico\n#alcance #limite\n#falla #laFalla\n#constelacionDeErrores\n#observadores\n#vidaReal #imaginacion\n#origen #destino #sistemaRepresor\n#conciencia\n#psiquisConmigoMismo\n#desdoblamientoPrimario #desdoblamientoSecundario\n#psiquismo\n#prototipos\n#ancla  #anclaCruzada\n#posicionOrigen #posicionDestino\n#conexionOrigen\n#secuenciacion\n#mente\n#creacionDeLaTarea\n#trabajoDeAntena\n#NE #cardinalidadNE\n#SO #cardinalidadSO",
    "pdfPage": 33
  },
  {
    "num": 50,
    "date": "",
    "dateISO": "",
    "vuelta": 15,
    "freq": "",
    "url": "",
    "tags": [
      "AleEnRed50",
      "indice50",
      "13agosto2021",
      "vuelta15",
      "225",
      "AlcidesCarrion",
      "antena",
      "5deOctubre",
      "cincoDeOctubre",
      "4deOctubre",
      "biologia",
      "soma",
      "cuerpo",
      "preguntaDeLaOctava",
      "vueltasCalendaria",
      "vueltas",
      "calendaria",
      "primerasOnceVueltas",
      "onceVueltas",
      "segundasOnceVueltas",
      "vuelta12",
      "vuelta13",
      "vuelta14",
      "anticipacion",
      "conciencia",
      "elOtroEsOtro",
      "culpa",
      "falla",
      "estricto",
      "rigido",
      "flexible",
      "ambitoPsiquico",
      "geo",
      "laRealidadEduca",
      "realidad",
      "soberbia",
      "humildad",
      "herida",
      "arrepentimiento",
      "mente",
      "lecturaDeFallas",
      "mesianico",
      "mes",
      "año",
      "codigo",
      "traductores",
      "LGC",
      "escuchadoresParaLaRealidad",
      "regulacionDeLaHabilidad",
      "mejora",
      "mejoraViendoLaPropiaFalla",
      "autoaceptacion",
      "anclaCruzada",
      "autorrechazo",
      "victima",
      "victimario",
      "logica",
      "aprendiz",
      "ancla",
      "laPreguntaQueMeConstituye",
      "psiquico",
      "emotivo",
      "mistico",
      "mistiscismo",
      "atomo",
      "incremento",
      "campoIonico",
      "campoMuonico",
      "concienciaParticular",
      "particular",
      "masa",
      "hiroshima",
      "8888"
    ],
    "snippet": "13/08/2021 225 -140",
    "content": "AlejandraCasadoenRed 50\n13/08/2021  225  -140\nvuelta 15\nTranscripción\n#AleEnRed50\n#indice50\n#13agosto2021\n#vuelta15\n#225\n#AlcidesCarrion\n#antena\n#5deOctubre #cincoDeOctubre\n#4deOctubre\n#biologia\n#soma #cuerpo\n#preguntaDeLaOctava\n#vueltasCalendaria #vueltas #calendaria\n#primerasOnceVueltas  #onceVueltas #segundasOnceVueltas\n#vuelta12 #vuelta13 #vuelta14 #vuelta15\n#anticipacion\n#conciencia\n#elOtroEsOtro\n#culpa  #falla\n#antena\n#estricto #rigido #flexible\n#ambitoPsiquico\n#geo #Geo\n#laRealidadEduca  #realidad\n#soberbia #humildad\n#herida\n#falla  #arrepentimiento\n#mente\n#lecturaDeFallas #falla\n#mesianico #mes #año\n#codigo #traductores #LGC\n#escuchadoresParaLaRealidad\n#regulacionDeLaHabilidad\n#mejora #mejoraViendoLaPropiaFalla\n#autoaceptacion\n#anclaCruzada  #autorrechazo\n#victima #victimario #culpa\n#logica\n#aprendiz  #ancla\n#laPreguntaQueMeConstituye\n#psiquico #emotivo\n#mistico #mistiscismo\n#atomo #incremento\n#campoIonico #campoMuonico\n#concienciaParticular #particular\n#masa\n#hiroshima #8888\n",
    "pdfPage": 33
  },
  {
    "num": 51,
    "date": "",
    "dateISO": "",
    "vuelta": 15,
    "freq": "",
    "url": "",
    "tags": [
      "Vuelta15",
      "Cuarentena84",
      "MentalidadPsicologiaPsiquis",
      "Vuelta16Mes9",
      "GeoEgo",
      "EvolucionEspecieRiRo",
      "InteraccionCalificacion",
      "AlmaConcienciaMente",
      "SindromeDios",
      "FuncionPer",
      "27Agosto"
    ],
    "snippet": "27. 08. 2021 239 -126",
    "content": "AlejandraCasadoenRed 51\n27. 08. 2021  239  -126\nvuelta 15\nTranscripción\n#Vuelta15#Cuarentena84\n#MentalidadPsicologiaPsiquis\n#Vuelta16Mes9\n#GeoEgo\n#EvolucionEspecieRiRo\n#InteraccionCalificacion\n#AlmaConcienciaMente\n#SindromeDios\n#FuncionPer\n#27Agosto\n",
    "pdfPage": 34
  },
  {
    "num": 52,
    "date": "10.09.2021",
    "dateISO": "2021-09-10",
    "vuelta": 16,
    "freq": "253 -112",
    "url": "",
    "tags": [
      "Vuelta16",
      "MapeoDelOtro",
      "Error",
      "Fallas",
      "Vuelta17",
      "Alcances",
      "realidad",
      "Fantasia",
      "Psiquismo",
      "Mentalidad",
      "Mejora",
      "Ego",
      "Geo",
      "Interaccion",
      "Ideales",
      "AlturaPsiquica",
      "Separacion",
      "LineasParticulares",
      "IncompatibilidadTerritorial",
      "Filtros",
      "DocumentacionDeFallos",
      "Memoria",
      "Ciclos",
      "CiclosDeOnce",
      "Ciclosde22",
      "BaseObjetiva",
      "BaseSubjetiva",
      "Mente",
      "Fractal",
      "Año",
      "Aparato",
      "Dia",
      "ReferenciaObjetiva",
      "No",
      "Observador",
      "FabricDeModelos",
      "So",
      "Orden",
      "Falta",
      "ConcienciaEspacial",
      "MenteRecibeOrdenes",
      "ConcienciaOrdena",
      "Valor",
      "Limites",
      "Bandas",
      "ArquitecturaPsiquica",
      "InconcienciaRepeticion",
      "Terremoto19",
      "ModulacionEspacioIonico",
      "Antena",
      "Anticipacion",
      "TiempoCircularConciencia",
      "TiempoLinealMente",
      "RecodificacionDeLaTarea",
      "CreacionDeLModelo",
      "Procesador",
      "Dios",
      "Dio",
      "PuntoDeEncaje",
      "EjecucionEnDestino",
      "EspacioPsiquicoConciencia",
      "AsumirLasFallas",
      "ConcienciaEndogena",
      "ConcienciaExogena",
      "Autorechazo",
      "DesconexionVoluntariaInvoluntaria",
      "Alma",
      "DesarrollodelPsiquismo",
      "DefinicinParticular",
      "Argumentacion",
      "ObjetoHumano",
      "NarrativaInterpretada",
      "ImpermeabilidaDdeLaConciencia",
      "ConcienciaEspacio",
      "MenteTiempo",
      "RechazoDelError",
      "DeteccionDeLaInterferencia",
      "AlmaEspacio",
      "Coexistencia",
      "ConflictoDeDios",
      "algo",
      "DiosesPsiquicos",
      "Naturaleza",
      "DesarrolloDeLaConcienciaParticular"
    ],
    "snippet": "52.- Ale",
    "content": "AlejandraCasadoenRed 52\n10.09.2021  253  -112\nvuelta 16\nTranscripción\n52.- Ale\nen red 52\nVuelta 16  -19/9/2021\n#Vuelta16  #MapeoDelOtro #Error #Fallas\n#Vuelta17 #Alcances #realidad #Fantasia\n#Psiquismo #Mentalidad #Mejora #Ego #Geo #Interaccion  #Ideales #AlturaPsiquica\n#Separacion\n#LineasParticulares #IncompatibilidadTerritorial  #Filtros #DocumentacionDeFallos\n#Memoria #Ciclos #CiclosDeOnce #Ciclosde22 #Mentalidad #BaseObjetiva\n#BaseSubjetiva #Mente\n#Fractal #Año #Aparato #Dia #ReferenciaObjetiva\n#No #Observador #FabricDeModelos #So\n#Orden #Falta #ConcienciaEspacial #MenteRecibeOrdenes #ConcienciaOrdena\n#Valor #Limites #Bandas #ArquitecturaPsiquica #InconcienciaRepeticion\n#Terremoto19/09/2017\n#ModulacionEspacioIonico #Antena #Anticipacion #TiempoCircularConciencia\n#TiempoLinealMente  #Ciclos\n#RecodificacionDeLaTarea #CreacionDeLModelo #Procesador\n#Dios #Dia #Dio #PuntoDeEncaje #EjecucionEnDestino\n#EspacioPsiquicoConciencia  #AsumirLasFallas #ConcienciaEndogena\n#ConcienciaExogena #Autorechazo\n#DesconexionVoluntariaInvoluntaria #Alma #DesarrollodelPsiquismo\n#DefinicinParticular #Argumentacion #ObjetoHumano #NarrativaInterpretada\n#ImpermeabilidaDdeLaConciencia #ConcienciaEspacio #MenteTiempo\n#RechazoDelError\n#DeteccionDeLaInterferencia #AlmaEspacio #Coexistencia #ConflictoDeDios  #algo\n#DiosesPsiquicos #Naturaleza\n#DesarrolloDeLaConcienciaParticular\n",
    "pdfPage": 35
  },
  {
    "num": 53,
    "date": "24.09.2021",
    "dateISO": "2021-09-24",
    "vuelta": 17,
    "freq": "267 -98",
    "url": "",
    "tags": [
      "aleenred53",
      "24septiembre2021",
      "vuelta17",
      "mision53",
      "volcanpalmascanarias",
      "tierrapideirdespacio",
      "espacioalmadetierra",
      "espaciodelalma",
      "mision5353",
      "contextodesbordado",
      "episodiosviolentos",
      "horrorqueeduca",
      "erroryacompañamientocoherente",
      "horroryerror",
      "aparatopsiquico",
      "capacidaddelectura",
      "erroramplificado",
      "lecturadelerror",
      "capitalizarelhorror",
      "leerlaalarma",
      "cargaionica",
      "espaciodememoria",
      "espaciodemente",
      "espacioprocesador",
      "cargasimbolica",
      "memoriaoperativa",
      "concienciasolar",
      "mardesoma",
      "memoriaram",
      "licenciadeinterprete",
      "espaciorom",
      "recursosdeanticipion",
      "cargasimbolicaprolija",
      "antivalor",
      "octavaestable",
      "demandaaltadelarealidad"
    ],
    "snippet": "aleenred53, 24septiembre2021, vuelta17, mision53, volcanpalmascanarias, tierrapideirdespacio, espacioalmadetierra, espaciodelalma",
    "content": "AlejandraCasadoenRed 53\n24.09.2021  267  -98\nvuelta 17\nTranscripción\n#aleenred53\n#24septiembre2021\n#vuelta17\n#mision53\n#volcanpalmascanarias\n#tierrapideirdespacio\n#espacioalmadetierra\n#espaciodelalma\n#mision5353\n#contextodesbordado\n#episodiosviolentos\n#horrorqueeduca\n#erroryacompañamientocoherente\n#horroryerror\n#aparatopsiquico\n#capacidaddelectura\n#erroramplificado\n#lecturadelerror\n#capitalizarelhorror\n#leerlaalarma\n#cargaionica\n#espaciodememoria\n#espaciodemente\n#espacioprocesador\n#cargasimbolica\n#cargaionica\n#memoriaoperativa\n#concienciasolar\n#mardesoma\n#memoriaram\n#licenciadeinterprete\n#espaciorom\n#recursosdeanticipion\n#cargasimbolicaprolija\n#antivalor\n#octavaestable\n#demandaaltadelarealidad",
    "pdfPage": 36
  },
  {
    "num": 54,
    "date": "",
    "dateISO": "",
    "vuelta": 18,
    "freq": "",
    "url": "",
    "tags": [
      "AleEnRed54",
      "8Octubre2021",
      "asume2025",
      "vuelta18ValorOtroNoYo",
      "alcanceMentalidadDescrito",
      "menteNoDescritoEnfoque",
      "conceptosAncla",
      "enfocarMarcos",
      "desencriptarMente",
      "4Cardinalidades",
      "18ReceptorOctavaNoPropia",
      "estructuraPsicologicaPsiquica",
      "reactivos",
      "reconocimientoPatronesPropiosNoPropios",
      "inconscienteAtraccionRechazo",
      "concienteArgumentada",
      "creenciasEstructuraPsicologica",
      "creacionesEstructuraPsiquica",
      "somaRecursoCargaSimbolica",
      "estructuraNeurologicaMemoriaQuimicaInterna",
      "paqueteFrasesImagenesOlores",
      "estructuraPsicologicaMemoriaExterna",
      "año1582",
      "calendarioSolar",
      "calendariaAnguloObservador",
      "año2100AñoSecular",
      "calendarioJulianoGregoriano",
      "AutorruteoEntrada3D",
      "impacto80Pacto58",
      "eventosFronteraParticular",
      "evento47Propio",
      "rayosCosmicosAntenas",
      "genoma",
      "campoParticular",
      "perdidaConectividad",
      "añoSecular1460",
      "interpretarTotalidadCriterioParticular",
      "aparato396Año1582Dias1451",
      "parametro54",
      "respaldoCienciaLGC",
      "energiaTransferenciaRecursos",
      "especiesAlmaColectiva",
      "humanosAlmaAlcanceParticular",
      "responsabilidadAmbiente",
      "regulacionCampoParticular",
      "almasIndividualesProyecto5DComun",
      "tiempoCuartaCuerdaDimension",
      "tiempoComoEspacio5D",
      "tiempoComoSecuencia",
      "secuenciarRalentizar",
      "vinculacionAparatoPsiquicoConGeo",
      "darValorA3D",
      "campoNativoPsiquismo",
      "territorioParticulasSubatomicas",
      "espacioMemoria",
      "soma4TiposMemoriaCardinalidades",
      "reconocimientoRamRemRomRum",
      "facultadCambiosEstrategicos",
      "ramMemoriaVidaMar",
      "remMemoriaNacimiento",
      "romMemoriaTierraAireAgua",
      "rumCambiosRumbos",
      "sueñosNoLineales",
      "anatomiaPisquismoParticular",
      "autodiagnostico",
      "ejeRiConexion",
      "triadaConcienciaMenteCuerpo",
      "mapeoPropioOtros",
      "conexionParticularUneTriada",
      "concienciaObservaContextoMetricas",
      "menteDaCuerpoReflejosIdentificarPatronesNuevos",
      "cuerpoRegistraPatronesNuevosDocumenta",
      "concienciaHaceRegistroSoma",
      "concienciaEscribeCodigoMente",
      "cortexNocionesNuevas",
      "autorreferenciaOmiteContexto",
      "impactoRegistroFallaReaccion",
      "noImpactoRegistroErrorAnticipacion",
      "modulacion",
      "errorAnticipacion",
      "renglonArribaError",
      "renglonAbajoFalla"
    ],
    "snippet": "08. 10. 2021 281 -84",
    "content": "AlejandraCasadoenRed 54\n08. 10. 2021   281  -84\nvuelta 18\nTranscripción\n#AleEnRed54\n#8Octubre2021\n#asume2025\n#vuelta18ValorOtroNoYo\n#alcanceMentalidadDescrito\n#menteNoDescritoEnfoque\n#conceptosAncla\n#enfocarMarcos\n#desencriptarMente\n#4Cardinalidades\n#18ReceptorOctavaNoPropia\n#estructuraPsicologicaPsiquica\n#reactivos\n#reconocimientoPatronesPropiosNoPropios\n#inconscienteAtraccionRechazo\n#concienteArgumentada\n#creenciasEstructuraPsicologica\n#creacionesEstructuraPsiquica\n#somaRecursoCargaSimbolica\n#estructuraNeurologicaMemoriaQuimicaInterna\n#paqueteFrasesImagenesOlores\n#estructuraPsicologicaMemoriaExterna\n#año1582\n#calendarioSolar\n#calendariaAnguloObservador\n#año2100AñoSecular\n#calendarioJulianoGregoriano\n#AutorruteoEntrada3D\n#impacto80Pacto58\n#eventosFronteraParticular\n#evento47Propio\n#rayosCosmicosAntenas\n#genoma\n#campoParticular\n#perdidaConectividad\n#añoSecular1460\n#interpretarTotalidadCriterioParticular\n#aparato396Año1582Dias1451\n#parametro54\n#respaldoCienciaLGC\n#energiaTransferenciaRecursos\n#especiesAlmaColectiva\n#humanosAlmaAlcanceParticular\n#responsabilidadAmbiente\n#regulacionCampoParticular\n#almasIndividualesProyecto5DComun\n#tiempoCuartaCuerdaDimension\n#tiempoComoEspacio5D\n#tiempoComoSecuencia\n#secuenciarRalentizar\n#vinculacionAparatoPsiquicoConGeo\n#darValorA3D\n#campoNativoPsiquismo\n#territorioParticulasSubatomicas\n#espacioMemoria\n#soma4TiposMemoriaCardinalidades\n#reconocimientoRamRemRomRum\n#facultadCambiosEstrategicos\n#ramMemoriaVidaMar\n#remMemoriaNacimiento\n#romMemoriaTierraAireAgua\n#rumCambiosRumbos\n#sueñosNoLineales\n#anatomiaPisquismoParticular\n#autodiagnostico\n#ejeRiConexion\n#triadaConcienciaMenteCuerpo\n#mapeoPropioOtros\n#conexionParticularUneTriada\n#concienciaObservaContextoMetricas\n#menteDaCuerpoReflejosIdentificarPatronesNuevos\n#cuerpoRegistraPatronesNuevosD",
    "pdfPage": 36
  },
  {
    "num": 55,
    "date": "",
    "dateISO": "",
    "vuelta": 19,
    "freq": "",
    "url": "",
    "tags": [
      "AleEnRed55",
      "vuelta19",
      "octavaOtro",
      "noSecuenciacionCalendarioViolencia",
      "modularAlgoritmosDaño",
      "reconocimientoFallaPsiquico",
      "creacionNuevaPsicologia",
      "pasadoAbajo",
      "secuenciacionCalendaria16Dias",
      "secuenciacionAnilloFuego12RelojProcesador",
      "anilloFuegoCabeceraAño",
      "vuelta23Wifi",
      "pasadoAtrasRepeticionFuturo",
      "cargaIonicaMasFuerte",
      "construirPazEstable",
      "cadaAñoMasExigente",
      "modeularEstructuraPiscologica",
      "importancia31Diciembre",
      "anatomiaCalendario",
      "aparatos1460DiasAño1700Año1800Año1900",
      "14añosGuerraMundial",
      "tomografiaComputada",
      "estructuraPsiquicaForanea",
      "estrcuturaPsicologicaDomestica",
      "despliegueDomesticoMentalidadLocal",
      "despliegueDomesticoMentalidadOrbitales",
      "creacionNuevasEstructurasPsicologicasFuturo",
      "psicologiaMisticaNoEmpataRealidad",
      "ProximoAñoSecular2100",
      "palabrasComoCodigosInterdimensionales",
      "conceptosEstructurasPsiquicasPrimero",
      "estructurasPsicologicasDespues",
      "registrosMemoria",
      "reinterpretacionOrigenConcepto",
      "mejoraCanalizacionPsicologica",
      "abreRegistroMemoria",
      "registroNuevoMemoriaVieja",
      "colocarPasadoAtras",
      "estabilidadAncla",
      "valorOtroVinculoRelacion",
      "cadaAñoOtro",
      "clonacionMezclaInsconsciente",
      "mantenerOctavaPropiaOtroNuestra",
      "quintaEtapa1888TresOctavas",
      "mapearDiferenciaOtro",
      "creditoMenteSolPropia",
      "madurarPersonalParticular",
      "juicioJuzgamiento",
      "concienciasDistintosTamaños",
      "contenerComprenderRegular",
      "construirOctavaSocial",
      "vuelta20GestionIncrementos",
      "rolCristina",
      "futuroMejorPasado",
      "poderFuncionPer",
      "44TodosLosModelos",
      "octavasAjustadas",
      "colocarLimites",
      "preguntaAcostarOctava",
      "interconexionOctavasNativas",
      "octavaCircuitoOrbitales",
      "composicionDinamica",
      "actualizacionNovenoOrbital",
      "algortimoDiferentesEscalas",
      "activacionOctava",
      "circuitoCerradoOctava",
      "activacionCoberturaOctavaEstabilidad",
      "focoAutorreferencia",
      "efectoQuimicoPsicologia",
      "psiquismoNoEmociones",
      "quintaDimensionAdministraTercera",
      "octavaAcostadaSecuenciadaLinealmente",
      "colonAparato373"
    ],
    "snippet": "22. 10. 2021 295 -70",
    "content": "AlejandraCasadoenRed 55\n22. 10. 2021   295  -70\nvuelta 19\nTranscripción\n#AleEnRed55\n#vuelta19\n#octavaOtro\n#noSecuenciacionCalendarioViolencia\n#modularAlgoritmosDaño\n#reconocimientoFallaPsiquico\n#creacionNuevaPsicologia\n#pasadoAbajo\n#secuenciacionCalendaria16Dias\n#secuenciacionAnilloFuego12RelojProcesador\n#anilloFuegoCabeceraAño\n#vuelta23Wifi\n#pasadoAtrasRepeticionFuturo\n#cargaIonicaMasFuerte\n#construirPazEstable\n#cadaAñoMasExigente\n#modeularEstructuraPiscologica\n#importancia31Diciembre\n#anatomiaCalendario\n#aparatos1460DiasAño1700Año1800Año1900\n#14añosGuerraMundial\n#tomografiaComputada\n#estructuraPsiquicaForanea\n#estrcuturaPsicologicaDomestica\n#despliegueDomesticoMentalidadLocal\n#despliegueDomesticoMentalidadOrbitales\n#creacionNuevasEstructurasPsicologicasFuturo\n#psicologiaMisticaNoEmpataRealidad\n#ProximoAñoSecular2100\n#palabrasComoCodigosInterdimensionales\n#conceptosEstructurasPsiquicasPrimero\n#estructurasPsicologicasDespues\n#registrosMemoria\n#reinterpretacionOrigenConcepto\n#mejoraCanalizacionPsicologica\n#abreRegistroMemoria\n#registroNuevoMemoriaVieja\n#colocarPasadoAtras\n#estabilidadAncla\n#valorOtroVinculoRelacion\n#cadaAñoOtro\n#clonacionMezclaInsconsciente\n#mantenerOctavaPropiaOtroNuestra\n#quintaEtapa1888TresOctavas\n#mapearDiferenciaOtro\n#creditoMenteSolPropia\n#madurarPersonalParticular\n#juicioJuzgamiento\n#concienciasDistintosTamaños\n#contenerComprenderRegular\n#construirOctavaSocial\n#vuelta20GestionIncrementos\n#rolCristina\n#futuroMejorPasado\n#poderFuncionPer\n#44TodosLosModelos\n#octavasAjustadas\n#colocarLimites\n#preguntaAcostarOctava\n#interconexionOctavasNativas\n#octavaCircuitoOrbitales\n#composicionDinamica\n#actualizacionNovenoOrbital\n#algortimoDiferentesEscalas\n#activacionOctava\n#circuitoCerradoOctava\n#activacionCoberturaOctavaEstabilidad\n#focoAutorreferencia\n#efectoQui",
    "pdfPage": 38
  },
  {
    "num": 56,
    "date": "",
    "dateISO": "",
    "vuelta": 20,
    "freq": "",
    "url": "",
    "tags": [
      "AleEnRed56",
      "Indice56",
      "Noviembre13De2021",
      "MetricasDia",
      "ReinterpretarTerceraDimension",
      "LaCulpa",
      "RuteoVuelta20",
      "Responsabilidad",
      "IncrementoOctavaNativa",
      "Codigo56",
      "Codigo53",
      "Codigo57",
      "LaUit",
      "AnilloDeFuego",
      "AtomoPlata",
      "CalendarioLgcPlataforma2012"
    ],
    "snippet": "13. 11. 2021 317 -48 56.- Ale",
    "content": "AlejandraCasadoenRed 56\n13. 11. 2021  317  -48\nvuelta 20\nTranscripción\n56.- Ale\nen Red 56\n#AleEnRed56\n#Indice56\n#Noviembre13De2021\n#MetricasDia\n#ReinterpretarTerceraDimension\n#LaCulpa\n#RuteoVuelta20\n#Responsabilidad\n#IncrementoOctavaNativa\n#Codigo56\n#Codigo53\n#Codigo57\n#LaUit\n#AnilloDeFuego\n#AtomoPlata\n#CalendarioLgcPlataforma2012\n",
    "pdfPage": 40
  },
  {
    "num": 57,
    "date": "03.12.2021",
    "dateISO": "2021-12-03",
    "vuelta": 22,
    "freq": "337 -28",
    "url": "",
    "tags": [
      "AleEnRed57",
      "Indice57",
      "Diciembre3De2021",
      "Vuelta22",
      "Metricas3Diciembre2021",
      "AñoDaño",
      "Anticipación",
      "InteractividadEntreComponentes",
      "Cuadro25",
      "GeneracionDeEspacioTiempo",
      "ImpulsoMipulso",
      "Base12",
      "Autorechazo",
      "LaOctavaNativa",
      "Bolibia591",
      "ConexionEneroDiciembre",
      "InteractividadEntreFechas",
      "HabitarLaRetraccion"
    ],
    "snippet": "57.- Ale",
    "content": "AlejandraCasadoenRed 57\n03.12.2021  337  -28\nvuelta 22\nTranscripción\n57.- Ale\nen Red 57\n#AleEnRed57\n#Indice57\n#Diciembre3De2021\n#Vuelta22\n#Metricas3Diciembre2021\n#AñoDaño\n#Anticipación\n#InteractividadEntreComponentes\n#Cuadro25\n#GeneracionDeEspacioTiempo\n#ImpulsoMipulso\n#Base12\n#Autorechazo\n#LaOctavaNativa\n#Bolibia591\n#ConexionEneroDiciembre\n#InteractividadEntreFechas\n#HabitarLaRetraccion",
    "pdfPage": 41
  },
  {
    "num": 58,
    "date": "17.12.2021",
    "dateISO": "2021-12-17",
    "vuelta": 22,
    "freq": "351 -14",
    "url": "",
    "tags": [
      "AleEnRed58",
      "Indice58",
      "Diciembre17De2021",
      "Vuelta22",
      "CicloSolar25",
      "IgnoranciaLibertad",
      "ConcienciaEspacioTemporal",
      "Transparencia5aDimension",
      "Relacion3a5aDimension",
      "Frecuencia353",
      "GestionEspacioTiempo",
      "RelacionConRealidad",
      "InstalacionDeMarcos",
      "FuncionDe58",
      "ProcesarPasadoApoyarPresente"
    ],
    "snippet": "58.- Ale",
    "content": "AlejandraCasadoenRed 58\n17.12.2021  351  -14\nvuelta 22\nTranscripción\n58.- Ale\nen Red 58\n#AleEnRed58\n#Indice58\n#Diciembre17De2021\n#Vuelta22\n#CicloSolar25\n#IgnoranciaLibertad\n#ConcienciaEspacioTemporal\n#Transparencia5aDimension\n#Relacion3a5aDimension\n#Frecuencia353\n#GestionEspacioTiempo\n#RelacionConRealidad\n#InstalacionDeMarcos\n#FuncionDe58\n#ProcesarPasadoApoyarPresente\n",
    "pdfPage": 41
  },
  {
    "num": 59,
    "date": "01.01.2022",
    "dateISO": "2022-01-01",
    "vuelta": 1,
    "freq": "",
    "url": "",
    "tags": [
      "AleEnRed59",
      "Indice59",
      "Enero1De2022",
      "Vuelta1",
      "Metricas1De1De2022",
      "AnilloDeFuego",
      "CerebroDelAño",
      "Asimila",
      "AñoComoAncla",
      "MenteRegistro",
      "CerebroReactividad",
      "RegistrarElAño",
      "ErrorEquivocaciones",
      "ConexionConcienciaMenteSoma",
      "EscuchaDelCuerpo",
      "Soldados",
      "Enero31Asimila",
      "Calendaria",
      "GloblaParticular"
    ],
    "snippet": "59.- Ale",
    "content": "AlejandraCasadoenRed 59\n01.01.2022\nvuelta 1\nTranscripción\n59.- Ale\nen Red 59 docx\n#AleEnRed59\n#Indice59\n#Enero1De2022\n#Vuelta1\n#Metricas1De1De2022\n#AnilloDeFuego\n#CerebroDelAño\n#Asimila\n#AñoComoAncla\n#MenteRegistro\n#CerebroReactividad\n#RegistrarElAño\n#ErrorEquivocaciones\n#ConexionConcienciaMenteSoma\n#EscuchaDelCuerpo\n#Soldados\n#Enero31Asimila\n#Calendaria\n#GloblaParticular",
    "pdfPage": 42
  },
  {
    "num": 60,
    "date": "17.01.2022",
    "dateISO": "2022-01-17",
    "vuelta": 2,
    "freq": "",
    "url": "",
    "tags": [
      "AleEnRed60",
      "Indice60",
      "Enero17De2022",
      "Vuelta2",
      "MetricasEnero17Del2022",
      "Asimila",
      "EventoUnico",
      "ElValor",
      "FundarConciencia",
      "GenerarConcumir",
      "FundarFuncionFuncionario",
      "AparatoBiologico",
      "CalendarioLgcRenglon2012",
      "MecanismoIncrementoConciencia",
      "CronosKairos"
    ],
    "snippet": "60.- Ale",
    "content": "Alejandra Casado\nEN Red 60\n17.01.2022\nVuelta 2\nTranscripción\n60.- Ale\nen Red 60 docx\n#AleEnRed60\n#Indice60\n#Enero17De2022\n#Vuelta2\n#MetricasEnero17Del2022\n#Asimila\n#EventoUnico\n#ElValor\n#FundarConciencia\n#GenerarConcumir\n#FundarFuncionFuncionario\n#AparatoBiologico\n#CalendarioLgcRenglon2012\n#MecanismoIncrementoConciencia\n#CronosKairos\n",
    "pdfPage": 42
  },
  {
    "num": 61,
    "date": "02.02.2022",
    "dateISO": "2022-02-02",
    "vuelta": 3,
    "freq": "",
    "url": "",
    "tags": [
      "AleEnRed61",
      "vuelta3",
      "tercerOrbital",
      "segundoOrbital",
      "estatico",
      "dinamico",
      "estructuraPsiquica",
      "estructuraPsicologica",
      "dia33",
      "funcionario",
      "fundacionVueltaEnCurso",
      "anclaVuestaAñoAnterior",
      "captacion",
      "incremento",
      "trazabilidad",
      "sensar",
      "CG3730",
      "concienciaInstrumento",
      "anticipacion",
      "señalEducativa",
      "periodoCalificacionSol",
      "3Accion",
      "percepcionGlobal",
      "procesadorGlobal",
      "anilloFuego",
      "evolucionSistemaSolar",
      "estabilidad",
      "actualizacion",
      "estaticoDinamico",
      "complementariedad",
      "estabilidadDinamica",
      "espacioGuardado",
      "ingresoNovedades",
      "aprovechamientoError",
      "hammer",
      "terceraEtapa",
      "desvalorizacion",
      "valor",
      "comparacionCompetencia",
      "movimientoMetrica",
      "conflictoBiologia",
      "concienciaAccion",
      "procesoResultado",
      "accionReaccion",
      "fraccionSegundo",
      "lentitud",
      "aprovechamiento",
      "microsegundoAntes",
      "11PrimerasVueltas",
      "otroPuntoVista",
      "cuerpoDesfasadoPiscologia",
      "desfasajeDolor",
      "menteFuturoParaCuerpo",
      "permitirFuturoMejor",
      "pasadoPerpetua",
      "trama",
      "fundacionConciencia",
      "estabilizacionExistencia",
      "ralentizacion",
      "dolorCuerpoBuenaSeñal",
      "permitirBiologiaAcomode",
      "RamRemRomRum",
      "RamEmisionSistemaSolar",
      "4diasFuenteInterna",
      "12diasFuenteExterna",
      "estamentosEstaticos",
      "capasInnovadorasFiltro",
      "octavaReactiva",
      "desplazamientoOctava",
      "errorNativoDestino",
      "particula",
      "desplamientoEspacioTemporalParticular",
      "cuarentena88",
      "cambioOctava",
      "plataformaPasadoAgregados",
      "fundacionOctava",
      "transicionSuave",
      "concienciaDesplazaIgnorancia",
      "transicionesVividas",
      "entendimientoEscalas",
      "subnivelesModulacionOctavas",
      "perfilAntena",
      "vacunasCovid",
      "maduracionColectiva",
      "instrumentacionParticular",
      "pertenenciaSistemaSolar",
      "detallesAbrenTrama",
      "darTiempoAlTiempo",
      "anclajeDetallesAbsorbenCaos",
      "percepcionAnticipada",
      "señalAlCuerpoReceptivo",
      "maduracionModulacion",
      "respetoAlcances",
      "señalPrimerSegundoOrbitalesBiologia",
      "aceptacionAutorrechazo",
      "lecturaPosicionParticular",
      "depresion",
      "suicidio",
      "anatomiaSistemaSolar",
      "orbital1y2Reparametrizacion",
      "escaneoOrasDimensiones",
      "psiquismoLeeSeñal",
      "instintoAnimal",
      "realidadSomaSistemaSolar",
      "coherencia",
      "reporteFallasFaltas",
      "anatomiaCalendario",
      "anatomiaCalendaria"
    ],
    "snippet": "AleEnRed61, vuelta3, tercerOrbital, segundoOrbital, estatico, dinamico, estructuraPsiquica, estructuraPsicologica",
    "content": "AlejandraCasadoenRed 61\n02.02.2022\nvuelta 3\nTranscripción\n#AleEnRed61\n#vuelta3\n#tercerOrbital\n#segundoOrbital\n#estatico\n#dinamico\n#estructuraPsiquica\n#estructuraPsicologica\n#dia33\n#funcionario\n#fundacionVueltaEnCurso\n#anclaVuestaAñoAnterior\n#captacion\n#incremento\n#trazabilidad\n#sensar\n#CG3730\n#concienciaInstrumento\n#anticipacion\n#señalEducativa\n#periodoCalificacionSol\n#3Accion\n#percepcionGlobal\n#procesadorGlobal\n#anilloFuego\n#evolucionSistemaSolar\n#estabilidad\n#actualizacion\n#estaticoDinamico\n#complementariedad\n#estabilidadDinamica\n#espacioGuardado\n#ingresoNovedades\n#aprovechamientoError\n#hammer\n#terceraEtapa\n#desvalorizacion\n#valor\n#comparacionCompetencia\n#movimientoMetrica\n#conflictoBiologia\n#concienciaAccion\n#procesoResultado\n#accionReaccion\n#fraccionSegundo\n#lentitud\n#aprovechamiento\n#microsegundoAntes\n#11PrimerasVueltas\n#otroPuntoVista\n#cuerpoDesfasadoPiscologia\n#desfasajeDolor\n#menteFuturoParaCuerpo\n#permitirFuturoMejor\n#pasadoPerpetua\n#trama\n#fundacionConciencia\n#estabilizacionExistencia\n#ralentizacion\n#dolorCuerpoBuenaSeñal\n#permitirBiologiaAcomode\n#RamRemRomRum\n#RamEmisionSistemaSolar\n#4diasFuenteInterna\n#12diasFuenteExterna\n#estamentosEstaticos\n#capasInnovadorasFiltro\n#octavaReactiva\n#desplazamientoOctava\n#errorNativoDestino\n#particula\n#desplamientoEspacioTemporalParticular\n#cuarentena88\n#cambioOctava\n#plataformaPasadoAgregados\n#fundacionOctava\n#transicionSuave\n#concienciaDesplazaIgnorancia\n#transicionesVividas\n#entendimientoEscalas\n#subnivelesModulacionOctavas\n#perfilAntena\n#vacunasCovid\n#maduracionColectiva\n#instrumentacionParticular\n#pertenenciaSistemaSolar\n#detallesAbrenTrama\n#darTiempoAlTiempo\n#anclajeDetallesAbsorbenCaos\n#percepcionAnticipada\n#señalAlCuerpoReceptivo\n#maduracionModulacion\n#respetoAlcances\n#señalPrimerSegundoOrbitalesBiologia\n#aceptacionAu",
    "pdfPage": 43
  },
  {
    "num": 62,
    "date": "18.02.2022",
    "dateISO": "2022-02-18",
    "vuelta": 4,
    "freq": "",
    "url": "",
    "tags": [
      "AnilloDeFuegoCerebro",
      "Vuelta22AnclaDelAño",
      "Vuelta4ConcienciaInstalandose",
      "PuntoDeEncaje",
      "Febrero18Actualizacion",
      "Dia60AparatoDecide",
      "Plano4",
      "PremioCastigo",
      "ReALyLA",
      "CaptarFuncionalizarUnaOctava",
      "AlcancesLimitaciones",
      "RazonamientosComoAncla",
      "AjusteDia49DelAño",
      "Victimismo",
      "CrearDignidadNoConsumirla",
      "AutosateliteoMisticismo",
      "PerversionDelRecurso",
      "ConcienciaAlmaSuDesarrollo"
    ],
    "snippet": "62.- Ale Febrero 18 2022",
    "content": "AlejandraCasadoenRed 62\n18.02.2022\nvuelta 4\nTranscripción\n62.- Ale\nen Red 62 docx\nFebrero 18 2022\n# AleEnRed62\n#AnilloDeFuegoCerebro\n#Vuelta22AnclaDelAño\n#Vuelta4ConcienciaInstalandose\n#PuntoDeEncaje\n#Febrero18Actualizacion\n#Dia60AparatoDecide\n#Plano4º4ªDimension\n#PremioCastigo\n#ReALyLA\n#CaptarFuncionalizarUnaOctava\n#AlcancesLimitaciones\n#RazonamientosComoAncla\n#AjusteDia49DelAño\n#Victimismo\n#CrearDignidadNoConsumirla\n#AutosateliteoMisticismo\n#PerversionDelRecurso\n#ConcienciaAlmaSuDesarrollo\n",
    "pdfPage": 45
  },
  {
    "num": 63,
    "date": "06.03.2022",
    "dateISO": "2022-03-06",
    "vuelta": 5,
    "freq": "",
    "url": "",
    "tags": [
      "AleEnRed63",
      "Vuelta5",
      "MamuskasHistoria",
      "ConflictoDe7",
      "TecnologiaConcienciaDeOtraDimension",
      "EtapasVidaSobreLaTierra",
      "SeñalEducativaInicia2012",
      "EspacioTiempoEsConstructorDeConceptos",
      "Aparato4AñosJuntosCalendarioSolar",
      "Dilema3con7SuCaptacion",
      "ConceptoDe5",
      "UnidadDeConcienciaSolarEsAño2016",
      "SegundosIntercalares",
      "LimitesAlcancesVanConTecnologia",
      "AnclaSuSignificado",
      "CaptacionDeLaAntena",
      "TontoBrillante",
      "EventoFrontera46",
      "SeñalEspacioDeGuardado",
      "DiaDeImpacto17353",
      "LadrilloPasadoPresenteFuturo",
      "RiPropiaRoCompartida",
      "Diferencia5"
    ],
    "snippet": "63.- Ale Marzo 6 de 2022",
    "content": "AlejandraCasadoenRed 63\n06.03.2022\nvuelta 5\nTranscripción\n63.- Ale\nen Red 63 docx\nMarzo 6 de 2022\n#AleEnRed63\n#Vuelta5\n#MamuskasHistoria\n#ConflictoDe7\n#TecnologiaConcienciaDeOtraDimension\n#EtapasVidaSobreLaTierra\n#SeñalEducativaInicia2012\n#EspacioTiempoEsConstructorDeConceptos\n#Aparato4AñosJuntosCalendarioSolar\n#Dilema3con7SuCaptacion\n#ConceptoDe5ªEtapa\n#UnidadDeConcienciaSolarEsAño2016\n#SegundosIntercalares\n#LimitesAlcancesVanConTecnologia\n#AnclaSuSignificado\n#CaptacionDeLaAntena\n#TontoBrillante\n#EventoFrontera46\n#SeñalEspacioDeGuardado\n#DiaDeImpacto17353\n#LadrilloPasadoPresenteFuturo\n#RiPropiaRoCompartida\n#Diferencia5ºPlanoDe5ªDimension",
    "pdfPage": 46
  },
  {
    "num": 64,
    "date": "22.03.2022",
    "dateISO": "2022-03-22",
    "vuelta": 6,
    "freq": "",
    "url": "",
    "tags": [
      "AleEnRed64",
      "Vuelta6",
      "La5",
      "CodigoDe27Letras27X3Es81",
      "Recursos1",
      "TriadaAlmicaPasadoPresenteFuturo",
      "ElErrorDeInputEsPsiquico",
      "FreudElSuperYoEvolucionLGC",
      "LaDiferenciaPsiquicaYPsicologica",
      "RealidadSistemaTema",
      "AlcanceLimitacion",
      "AmorOdioDefectosVirtudes",
      "CulpaPremioCastigo"
    ],
    "snippet": "64.- Ale 22 de Marzo 2022",
    "content": "AlejandraCasadoenRed 64\n22.03.2022\nvuelta 6\nTranscripción\n64.- Ale\nen red 64 docx\nAlejandra Casado\nEn Red 64\n22 de Marzo 2022\n#AleEnRed64\n#Vuelta6\n#La5ªDimensionElTiempo81\n#CodigoDe27Letras27X3Es81\n#Recursos1ºDesafiosDespuesUEC\n#TriadaAlmicaPasadoPresenteFuturo\n#ElErrorDeInputEsPsiquico\n#FreudElSuperYoEvolucionLGC\n#LaDiferenciaPsiquicaYPsicologica\n#RealidadSistemaTema\n#AlcanceLimitacion\n#AmorOdioDefectosVirtudes\n#CulpaPremioCastigo\n",
    "pdfPage": 46
  },
  {
    "num": 65,
    "date": "07.04.2022",
    "dateISO": "2022-04-07",
    "vuelta": 7,
    "freq": "",
    "url": "",
    "tags": [
      "AleEnRed65",
      "vuelta7",
      "cierreCanal6910",
      "personasAutorizadasLGC",
      "davidWilliams",
      "isabelNocetti",
      "sebastianLlanos",
      "nahirBarrios",
      "cienciaDura",
      "urano",
      "rusia",
      "tercerOrbitalContextualiza",
      "septimoOrbitalAbsolutiza",
      "sobrecargaPsiquismo",
      "estructuraPsicologica",
      "impulsosRelativosAbsolutos",
      "reconocimientoAbsoluto",
      "procesamientoRelativo",
      "psiquismoAbsoluto",
      "materializacionRelativa",
      "diosPuntoDeEncajeSOMA",
      "ejecucion7a1",
      "unaManoParaElHumano9",
      "conexionRi",
      "chinaConfucio",
      "habilidadesRo",
      "fallasPlano",
      "roTransferible",
      "riEsGo",
      "realidadSomaSistemaSolar",
      "autorregulacion",
      "observadoresLogicos",
      "politicaCorrupcion",
      "vidaReligion",
      "psiquismoCapturaError",
      "planoDimension",
      "dimensionAlcance",
      "planoLimitacion",
      "psiquismoRecibeDimension",
      "psicologíaProcesoPlano",
      "integrarDimensionesDiferentes",
      "concienciaMadura",
      "inhumanoCodificaADN",
      "diosPuntoEncaje49",
      "dimensionOrigenPsiquismo",
      "dimensionDestinoPsicologia",
      "regulacionesRepresionComprensionImpulso",
      "cuartaEtapaCorrectivos",
      "autorregulacionObservacionImpulso",
      "libreMemoriaPasado",
      "particularizarseApropiarsePuntosEncajePropios",
      "capitalizacionErrorCreacionPaz",
      "infraestructuraPsiquica"
    ],
    "snippet": "AleEnRed65, vuelta7, cierreCanal6910, personasAutorizadasLGC, davidWilliams, isabelNocetti, sebastianLlanos, nahirBarrios",
    "content": "AlejandraCasadoenRed 65\n07.04.2022\nvuelta 7\nTranscripción\n#AleEnRed65\n#vuelta7-2022\n#cierreCanal6910\n#personasAutorizadasLGC\n#davidWilliams\n#isabelNocetti\n#sebastianLlanos\n#nahirBarrios\n#cienciaDura\n#urano\n#rusia\n#tercerOrbitalContextualiza\n#septimoOrbitalAbsolutiza\n#sobrecargaPsiquismo\n#estructuraPsicologica\n#impulsosRelativosAbsolutos\n#reconocimientoAbsoluto\n#procesamientoRelativo\n#psiquismoAbsoluto\n#materializacionRelativa\n#diosPuntoDeEncajeSOMA\n#ejecucion7a1\n#unaManoParaElHumano9\n#conexionRi\n#chinaConfucio\n#habilidadesRo\n#fallasPlano\n#roTransferible\n#riEsGo\n#realidadSomaSistemaSolar\n#autorregulacion\n#observadoresLogicos\n#politicaCorrupcion\n#vidaReligion\n#psiquismoCapturaError\n#planoDimension\n#dimensionAlcance\n#planoLimitacion\n#psiquismoRecibeDimension\n#psicologíaProcesoPlano\n#integrarDimensionesDiferentes\n#concienciaMadura\n#inhumanoCodificaADN\n#diosPuntoEncaje49\n#dimensionOrigenPsiquismo\n#dimensionDestinoPsicologia\n#regulacionesRepresionComprensionImpulso\n#cuartaEtapaCorrectivos\n#autorregulacionObservacionImpulso\n#libreMemoriaPasado\n#particularizarseApropiarsePuntosEncajePropios\n#capitalizacionErrorCreacionPaz\n#infraestructuraPsiquica\n",
    "pdfPage": 47
  },
  {
    "num": 66,
    "date": "23.04.2022",
    "dateISO": "2022-04-23",
    "vuelta": 8,
    "freq": "",
    "url": "",
    "tags": [
      "AleEnRed66",
      "indice66",
      "23deAbril2022",
      "vuelta8Año2022",
      "dia112SeptronDiaDeLaTierra",
      "errorRedefinicion",
      "alineacionDePlanetasPlanesLogicos",
      "cardinalidadesPasos",
      "dia113ParadaEnSus13",
      "tierraMagnetismoTerrestre",
      "accidenteConPerrosSueltos",
      "limitacionEntrenamiento",
      "restriccionesPerEnRo",
      "lecturasCorrectasRectas",
      "interpretacionDeMayorAlcance",
      "vuelta8Año2022ErrorDesarrollo",
      "mapas",
      "objetivoDeLgc",
      "universoExpresado",
      "universoExpresadoCivilizadoDiferencia",
      "mejoraControlDominio",
      "esenciaDeLaExistencia",
      "ionosferaConflicto",
      "mejorPeorModo",
      "funcionPer",
      "almaCuerpoPuntoDeEncaje",
      "arquetipicoPrototipicoAprendizaje",
      "retocarElPasado",
      "impulsoPulsoModulacion",
      "siquismoAlcance",
      "sicologiaLimite",
      "cuarentena90",
      "derroteroDesde9Hasta1",
      "cierreEmision",
      "capitalizarTomarDeuda",
      "anticipacionHerramientas",
      "alianzaEntreEspecies"
    ],
    "snippet": "66.-Ale",
    "content": "AlejandraCasadoenRed 66\n23.04.2022\nvuelta 8\nTranscripción\n66.-Ale\nen Red66\n#AleEnRed66\n#indice66\n#23deAbril2022\n#vuelta8Año2022\n#dia112SeptronDiaDeLaTierra\n#errorRedefinicion\n#alineacionDePlanetasPlanesLogicos\n#cardinalidadesPasos\n#dia113ParadaEnSus13\n#tierraMagnetismoTerrestre\n#accidenteConPerrosSueltos\n#limitacionEntrenamiento\n#restriccionesPerEnRo\n#lecturasCorrectasRectas\n#interpretacionDeMayorAlcance\n#vuelta8Año2022ErrorDesarrollo\n#mapas\n#objetivoDeLgc\n#universoExpresado\n#universoExpresadoCivilizadoDiferencia\n#mejoraControlDominio\n#esenciaDeLaExistencia\n#ionosferaConflicto\n#mejorPeorModo\n#funcionPer\n#almaCuerpoPuntoDeEncaje\n#arquetipicoPrototipicoAprendizaje\n#retocarElPasado\n#impulsoPulsoModulacion\n#siquismoAlcance\n#sicologiaLimite\n#cuarentena90\n#derroteroDesde9Hasta1\n#cierreEmision\n#capitalizarTomarDeuda\n#anticipacionHerramientas\n#alianzaEntreEspecies\n",
    "pdfPage": 48
  },
  {
    "num": 67,
    "date": "09.05.2022",
    "dateISO": "2022-05-09",
    "vuelta": 9,
    "freq": "",
    "url": "",
    "tags": [
      "Vuelta9",
      "JKLfuenteExterna",
      "Base12Y21",
      "FortalezaEsEmisoraFuerzaEsReceptora",
      "ConcienciaReceptoraMenteEmisora",
      "AnatomiaDelAño",
      "AnatomiaDelPsiquismo",
      "IteracionTieneQueVerConCiclos",
      "DiferenciaExperienciaEvolucion",
      "AparatoPsiquicoYPsicologico",
      "SeñalesInterpretadasDocumentadas",
      "FuncionPer",
      "AlmaInstanciaParticularOColectiva",
      "BasesOtasDesdeLGC",
      "LaTotalidadFiltraLaFuncionPer"
    ],
    "snippet": "67.- Ale Mayo 9",
    "content": "AlejandraCasadoenRed 67\n09.05.2022\nvuelta 9\nTranscripción\n67.- Ale\nen Red 67\nAlejandra Casado\nEn RED 67\nMayo 9\n#Vuelta9\n#JKLfuenteExterna\n#Base12Y21\n#FortalezaEsEmisoraFuerzaEsReceptora\n#ConcienciaReceptoraMenteEmisora\n#AnatomiaDelAño\n#AnatomiaDelPsiquismo\n#IteracionTieneQueVerConCiclos\n#DiferenciaExperienciaEvolucion\n#AparatoPsiquicoYPsicologico\n#SeñalesInterpretadasDocumentadas\n#FuncionPer\n#AlmaInstanciaParticularOColectiva\n#BasesOtasDesdeLGC\n#LaTotalidadFiltraLaFuncionPer",
    "pdfPage": 49
  },
  {
    "num": 68,
    "date": "02.06.2022",
    "dateISO": "2022-06-02",
    "vuelta": 10,
    "freq": "",
    "url": "",
    "tags": [
      "junio2De2023",
      "indice68",
      "vuelta10",
      "periodoEvolutivo",
      "cajasSemanticas",
      "cajasDialecticas",
      "concienciaSocial",
      "restriccionesAusentes",
      "estructuraPsiquica",
      "estructuraPsicologica",
      "evolucionColectiva",
      "evolucionParticular",
      "identidadDelSistemaSolar",
      "registroCivilDelSistemaSolar",
      "comunicacionMultidimensional",
      "identidadMultipleEscala",
      "cajasSemanticasEnCadaEscala",
      "plano",
      "falla",
      "error",
      "dimension",
      "interesParticular",
      "humanoProyectoDelSistemaSolar",
      "vuelta10CaptacionDeLaTotalidad",
      "perspectivaGlobal2022",
      "cuarentenaGlobal3730",
      "dilema",
      "codificacionPropia",
      "codificacionDelOtro",
      "cerebroSolar",
      "fundacionDelAparato507",
      "contruirQuietudInterna"
    ],
    "snippet": "68AleEnRed68docx",
    "content": "AlejandraCasadoenRed 68\n02.06.2022\nvuelta 10\nTranscripción\n68AleEnRed68docx\n#junio2De2023\n#indice68\n#vuelta10\n#periodoEvolutivo\n#cajasSemanticas   #cajasDialecticas\n#concienciaSocial #restriccionesAusentes\n#estructuraPsiquica #estructuraPsicologica\n#evolucionColectiva #evolucionParticular\n#identidadDelSistemaSolar\n#registroCivilDelSistemaSolar\n#comunicacionMultidimensional\n#identidadMultipleEscala\n#cajasSemanticasEnCadaEscala\n#plano #falla #error #dimension\n#interesParticular\n#humanoProyectoDelSistemaSolar\n#vuelta10CaptacionDeLaTotalidad\n#perspectivaGlobal2022\n#cuarentenaGlobal3730\n#dilema\n#codificacionPropia\n#codificacionDelOtro\n#cerebroSolar\n#fundacionDelAparato507\n#contruirQuietudInterna\n",
    "pdfPage": 49
  },
  {
    "num": 69,
    "date": "10.06.2022",
    "dateISO": "2022-06-10",
    "vuelta": 11,
    "freq": "",
    "url": "",
    "tags": [
      "junio2De2023",
      "indice68",
      "vuelta10",
      "periodoEvolutivo",
      "cajasSemanticas",
      "cajasDialecticas",
      "concienciaSocial",
      "restriccionesAusentes",
      "estructuraPsiquica",
      "estructuraPsicologica",
      "evolucionColectiva",
      "evolucionParticular",
      "identidadDelSistemaSolar",
      "registroCivilDelSistemaSolar",
      "comunicacionMultidimensional",
      "identidadMultipleEscala",
      "cajasSemanticasEnCadaEscala",
      "plano",
      "falla",
      "error",
      "dimension",
      "interesParticular",
      "humanoProyectoDelSistemaSolar",
      "vuelta10CaptacionDeLaTotalidad",
      "perspectivaGlobal2022",
      "cuarentenaGlobal3730",
      "dilema",
      "codificacionPropia",
      "codificacionDelOtro",
      "cerebroSolar",
      "fundacionDelAparato507",
      "contruirQuietudInterna"
    ],
    "snippet": "68AleEnRed68docx",
    "content": "AlejandraCasadoenRed 69\n10.06.2022\nvuelta 11\nTranscripción\n68AleEnRed68docx\n#junio2De2023\n#indice68\n#vuelta10\n#periodoEvolutivo\n#cajasSemanticas   #cajasDialecticas\n#concienciaSocial #restriccionesAusentes\n#estructuraPsiquica #estructuraPsicologica\n#evolucionColectiva #evolucionParticular\n#identidadDelSistemaSolar\n#registroCivilDelSistemaSolar\n#comunicacionMultidimensional\n#identidadMultipleEscala\n#cajasSemanticasEnCadaEscala\n#plano #falla #error #dimension\n#interesParticular\n#humanoProyectoDelSistemaSolar\n#vuelta10CaptacionDeLaTotalidad\n#perspectivaGlobal2022\n#cuarentenaGlobal3730\n#dilema\n#codificacionPropia\n#codificacionDelOtro\n#cerebroSolar\n#fundacionDelAparato507\n#contruirQuietudInterna\n",
    "pdfPage": 50
  },
  {
    "num": 70,
    "date": "26.06.2022",
    "dateISO": "2022-06-26",
    "vuelta": 12,
    "freq": "",
    "url": "",
    "tags": [],
    "snippet": "70.- ALE",
    "content": "AlejandraCasadoenRed 70\n26.06.2022\nvuelta 12\nTranscripción\n70.- ALE\nEN RED 70 - 26/6/2022 - VUELTA 12\n# Origen destino - Procesador\n#  Prototipo primeras 11 vueltas- segundas 11 vueltas\n#  Caja - Esquema 12-21\n#  Carga - Ruta\n#  Objeto biológico- Sujeto biológico\n#  Proyecto humano sistema solar\n#  Integración - Interactividad\n#  Mundo Propio - Mundo colectivo\n#  Configuración compleja SO - Especie Humana SE\n#  Zonar - Efecto de Antena\n#  Configuración Cod. nativo\n#  Aparato Psíquico - Estructura física - psicología Psíquica\n#  Realidad codificada - Tecnología\n#  Realidad interactiva - Marco sistema solar\n#  Procesador - Aspecto subatómico atómico\n#  Cono Cimiento - cono psiquismo cimiento archivo\n#  La realidad tiene alcance\n#  Señal en estado puro - Señal educativa amplia\n#  Científicos - Cambio constitución del segundo\n#  Segundo intercalar 2016 - Calendaria 2017\n#  Pedro - Petro\n#  Humano mejor nexo - Distintos tiempos mismo espacio\n#  Dificultades - Facultades\n#  Fallas y faltas - Registros\n#  352 al 353 - Alimentar al procesador\n#  Proyecto nativo humano - Prolongaciones\n#  Espacio tiempo - Mejora",
    "pdfPage": 51
  },
  {
    "num": 71,
    "date": "12.07.2022",
    "dateISO": "2022-07-12",
    "vuelta": 13,
    "freq": "",
    "url": "",
    "tags": [],
    "snippet": "71.- ALE",
    "content": "AlejandraCasadoenRed 71\n12.07.2022\nvuelta 13\nTranscripción\n71.- ALE\nEN RED 71 - 12/7/2022 - VUELTA 13\n#  El otro que no soy yo funcionando\n#  Distanciamiento - Integración\n#  Perspectivas globales distintas\n#  Estructura psíquica - Estructura física\n#  Estructura psicológica - Preservación del ámbito\n#  Reconfiguración reactivos\n#  Realidad - Mundo\n#  Interdependencia\n#  Cuarentena global 3558\n#  La caja - La existencia es una fabricación\n#  Proyección evolutiva - Proyección física\n#  Lectores habidos - Diferenciar escalas\n#  Técnico-ambito  - Ubicación de un relato\n#  Documentación - Fallas y falta\n#   Funcionamiento social - funcionamiento particular\n#  Identificar variables de entorno",
    "pdfPage": 52
  },
  {
    "num": 72,
    "date": "28.07.2022",
    "dateISO": "2022-07-28",
    "vuelta": 14,
    "freq": "",
    "url": "",
    "tags": [
      "AleEnRed72",
      "indice72",
      "28deJulio2022",
      "vuelta14",
      "vuelta3AccionesDeLosOtros",
      "independenciaPeru",
      "modeloVuelta14",
      "fallasYFaltas",
      "confianza",
      "desconfianza",
      "atentoAlCodigoDelOtro",
      "atentoAlCodigoPropio",
      "anatomiaDelAño",
      "reportes",
      "cardinalidades",
      "confeccionandoEstructuraPsiquica",
      "espacioEntreMenteYCuerpo",
      "crearMejora",
      "primeraGuerraMundial",
      "estructuraPsicologicaMasRobusta",
      "listaDeTareas",
      "fallasFaltas",
      "documentacion",
      "octavaDeRespaldo",
      "cardinalidadSe",
      "logicaNoPropia",
      "espacioParaLogicaNoPropia",
      "vuelta14AnatomiaDelAño",
      "movimientoDelOtro",
      "nuevoTablero",
      "lupaOReactividad",
      "mejoraSobreBaseImperfecta",
      "jabalina",
      "pararrayos",
      "construccionDeOctava",
      "orbital8",
      "neptunoRegistroCivilDelSistemaSolar",
      "diosSocial",
      "diosLgc",
      "vuelta14ConfiguracionDelTablero",
      "recepcionVuelta15"
    ],
    "snippet": "72.- Ale",
    "content": "AlejandraCasadoenRed 72\n28.07.2022\nvuelta 14\nTranscripción\n72.- Ale\nen Red 72 docx\n#AleEnRed72\n#indice72\n#28deJulio2022\n#vuelta14\n#vuelta3AccionesDeLosOtros\n#independenciaPeru\n#modeloVuelta14\n#fallasYFaltas\n#confianza #desconfianza\n#atentoAlCodigoDelOtro\n#atentoAlCodigoPropio\n#anatomiaDelAño #reportes #cardinalidades\n#confeccionandoEstructuraPsiquica\n#espacioEntreMenteYCuerpo\n#crearMejora\n#primeraGuerraMundial\n#estructuraPsicologicaMasRobusta\n#listaDeTareas #fallasFaltas\n#documentacion\n#octavaDeRespaldo\n#cardinalidadSe #logicaNoPropia\n#espacioParaLogicaNoPropia\n#vuelta14AnatomiaDelAño\n#movimientoDelOtro\n#nuevoTablero\n#lupaOReactividad\n#mejoraSobreBaseImperfecta\n#jabalina #pararrayos\n#construccionDeOctava\n#orbital8\n#neptunoRegistroCivilDelSistemaSolar\n#diosSocial #diosLgc\n#vuelta14ConfiguracionDelTablero\n#recepcionVuelta15\n",
    "pdfPage": 52
  },
  {
    "num": 73,
    "date": "13.08.2022",
    "dateISO": "2022-08-13",
    "vuelta": 15,
    "freq": "",
    "url": "",
    "tags": [
      "AleEnRed73",
      "indice73",
      "13deAgosto2022",
      "vuelta15",
      "anatomiaDelAño",
      "cuarentena93",
      "concienciaDelOtroNoYo",
      "concienciaSocial",
      "reconstruccionDePercepcionGlobal",
      "recodificacionDeAntenaEn2023",
      "actualizacionDeLaEspecieHumana",
      "2022aVistaTodosLosModelos",
      "reportesDeFallasYFaltasEn2022",
      "espejo20122021",
      "realidadAudita",
      "aparatoPsiquico",
      "antenaConfiguraEnLimite",
      "estructuraCoordina",
      "mundo",
      "entorno",
      "broteEnCulturaSocial",
      "aspectoNoLineal",
      "EspecieHumana",
      "ReinoMineral",
      "tecnologiasNativas",
      "cuarentena93Precaucion",
      "propiaAgenda20122021",
      "MensajeDeRealidad",
      "miradaRetro",
      "puestaEnValor",
      "ojoDelHuracan",
      "focoDelObservador",
      "aspectoNativo",
      "codigo",
      "izquierda",
      "Derecha",
      "talento",
      "Subatomica",
      "codigoFallado",
      "Antena",
      "Estructu",
      "error",
      "funcionAntena",
      "registrarFalencias20122021",
      "c",
      "traductor",
      "interprete",
      "especiePlanificada",
      "reporteDiario",
      "secuenciacionDeLaAnatomiaDelAño",
      "reactivos",
      "metricas",
      "asumirPeorVersion",
      "ambit",
      "mejorarLaEspecie",
      "espacio",
      "tiempo",
      "cualidadAlMismoEspacio",
      "archivosDelPasado",
      "cargaGravitatoria",
      "autoreferencia",
      "agenda20122021",
      "buenosYmalos",
      "paradigmaObsoleto",
      "pasadoCongelado",
      "argumento",
      "archiv",
      "actualizacionInmediataOneLine",
      "mejoraDiaria",
      "memoriaRam",
      "memoria",
      "estructuraPsiquica",
      "especieAlServicioDeTodasLasRazas",
      "conectividadConTodo",
      "propositoMayor",
      "mejorFuturo",
      "anatomiaConstructiva",
      "vuelta15BisagraLo",
      "incluyoConcienciaDeOtroNoYo"
    ],
    "snippet": "73.- Ale spectiva #puestaEnValor #ojoDelHuracan #focoDelObservador #aspectoNativo #codigo Nacido",
    "content": "AlejandraCasadoenRed 73\n13.08.2022\nvuelta 15\nTranscripción\n73.- Ale\nen Red 73\n#AleEnRed73\n#indice73\n#13deAgosto2022\n#vuelta15\n#anatomiaDelAño\n#cuarentena93\n#concienciaDelOtroNoYo #concienciaSocial\n#reconstruccionDePercepcionGlobal\n#recodificacionDeAntenaEn2023\n#actualizacionDeLaEspecieHumana\n#2022aVistaTodosLosModelos\n#reportesDeFallasYFaltasEn2022\n#espejo20122021 #realidadAudita #aparatoPsiquico\n#antenaConfiguraEnLimite\n#estructuraCoordina\n#mundo #entorno #broteEnCulturaSocial #aspectoNoLineal #EspecieHumana\n#ReinoMineral #tecnologiasNativas\n#cuarentena93Precaucion #propiaAgenda20122021 #MensajeDeRealidad #miradaRetro\nspectiva #puestaEnValor #ojoDelHuracan #focoDelObservador #aspectoNativo #codigo\nNacido\n#izquierda #Derecha #talento #Subatomica #codigoFallado #entorno #Antena #Estructu\nrasEspacioTemporales #error #funcionAntena  #mundo #registrarFalencias20122021 #c\nienciasDurasCienciasBlandas #traductor #interprete #especiePlanificada #reporteDiario\n#secuenciacionDeLaAnatomiaDelAño #reactivos #metricas #asumirPeorVersion #ambit\no #mejorarLaEspecie #espacio #tiempo #cualidadAlMismoEspacio #archivosDelPasado\n #cargaGravitatoria #autoreferencia #agenda20122021 #ojoDelHuracan\n#buenosYmalos #paradigmaObsoleto #pasadoCongelado #metricas #argumento #archiv\nosAdecuados #actualizacionInmediataOneLine #mejoraDiaria #memoriaRam #memoria\nRom #estructuraPsiquica #especieAlServicioDeTodasLasRazas #conectividadConTodo\nElUniverso #propositoMayor #mejorFuturo #anatomiaConstructiva #vuelta15BisagraLo\ngica #incluyoConcienciaDeOtroNoYo\n",
    "pdfPage": 53
  },
  {
    "num": 74,
    "date": "31.08.2022",
    "dateISO": "2022-08-31",
    "vuelta": 16,
    "freq": "",
    "url": "",
    "tags": [
      "AleEnRed74",
      "indice74",
      "31deAgosto2022",
      "vuelta16",
      "nuevasPosibilidades",
      "dominioYControl",
      "alcance",
      "regulaciones",
      "autoregulacion",
      "anatomiaDelAño",
      "deciciones",
      "limitacion",
      "memoriaROM",
      "cuartaCardinalidad",
      "faltaFalla",
      "ajustes",
      "control",
      "dominio",
      "lasTresPsiquis",
      "equilibrioFiscal",
      "acreedorDeudor",
      "somaDeLaRealidad",
      "codigoMoral",
      "reparametrizacionAntena2023",
      "proyectoHumano",
      "entorno",
      "cajaDeResonanciaDelEspacioTiempo",
      "estadoDeGracia",
      "balanceFiscal",
      "saltoEvolutivo",
      "facultad",
      "habilidad",
      "dificultad",
      "actualizacion",
      "rayo",
      "dios",
      "arquetipo",
      "realidad",
      "quintoPlano",
      "quintaDimension",
      "noLinealidad",
      "psiquismo",
      "proposito",
      "codigoTerritorio",
      "frecuenciaSolarPositivaNegativa",
      "nacidoNativo",
      "modoOfuscado",
      "foco",
      "derivacion",
      "hipertiroidismoHipotiroidismo",
      "estabilidad"
    ],
    "snippet": "74.- Ale",
    "content": "AlejandraCasadoenRed 74\n31.08.2022\nvuelta 16\nTranscripción\n74.- Ale\nen Red 74 docx\n#AleEnRed74\n#indice74\n#31deAgosto2022\n#vuelta16\n#nuevasPosibilidades\n#dominioYControl\n#alcance\n#regulaciones #autoregulacion\n#anatomiaDelAño\n#deciciones #limitacion\n#memoriaROM\n#cuartaCardinalidad\n#faltaFalla\n#ajustes #control #dominio\n#lasTresPsiquis\n#equilibrioFiscal #acreedorDeudor\n#somaDeLaRealidad\n#codigoMoral\n#reparametrizacionAntena2023\n#proyectoHumano\n#entorno #cajaDeResonanciaDelEspacioTiempo\n#estadoDeGracia\n#balanceFiscal\n#saltoEvolutivo\n#facultad #habilidad #dificultad\n#actualizacion\n#rayo #dios #arquetipo\n#entorno #realidad\n#quintoPlano #quintaDimension\n#noLinealidad #psiquismo\n#proposito\n#codigoTerritorio\n#frecuenciaSolarPositivaNegativa\n#nacidoNativo #modoOfuscado #foco\n#derivacion #hipertiroidismoHipotiroidismo\n#estabilidad\n",
    "pdfPage": 54
  },
  {
    "num": 75,
    "date": "14.09.2022",
    "dateISO": "2022-09-14",
    "vuelta": 17,
    "freq": "",
    "url": "",
    "tags": [
      "AleEnRed75",
      "indice75",
      "14deSetiembre2022",
      "vuelta17Año2022",
      "año2022Vuelta17LimiteDesarrollo",
      "puestaEnValor",
      "dominioDeLaRealidad",
      "aporteCorberaGarnierAlejandraCasado",
      "proyectoHumanoDesarrollo",
      "capacidadDeCapitalizarLoRecibido",
      "huellaVuelta16Y17Año2022",
      "ReinaIsabelFallecimiento",
      "facultadesReactivas",
      "capitalizacion",
      "conflicto380Con7",
      "proyectoSol",
      "marteEstaParaAmarte",
      "lgcRecursoParaEspecieHumana",
      "CalendariaPrototipadoBase16Dia256",
      "diaDelProgramador",
      "diaDelBibliotecarioTareaDilema",
      "bibliotecaCongresoDeEstadosUnidos",
      "destruccionReconstruccionAutodesmantelamiento",
      "construcciónNacido",
      "socializacion",
      "mentalidadSocial",
      "deuda",
      "deudoresDeLaSociedad",
      "deudaConLaSociedad",
      "cristinaKirchnerTomaDeuda",
      "cuarentena94ID",
      "diaDianaSpencer",
      "retrospectivaDesde2012Al2021",
      "tareaEnDestino",
      "tareaEnOrigen",
      "anatomiaDelAño",
      "cerebroDelAño",
      "CuerpoDelAño",
      "aparatosVivosAp504Ap505Ap506",
      "capital",
      "particulaSubatomicaDesarrollo"
    ],
    "snippet": "75.-Ale",
    "content": "AlejandraCasadoenRed 75\n14.09.2022\nvuelta 17\nTranscripción\n75.-Ale\nen Red 75\n#AleEnRed75\n#indice75\n#14deSetiembre2022\n#vuelta17Año2022\n#año2022Vuelta17LimiteDesarrollo\n#puestaEnValor\n#dominioDeLaRealidad\n#aporteCorberaGarnierAlejandraCasado\n#proyectoHumanoDesarrollo\n#capacidadDeCapitalizarLoRecibido\n#huellaVuelta16Y17Año2022\n#ReinaIsabelFallecimiento\n#facultadesReactivas\n#capitalizacion\n#conflicto380Con7\n#proyectoSol\n#marteEstaParaAmarte\n#lgcRecursoParaEspecieHumana\n#CalendariaPrototipadoBase16Dia256\n#diaDelProgramador\n#diaDelBibliotecarioTareaDilema\n#bibliotecaCongresoDeEstadosUnidos\n#destruccionReconstruccionAutodesmantelamiento\n#construcciónNacido\n#socializacion\n#mentalidadSocial\n#deuda\n#deudoresDeLaSociedad\n#deudaConLaSociedad\n#cristinaKirchnerTomaDeuda\n#cuarentena94ID\n#diaDianaSpencer\n#retrospectivaDesde2012Al2021\n#tareaEnDestino\n#tareaEnOrigen\n#anatomiaDelAño\n#cerebroDelAño\n#CuerpoDelAño\n#aparatosVivosAp504Ap505Ap506\n#capital\n#particulaSubatomicaDesarrollo\n",
    "pdfPage": 55
  },
  {
    "num": 76,
    "date": "30.09.2022",
    "dateISO": "2022-09-30",
    "vuelta": 18,
    "freq": "",
    "url": "",
    "tags": [
      "AleEnRed76",
      "indice76",
      "30deSetiembre2022",
      "vuelta18Año2022",
      "año2022Vuelta18Descripcion",
      "acreedorODeudorDeLaRealidad",
      "capitalizar",
      "gaiaTierraPerspectivas",
      "impresion3D",
      "derechosEternos",
      "derechosTemporalesCondicionales",
      "base12Base21",
      "gaiaConcretoInconcretoAbstracto",
      "dificultad",
      "tiempo",
      "espacio",
      "orbital",
      "aparatoDesarrollo",
      "calendarioSolar",
      "aparato396",
      "transacciones",
      "atentadoCristinaFernandez",
      "instanciaInstructiva",
      "diaSolarNativoExplicacion",
      "fernandoMontiel",
      "cristinaFernandez",
      "diasNativosDesarrollo",
      "eraAgregoriano",
      "aparato386Ap396PerspectivaMayor"
    ],
    "snippet": "76.- Ale",
    "content": "AlejandraCasadoenRed 76\n30.09.2022\nvuelta 18\nTranscripción\n76.- Ale\nen Red 76\n#AleEnRed76\n#indice76\n#30deSetiembre2022\n#vuelta18Año2022\n#año2022Vuelta18Descripcion\n#acreedorODeudorDeLaRealidad\n#capitalizar\n#gaiaTierraPerspectivas\n#impresion3D\n#derechosEternos\n#derechosTemporalesCondicionales\n#base12Base21\n#gaiaConcretoInconcretoAbstracto\n#dificultad\n#tiempo\n#espacio\n#orbital\n#aparatoDesarrollo\n#calendarioSolar\n#aparato396\n#transacciones\n#atentadoCristinaFernandez\n#instanciaInstructiva\n#diaSolarNativoExplicacion\n#fernandoMontiel\n#cristinaFernandez\n#diasNativosDesarrollo\n#eraAgregoriano\n#aparato386Ap396PerspectivaMayor",
    "pdfPage": 56
  },
  {
    "num": 77,
    "date": "17.10.2022",
    "dateISO": "2022-10-17",
    "vuelta": 19,
    "freq": "",
    "url": "",
    "tags": [
      "vuelta19",
      "vuelta8DelOtro",
      "nativo",
      "nacido",
      "base21",
      "caidaDeFicha",
      "octavaSocial",
      "octavaNativa",
      "octavaGravitatoria",
      "incremento",
      "noMapeado",
      "control",
      "dominio",
      "conexionInterna",
      "autodominio",
      "defecto",
      "anclaCruzada",
      "base12",
      "calendarioSolar",
      "eventoUnica",
      "rayoCosmico",
      "andromeda2511",
      "programador",
      "bibliotecario",
      "señalEducativa",
      "fuenteExterna",
      "baseConceptual",
      "filtroDeValor",
      "creditoDeTerritorio",
      "gaia",
      "relativo",
      "absoluto",
      "orbital3",
      "contexto",
      "entorno",
      "limite",
      "alcance",
      "derivar"
    ],
    "snippet": "vuelta19, vuelta8DelOtro, nativo, nacido, base21, caidaDeFicha, octavaSocial, octavaNativa",
    "content": "AlejandraCasadoenRed 77\n17.10.2022\nvuelta 19\nTranscripción\n#\nEN RED 77\n#vuelta19\n#vuelta8DelOtro\n#nativo\n#nacido\n#base21\n#caidaDeFicha\n#octavaSocial\n#octavaNativa\n#octavaGravitatoria\n#incremento\n#noMapeado\n#control\n#dominio\n#conexionInterna\n#autodominio\n#defecto\n#anclaCruzada\n#base12\n#calendarioSolar\n#eventoUnica\n#rayoCosmico\n#andromeda2511\n#programador\n#bibliotecario\n#señalEducativa\n#fuenteExterna\n#baseConceptual\n#filtroDeValor\n#creditoDeTerritorio\n#gaia\n#relativo\n#absoluto\n#orbital3\n#contexto\n#entorno\n#limite\n#alcance\n#derivar\n",
    "pdfPage": 56
  },
  {
    "num": 78,
    "date": "02.11.2022",
    "dateISO": "2022-11-02",
    "vuelta": 20,
    "freq": "",
    "url": "",
    "tags": [
      "vuelta20",
      "fallas",
      "faltas",
      "definicion",
      "ancla",
      "ram",
      "rem",
      "rom",
      "rum",
      "señal",
      "interprete",
      "rombo",
      "bibliotecario",
      "programador",
      "nacido",
      "nativo",
      "doble",
      "revalida",
      "pactos",
      "circuitoAbierto",
      "circuitoCerrado",
      "modular",
      "documentar",
      "cono",
      "cimiento",
      "santos",
      "muertos",
      "vivos",
      "despiertos",
      "dilemas",
      "retracción",
      "error",
      "octavaGravitatoria",
      "gaia",
      "caja",
      "ambito",
      "errar",
      "mapear",
      "clonar",
      "perdonar",
      "interpretar",
      "serHumano",
      "capacidadReflexiva",
      "dominio",
      "instrumentar",
      "especie",
      "credito",
      "clan",
      "notasMusicales",
      "si",
      "sol",
      "fa",
      "mi",
      "re",
      "do",
      "la",
      "alcance",
      "consumir",
      "usuario",
      "algo"
    ],
    "snippet": "vuelta20, fallas, faltas, definicion, ancla, ram, rem, rom",
    "content": "AlejandraCasadoenRed 78\n02.11.2022\nvuelta 20\nTranscripción\n#\nenRed78\n#vuelta20\n#fallas\n#faltas\n#definicion\n#ancla\n#ram\n#rem\n#rom\n#rum\n#señal\n#interprete\n#rombo\n#bibliotecario\n#programador\n#nacido\n#nativo\n#doble\n#revalida\n#pactos\n#circuitoAbierto\n#circuitoCerrado\n#modular\n#documentar\n#cono\n#cimiento\n#santos\n#muertos\n#vivos\n#despiertos\n#dilemas\n#retracción\n#error\n#octavaGravitatoria\n#gaia\n#caja\n#ambito\n#errar\n#mapear\n#clonar\n#perdonar\n#interpretar\n#serHumano\n#documentar\n#capacidadReflexiva\n#dominio\n#instrumentar\n#especie\n#credito\n#clan\n#notasMusicales\n#si\n#sol\n#fa\n#mi\n#re\n#do\n#la\n#alcance\n#consumir\n#usuario\n#algo\n",
    "pdfPage": 57
  },
  {
    "num": 79,
    "date": "17.11.2022",
    "dateISO": "2022-11-17",
    "vuelta": 21,
    "freq": "",
    "url": "",
    "tags": [
      "vuelta",
      "base21",
      "creacionBinaria",
      "creacionDomestica",
      "base21Social",
      "horizontalizar",
      "identificación",
      "señalSutil",
      "octavaDomestica",
      "estructuraPsiquica",
      "5dimension",
      "cualidadAbsoluta",
      "instanciaRelativa",
      "condicionRelativa",
      "desdoblamiento",
      "funcionPer",
      "inconscienteBiologico",
      "administracionRemota",
      "recepcionDeSeñales",
      "octava",
      "codigo351",
      "calendarioSolar",
      "posicionGravitatoria",
      "concienciaGravitatoria",
      "alcidesCarrion",
      "ram",
      "rem",
      "rom",
      "rum",
      "concienciaSolar",
      "menteSolar",
      "relativa",
      "absoluta",
      "exclusivo",
      "inclusivo",
      "5etapa",
      "fundar",
      "usuario",
      "universoExpresadoCivilizado",
      "construccionBinaria",
      "ejeY",
      "ro",
      "navegabilidadDeOctava",
      "interpretar",
      "autoReferencia",
      "sellado",
      "proyección",
      "defecto",
      "clonar",
      "anclaPropia",
      "anclaCruzada"
    ],
    "snippet": "vuelta, base21, creacionBinaria, creacionDomestica, base21Social, horizontalizar, identificación, señalSutil",
    "content": "AlejandraCasadoenRed 79\n17.11.2022\nvuelta 21\nTranscripción\n#\nenRed79\n#vuelta 21\n#base21\n#creacionBinaria\n#creacionDomestica\n#base21Social\n#horizontalizar\n#identificación\n#señalSutil\n#octavaDomestica\n#estructuraPsiquica\n#5dimension\n#cualidadAbsoluta\n#instanciaRelativa\n#condicionRelativa\n#desdoblamiento\n#funcionPer\n#inconscienteBiologico\n#administracionRemota\n#recepcionDeSeñales\n#octava\n#codigo351\n#calendarioSolar\n#posicionGravitatoria\n#concienciaGravitatoria\n#alcidesCarrion\n#ram\n#rem\n#rom\n#rum\n#concienciaSolar\n#menteSolar\n#relativa\n#absoluta\n#exclusivo\n#inclusivo\n#5etapa\n#fundar\n#usuario\n#universoExpresadoCivilizado\n#construccionBinaria\n#menteSolar\n#ejeY\n#ro\n#navegabilidadDeOctava\n#interpretar\n#autoReferencia\n#sellado\n#proyección\n#defecto\n#clonar\n#anclaPropia\n#anclaCruzada\n",
    "pdfPage": 59
  },
  {
    "num": 80,
    "date": "03.12.2022",
    "dateISO": "2022-12-03",
    "vuelta": 22,
    "freq": "",
    "url": "",
    "tags": [
      "indice80",
      "Dic22De2022",
      "vuelta22",
      "memoriasRamRemRomRum",
      "RemRolProgramador",
      "RomRolBibliotecario",
      "peruanizarbajafrecuencia",
      "22885taEtapa",
      "EstructurasEspaciosTemporales373",
      "FátimaApariciónMundialDeFútbol1930",
      "AdultosMayoresDelEspacioTiempo369",
      "ManifiestoSerie828",
      "DilemasLemas",
      "Procesador353",
      "ancla",
      "fallas",
      "CalendariaCuadrantes",
      "espejo",
      "Estático96Dinámico69",
      "Aparato493",
      "PuertaPública80",
      "fábula",
      "MenteConciencia",
      "Derechos",
      "Amor"
    ],
    "snippet": "indice80, Dic22De2022, vuelta22, memoriasRamRemRomRum, RemRolProgramador, RomRolBibliotecario, peruanizarbajafrecuencia, 22885taEtapa",
    "content": "AlejandraCasadoenRed 80\n03.12.2022\nvuelta 22\nTranscripción\n#indice80\n#Dic22De2022\n#vuelta22.2022\n#memoriasRamRemRomRum\n#RemRolProgramador\n#RomRolBibliotecario\n#peruanizarbajafrecuencia\n#22885taEtapa\n#EstructurasEspaciosTemporales373\n#FátimaApariciónMundialDeFútbol1930\n#AdultosMayoresDelEspacioTiempo369\n#ManifiestoSerie828\n#DilemasLemas\n#Procesador353\n#ancla\n#fallas\n#CalendariaCuadrantes\n#espejo\n#Estático96Dinámico69\n#Aparato493\n#PuertaPública80\n#fábula\n#MenteConciencia\n#Derechos\n#Amor",
    "pdfPage": 60
  },
  {
    "num": 81,
    "date": "19.12.2022",
    "dateISO": "2022-12-19",
    "vuelta": null,
    "freq": "",
    "url": "",
    "tags": [
      "indice81",
      "Dic19De2022",
      "vuelta23AnillodeFuego2022",
      "81Tiempo",
      "codigofresco",
      "Messi",
      "digital",
      "analógica",
      "ideas",
      "octava",
      "concepto",
      "SanMartin",
      "escalabilidadDeLaConciencia",
      "ScaloniLionel",
      "aparato525",
      "octavaSocial",
      "prototiparMemorias",
      "especieHumana",
      "generohumano",
      "complementariedad",
      "LogicaGravitatoria",
      "LogicaConceptual",
      "dia353",
      "dia354",
      "posicionesDelReloj",
      "código828Manifiesto"
    ],
    "snippet": "Anillo de Fuego",
    "content": "AlejandraCasadoenRed 81\n19.12.2022\nAnillo de Fuego\nTranscripción\n#indice81\n#Dic19De2022\n#vuelta23AnillodeFuego2022\n#81Tiempo\n#codigofresco\n#Messi\n#digital\n#analógica\n#ideas\n#octava digital\n#concepto\n#SanMartin\n#escalabilidadDeLaConciencia\n#ScaloniLionel\n#aparato525\n#octavaSocial\n#prototiparMemorias\n#especieHumana\n#generohumano\n#complementariedad\n#LogicaGravitatoria\n#LogicaConceptual\n#dia353\n#dia354\n#posicionesDelReloj\n#código828Manifiesto\n",
    "pdfPage": 60
  },
  {
    "num": 82,
    "date": "01.01.2023",
    "dateISO": "2023-01-01",
    "vuelta": 1,
    "freq": "",
    "url": "",
    "tags": [
      "Indice82",
      "Enero1De2023",
      "vuelta1",
      "captacion",
      "256Dia",
      "DíaDelBibliotecario",
      "DiaDelProgramador",
      "personaje",
      "persona",
      "BabaVanga",
      "horizonteDeSucesos",
      "cono",
      "cimiento",
      "aparato500",
      "ancla",
      "manifiesto",
      "rayoCosmico",
      "logicaConceptual",
      "logicaGravitatoria",
      "objetoBiologico",
      "sujetoAnatomico",
      "UniversoExpresadoCivilizado",
      "antenasBiologicas",
      "nacido",
      "nativo",
      "errorNativo",
      "aparatos400",
      "ocurrencia"
    ],
    "snippet": "82.-AleEnRed82.docx",
    "content": "Alejandra Casado\nen Red 82\n01.01.2023\nvuelta 01\nTranscripción\n82.-AleEnRed82.docx\n#Indice82\n#Enero1De2023\n#vuelta1-2023\n#captacion\n#256Dia\n#DíaDelBibliotecario\n#DiaDelProgramador\n#personaje\n#persona\n#BabaVanga\n#horizonteDeSucesos\n#cono\n#cimiento\n#aparato500\n#ancla\n#manifiesto\n#rayoCosmico\n#logicaConceptual\n#logicaGravitatoria\n#objetoBiologico\n#sujetoAnatomico\n#UniversoExpresadoCivilizado\n#antenasBiologicas\n#nacido\n#nativo\n#errorNativo\n#aparatos400\n#ocurrencia\n",
    "pdfPage": 61
  },
  {
    "num": 83,
    "date": "17.01.2023",
    "dateISO": "2023-01-17",
    "vuelta": 2,
    "freq": "",
    "url": "",
    "tags": [
      "AleEnRed83",
      "indice83",
      "17deEnero2023",
      "vuelta2Año2023",
      "lógicaGlobalConvergente",
      "captación",
      "señalEducativa",
      "Sol",
      "planeta",
      "conflictos",
      "dilemas",
      "solCalificaciónTarea",
      "campoSíquico",
      "procesoEvolutivoDeSol",
      "capacidades",
      "habilidades",
      "objetoBiológico",
      "efectoLupa",
      "serieManifiesto",
      "rayo",
      "conopasajeros",
      "cimientoTierra",
      "conflicto",
      "código828",
      "octavagravitatoria",
      "octavaDigital",
      "distracción",
      "retracción",
      "lgcCaptación",
      "zonaMudaWernicke",
      "conceptos",
      "inicioCalendarioLgc",
      "temasComoDilema",
      "espacioDelDilema",
      "horizontesDeSucesos",
      "eventoUnico",
      "2aLaDoce",
      "vidaGravitatoria",
      "cuarentena97Año2023",
      "valorALoRustico"
    ],
    "snippet": "83.- Ale",
    "content": "Alejandra Casado\nEN RED 83\n17.01.2023\nVuelta 2\nTranscripción\n83.- Ale\nen Red 83\n#AleEnRed83\n#indice83\n#17deEnero2023\n#vuelta2Año2023\n#lógicaGlobalConvergente #captación #señalEducativa\n#Sol #planeta\n#conflictos #dilemas\n#solCalificaciónTarea\n#campoSíquico\n#procesoEvolutivoDeSol\n#conflictos #capacidades #habilidades #objetoBiológico #efectoLupa\n#serieManifiesto #rayo #conopasajeros #cimientoTierra #conflicto\n#código828 #octavagravitatoria #octavaDigital\n#distracción\n#retracción\n#lgcCaptación #zonaMudaWernicke #conceptos\n#inicioCalendarioLgc\n#temasComoDilema\n#espacioDelDilema\n#horizontesDeSucesos\n#eventoUnico #2aLaDoce\n#vidaGravitatoria\n#octavaGravitatoria\n#cuarentena97Año2023\n#valorALoRustico",
    "pdfPage": 62
  },
  {
    "num": 84,
    "date": "02.02.2023",
    "dateISO": "2023-02-02",
    "vuelta": 3,
    "freq": "",
    "url": "",
    "tags": [
      "AleEnRed84",
      "indice84",
      "2deFebrero2023",
      "vuelta3Año2023",
      "orbitales",
      "planeta",
      "año",
      "objetivoDeLaLgc",
      "código2023",
      "anilloDeFuego2022",
      "retracción",
      "sobregiro",
      "exámenDeSol",
      "calificación",
      "evolución",
      "dilemaHumano",
      "trazabilidad",
      "conflictosHipotéticos",
      "códigoFresco",
      "concienciaMenteSolar",
      "modoDilema",
      "errorComoSistemaDeNavegación",
      "identidadAnalógica",
      "identidadDigital",
      "estrés",
      "calendarioLgcExplicaciónBreve"
    ],
    "snippet": "84.- Ale",
    "content": "Alejandra Casado\nEN RED 84\n02.02.2023\nvuelta 3\nTranscripción\n84.- Ale\nen Red 84\n#AleEnRed84\n#indice84\n#2deFebrero2023\n#vuelta3Año2023\n#orbitales #planeta #año\n#objetivoDeLaLgc #código2023\n#anilloDeFuego2022 #retracción #sobregiro\n#exámenDeSol #calificación #evolución\n#dilemaHumano #trazabilidad\n#conflictosHipotéticos\n#códigoFresco #concienciaMenteSolar\n#modoDilema\n#errorComoSistemaDeNavegación\n#identidadAnalógica\n#identidadDigital #estrés\n#calendarioLgcExplicaciónBreve",
    "pdfPage": 62
  },
  {
    "num": 85,
    "date": "20.02.2023",
    "dateISO": "2023-02-20",
    "vuelta": 4,
    "freq": "",
    "url": "",
    "tags": [
      "AleEnRed85",
      "indice85",
      "20deFebrero2023",
      "vuelta4Año2023",
      "emisiónConPúblico",
      "LaCumbreCórdoba",
      "prospectoDelAño",
      "conceptual",
      "gravitatorio",
      "terceraDimensión",
      "reevaluar",
      "pertenenciaAlSistemaSolar",
      "clima",
      "redistribuciónDelSubsidio",
      "vida",
      "constanteDiasDeVida",
      "arteDesdeLgc",
      "configuraciónDeOctava",
      "traumado",
      "traumatizado",
      "año",
      "anclar",
      "criterio",
      "cuarentena97",
      "patrónOro",
      "captaciónDeSeñales",
      "código373",
      "estructurasEspacioTemporales",
      "fundarAparatoPsíquico"
    ],
    "snippet": "85.- Ale",
    "content": "Alejandra Casado\nEN RED 85\n20.02.2023\nvuelta 4\nTranscripción\n85.- Ale\nen Red 85\n#AleEnRed85\n#indice85\n#20deFebrero2023\n#vuelta4Año2023\n#emisiónConPúblico #LaCumbreCórdoba\n#vuelta4Año2023 #prospectoDelAño\n#conceptual #gravitatorio\n#terceraDimensión #reevaluar\n#pertenenciaAlSistemaSolar #clima\n#redistribuciónDelSubsidio #vida\n#constanteDiasDeVida\n#arteDesdeLgc\n#configuraciónDeOctava\n#traumado\n#traumatizado\n#año #anclar #criterio\n#cuarentena97 #patrónOro\n#captaciónDeSeñales\n#código373 #estructurasEspacioTemporales\n#fundarAparatoPsíquico",
    "pdfPage": 63
  },
  {
    "num": 86,
    "date": "06.03.2023",
    "dateISO": "2023-03-06",
    "vuelta": 5,
    "freq": "",
    "url": "",
    "tags": [
      "PlantillaLGC"
    ],
    "snippet": "0:00 - Introducción. Bienvenida y contexto de la transmisión 4:00 - Actualización de la Plantilla LGC 2023: Importancia de las imágenes gráficas 8:00 - Explicación del Eje RI del Tiempo 0",
    "content": "Alejandra Casado\nEN RED 86\n06.03.2023\nvuelta 5\nTranscripción\n0:00 - Introducción. Bienvenida y contexto de la transmisión\n4:00 - Actualización de la Plantilla LGC 2023: Importancia de las imágenes gráficas\n8:00 - Explicación del Eje RI del Tiempo 0\n9:30 - Introducción del Eje RO y su relación con el Entorno\n10:30 - Detalle de la Escala Anatómica y su importancia\n12:00 - Escala SubAtómica 7 y Historia Anatómica -7\n18:00 - Entorno y Especie Humana\n19:00 - La Especie y el El Clan\n23:30 - La Especie Humana: Caja Personal: Reflexiones sobre la emisión y recepción de\nseñales dentro de la caja personal\n25:15 - Fecha de Nacimiento y Fecha de Concepción\n27:30 - Flujo de señales y Alcances, Limites y limitaciones de las Cajas\n37:30 - Caracter Conformante y Deformante\n41:00 - Desdoblamiento Primario y Desdoblamiento Secundario\n01:25:00 - Recreación de una cualidad del Espacio: el tiempo\n#PlantillaLGC\nActualización 2023",
    "pdfPage": 64
  },
  {
    "num": 87,
    "date": "22.03.2023",
    "dateISO": "2023-03-22",
    "vuelta": 6,
    "freq": "",
    "url": "",
    "tags": [
      "AleEnRed87",
      "Vuelta6",
      "Marzo22De2023",
      "V6sistemaReprogramacion",
      "AntenaConoCimiento",
      "EstructuraPsiquica",
      "ProcesamientoDeSeñales",
      "CaracterSimbolico",
      "CaracterTecnico",
      "Emision87OctavaGravitatoria",
      "SeñalesDeEntorno",
      "FallasErroresDeCodigo",
      "EscalaDelConflicto",
      "DilemaLemaDocumentacion",
      "AreaDeBrocaBiblioteca",
      "ElOtroQueNoSoyYo",
      "ZonasReactivas",
      "FlujoDeSeñales",
      "CajaPersonal",
      "SeñalEducativa",
      "EscalaPersonal",
      "EscalaDelEntorno",
      "AspectoSimbolico",
      "AspectoObjetivo",
      "ConflictosDeEntorno",
      "IdentidadImaginaria",
      "IdentidadGravitatoria",
      "AspectoPsiquico",
      "AspectoMaterial",
      "SeñalSutil",
      "SeñalGrotesca",
      "PertenenciaAlSistemaSolar",
      "VidaYMuerte",
      "ConcienciaSubjetiva",
      "ConcienciaObjetiva",
      "EspecieHumanaOrigenEstelar",
      "PoliticosConcienciaSocial",
      "DeDondeLlegaLaSeñal",
      "EscalaInteractiva",
      "CrianzaNativoActual",
      "GeoEgo"
    ],
    "snippet": "AleEnRed87, Vuelta6, Marzo22De2023, V6sistemaReprogramacion, AntenaConoCimiento, EstructuraPsiquica, ProcesamientoDeSeñales, CaracterSimbolico",
    "content": "Alejandra Casado\nEN RED 87\n22.03.2023\nvuelta 6\nTranscripción\n#AleEnRed87\n#Vuelta6\n#Marzo22De2023\n#V6sistemaReprogramacion\n#AntenaConoCimiento\n#EstructuraPsiquica\n#ProcesamientoDeSeñales\n#CaracterSimbolico\n#CaracterTecnico\n#Emision87OctavaGravitatoria\n#SeñalesDeEntorno\n#FallasErroresDeCodigo\n#EscalaDelConflicto\n#DilemaLemaDocumentacion\n#AreaDeBrocaBiblioteca\n#ElOtroQueNoSoyYo\n#ZonasReactivas\n#FlujoDeSeñales\n#CajaPersonal\n#SeñalEducativa\n#EscalaPersonal\n#EscalaDelEntorno\n#AspectoSimbolico\n#AspectoObjetivo\n#ConflictosDeEntorno\n#IdentidadImaginaria\n#IdentidadGravitatoria\n#AspectoPsiquico\n#AspectoMaterial\n#SeñalSutil\n#SeñalGrotesca\n#PertenenciaAlSistemaSolar\n#VidaYMuerte\n#ConcienciaSubjetiva\n#ConcienciaObjetiva\n#EspecieHumanaOrigenEstelar\n#PoliticosConcienciaSocial\n#DeDondeLlegaLaSeñal\n#EscalaInteractiva\n#CrianzaNativoActual\n#GeoEgo\n",
    "pdfPage": 64
  },
  {
    "num": 88,
    "date": "10.04.2023",
    "dateISO": "2023-04-10",
    "vuelta": 7,
    "freq": "",
    "url": "",
    "tags": [
      "AleEnRed88",
      "Vuelta7",
      "Abril10De2023",
      "TerremotoCalifornia",
      "ContenidoContinente",
      "ReceptorMAEntornoPA",
      "TierraReactivoFalla",
      "CodificacionConcienciaMente",
      "AñoSecular1900",
      "CaptacionReinoMineral",
      "TecnologiaCalifornia",
      "FalloMentesGuerra1914",
      "FallaGeoEntorno",
      "DiaNativoACGolpeDeEstado",
      "SociedadAutopercepcion",
      "MargenDeErrorAp396",
      "StatusGravitatorio",
      "ImaginacionResultado",
      "AnatomiaProceso",
      "DondeSomosDondeEstamos",
      "MapaTerritorio",
      "ConcienciaEspacioTemporal",
      "DecodificacionMarcos",
      "SeñalEducativa",
      "SeñalDebilFuerte",
      "FallaArmaCristina",
      "ConceptualNoEnergetico",
      "DeclaracionPertenencia",
      "SemillasEstelares",
      "Cuarent99RiesgoOportunidad",
      "EvolucionDelCono",
      "MejorarCodigoSolar",
      "HabitarLaFallaTiErra",
      "MejorarComceptos"
    ],
    "snippet": "AleEnRed88, Vuelta7, Abril10De2023, TerremotoCalifornia, ContenidoContinente, ReceptorMAEntornoPA, TierraReactivoFalla, CodificacionConcienciaMente",
    "content": "Alejandra Casado\nEN RED 88\n10.04.2023\nvuelta 7\nTranscripción\n#AleEnRed88\n#Vuelta7\n#Abril10De2023\n#TerremotoCalifornia\n#ContenidoContinente\n#ReceptorMAEntornoPA\n#TierraReactivoFalla\n#CodificacionConcienciaMente\n#AñoSecular1900\n#CaptacionReinoMineral\n#TecnologiaCalifornia\n#FalloMentesGuerra1914\n#FallaGeoEntorno\n#DiaNativoACGolpeDeEstado\n#SociedadAutopercepcion\n#MargenDeErrorAp396\n#StatusGravitatorio\n#ImaginacionResultado\n#AnatomiaProceso\n#DondeSomosDondeEstamos\n#MapaTerritorio\n#ConcienciaEspacioTemporal\n#DecodificacionMarcos\n#SeñalEducativa\n#SeñalDebilFuerte\n#FallaArmaCristina\n#ConceptualNoEnergetico\n#DeclaracionPertenencia\n#SemillasEstelares\n#Cuarent99RiesgoOportunidad\n#EvolucionDelCono\n#MejorarCodigoSolar\n#HabitarLaFallaTiErra\n#MejorarComceptos\n",
    "pdfPage": 65
  },
  {
    "num": 89,
    "date": "24.04.2023",
    "dateISO": "2023-04-24",
    "vuelta": 8,
    "freq": "",
    "url": "",
    "tags": [
      "AleEnRed89",
      "Vuelta8",
      "Abril24De2023",
      "BabaVagnaPronostico",
      "CoderosDelEspacioTiempo",
      "CodigoSolarActualizacion",
      "EducacionDeLGC",
      "AspectoParticular",
      "BandasEtarias1y2",
      "ConflictoDeAutoridad",
      "CancionWeAreTheWorld1985",
      "SeñalesDebilesEntorno",
      "SeñalesFuertesPersona",
      "LicenciaSimbolica",
      "SeñalesLejanasFractalizacion",
      "GoogleReferenciaCero1899",
      "AñoSecular1900",
      "ResetAntena2300",
      "TerremotoGoogleCancion",
      "AfricaEspecieNiño",
      "DoblesReprogramacion",
      "DolarDocumentoInterprete",
      "ElMundoNoSomosNosotros",
      "CienciaMatematica",
      "ConcienciaTematica",
      "IdentidadEnOrigenYEnDestino",
      "LecturasDeEntorno",
      "LosNiñosSomosNosotros",
      "ErrorDeCodeoDelEntorno",
      "SemillaEntornoBrote",
      "AreaDeBrocaBiblioteca",
      "NadaTodoAlgo",
      "Ap507IonosferaFiltros",
      "DiscoEspacio",
      "PistasTiempo",
      "ConcienciaEspacial",
      "BibliotecaUsuarioNoDueño"
    ],
    "snippet": "AleEnRed89, Vuelta8, Abril24De2023, BabaVagnaPronostico, CoderosDelEspacioTiempo, CodigoSolarActualizacion, EducacionDeLGC, AspectoParticular",
    "content": "Alejandra Casado\nEN RED 89\n24.04.2023\nvuelta 8\nTranscripción\n#AleEnRed89\n#Vuelta8\n#Abril24De2023\n#BabaVagnaPronostico\n#CoderosDelEspacioTiempo\n#CodigoSolarActualizacion\n#EducacionDeLGC\n#AspectoParticular\n#BandasEtarias1y2\n#ConflictoDeAutoridad\n#CancionWeAreTheWorld1985\n#SeñalesDebilesEntorno\n#SeñalesFuertesPersona\n#LicenciaSimbolica\n#SeñalesLejanasFractalizacion\n#GoogleReferenciaCero1899\n#AñoSecular1900\n#ResetAntena2300\n#TerremotoGoogleCancion\n#AfricaEspecieNiño\n#DoblesReprogramacion\n#DolarDocumentoInterprete\n#ElMundoNoSomosNosotros\n#CienciaMatematica\n#ConcienciaTematica\n#IdentidadEnOrigenYEnDestino\n#LecturasDeEntorno\n#LosNiñosSomosNosotros\n#ErrorDeCodeoDelEntorno\n#SemillaEntornoBrote\n#AreaDeBrocaBiblioteca\n#NadaTodoAlgo\n#Ap507IonosferaFiltros\n#DiscoEspacio\n#PistasTiempo\n#ConcienciaEspacial\n#BibliotecaUsuarioNoDueño",
    "pdfPage": 66
  },
  {
    "num": 90,
    "date": "10.05.2023",
    "dateISO": "2023-05-10",
    "vuelta": 9,
    "freq": "",
    "url": "",
    "tags": [
      "AleEnRed90",
      "Indice90",
      "Mayo10De2023",
      "Vuelta9Mayo2023",
      "estabilidad",
      "tecnologia",
      "retraccion",
      "iA",
      "vuelta7Y8Y10De2023",
      "aparato506",
      "alumno",
      "crearDestino",
      "reinos",
      "eucariotaPrecariotaProcariota",
      "virtudDefecto",
      "universoExpresadoCivilizado",
      "nuestraTarea",
      "creacionBinaria",
      "administracionReinos",
      "octava",
      "sabioGenio",
      "bibliotecario",
      "incremento",
      "solSistemaSolar",
      "cienciaInterdimensional",
      "pesoGravitatorio",
      "mente",
      "tareaYtesisDeSol",
      "estructuraPsicologica",
      "nativojapones",
      "error"
    ],
    "snippet": "AleEnRed90, Indice90, Mayo10De2023, Vuelta9Mayo2023, estabilidad, tecnologia, retraccion, iA",
    "content": "Alejandra Casado\nEN RED 90\n10.05.2023\nvuelta 9\nTranscripción\n#AleEnRed90\n#Indice90\n#Mayo10De2023\n#Vuelta9Mayo2023\n#estabilidad\n#tecnologia\n#retraccion\n#iA\n#vuelta7Y8Y10De2023\n#aparato506\n#alumno\n#crearDestino\n#reinos\n#eucariotaPrecariotaProcariota\n#virtudDefecto\n#universoExpresadoCivilizado\n#nuestraTarea\n#creacionBinaria\n#administracionReinos\n#octava\n#sabioGenio\n#bibliotecario\n#incremento\n#solSistemaSolar\n#cienciaInterdimensional\n#pesoGravitatorio\n#mente\n#tareaYtesisDeSol\n#estructuraPsicologica\n#nativojapones\n#error",
    "pdfPage": 67
  },
  {
    "num": 91,
    "date": "26.05.2023",
    "dateISO": "2023-05-26",
    "vuelta": 10,
    "freq": "",
    "url": "",
    "tags": [
      "AleEnRed91",
      "Indice91",
      "Mayo26De2023",
      "Vuelta10Mayo2023",
      "creacionBinaria",
      "Vueltas7Y8Y92023",
      "calendarioGregoriano",
      "aparato506",
      "controlDominio",
      "iA",
      "inicioAño12Desarrollo",
      "cuerpo",
      "realidad",
      "tareaDeSol",
      "objetivoLgc",
      "nucleoTierra",
      "retraccion",
      "confiar",
      "resonancia",
      "censar",
      "ordenJerarquicoEscalas",
      "desmantelacion",
      "transparencia",
      "financiacion",
      "reinoMineral",
      "evento58",
      "miCuman",
      "año2022",
      "dobleDesdoblado",
      "soma",
      "eje258",
      "estabilidad",
      "concienciaEscalar",
      "creencias",
      "controlComportamiento",
      "entorno",
      "bandasEtarias",
      "procesoAc",
      "registroInterno"
    ],
    "snippet": "AleEnRed91, Indice91, Mayo26De2023, Vuelta10Mayo2023, creacionBinaria, Vueltas7Y8Y92023, calendarioGregoriano, aparato506",
    "content": "Alejandra Casado\nEN RED 91\n26.05.2023\nvuelta 10\nTranscripción\n#AleEnRed91\n#Indice91\n#Mayo26De2023\n#Vuelta10Mayo2023\n#creacionBinaria\n#Vueltas7Y8Y92023\n#calendarioGregoriano\n#aparato506\n#controlDominio\n#iA\n#inicioAño12Desarrollo\n#cuerpo\n#realidad\n#tareaDeSol\n#objetivoLgc\n#nucleoTierra\n#retraccion\n#confiar\n#resonancia\n#censar\n#ordenJerarquicoEscalas\n#desmantelacion\n#transparencia\n#financiacion\n#reinoMineral\n#evento58\n#miCuman\n#año2022\n#dobleDesdoblado\n#soma\n#eje258\n#estabilidad\n#concienciaEscalar\n#creencias\n#controlComportamiento\n#entorno\n#bandasEtarias\n#procesoAc\n#registroInterno\n",
    "pdfPage": 67
  },
  {
    "num": 92,
    "date": "10.06.2023",
    "dateISO": "2023-06-10",
    "vuelta": 11,
    "freq": "",
    "url": "",
    "tags": [
      "AleEnRed92",
      "Indice92",
      "Junio10De2023",
      "Vuelta11Junio2023",
      "año2023",
      "memoriaRam",
      "memoriaNuestra",
      "estructurapsicologica",
      "AlcidesCarrion",
      "sabioGenio",
      "entorno",
      "nuevoPrototipadoEspecie",
      "Lgc",
      "efectoRetornoCajas",
      "ejeRiPositivoNegativo",
      "Uit25Julio2023Es5777",
      "globalConvergente",
      "gravitatoriaConceptual",
      "estructurapsíquica",
      "evolucionMarcos",
      "pasivoActivo",
      "conoCimiento",
      "construirConceptos",
      "WernickeBroca",
      "fractalizacion",
      "portalInterdimensional",
      "dobleDesdoblado",
      "apertura2012Cierre2021",
      "margenErrorTierra",
      "nivelIntencional",
      "envidia",
      "andromeda",
      "protocolo2511",
      "añoLuz",
      "sol",
      "aparato525Año2100",
      "ap1461Ap1460",
      "progresoSociedad",
      "ancladoAncla",
      "impulso",
      "neuropixel",
      "baseConceptual",
      "propioProgreso",
      "serieManifiesto",
      "menteConcienciaCuerpo",
      "concienciaDeMarcos",
      "concienciaDeApetito",
      "universoExpresado",
      "universoExpresadoCivilizado"
    ],
    "snippet": "AleEnRed92, Indice92, Junio10De2023, Vuelta11Junio2023, año2023, memoriaRam, memoriaNuestra, estructurapsicologica",
    "content": "Alejandra Casado\nEN RED 92\n10.06.2023\nvuelta 11\nTranscripción\n#AleEnRed92\n#Indice92\n#Junio10De2023\n#Vuelta11Junio2023\n#año2023\n#memoriaRam\n#memoriaNuestra\n#estructurapsicologica\n#AlcidesCarrion\n#sabioGenio\n#entorno\n#nuevoPrototipadoEspecie\n#Lgc\n#efectoRetornoCajas\n#ejeRiPositivoNegativo\n#Uit25Julio2023Es5777\n#globalConvergente\n#gravitatoriaConceptual\n#estructurapsíquica\n#evolucionMarcos\n#pasivoActivo\n#conoCimiento\n#construirConceptos\n#WernickeBroca\n#fractalizacion\n#portalInterdimensional\n#dobleDesdoblado\n#apertura2012Cierre2021\n#margenErrorTierra\n#nivelIntencional\n#envidia\n#andromeda\n#protocolo2511\n#añoLuz\n#sol\n#aparato525Año2100\n#ap1461Ap1460\n#progresoSociedad\n#ancladoAncla\n#impulso\n#neuropixel\n#baseConceptual\n#propioProgreso\n#serieManifiesto\n#menteConcienciaCuerpo\n#concienciaDeMarcos\n#concienciaDeApetito\n#universoExpresado\n#universoExpresadoCivilizado\n",
    "pdfPage": 68
  },
  {
    "num": 93,
    "date": "26.06.2023",
    "dateISO": "2023-06-26",
    "vuelta": 12,
    "freq": "",
    "url": "",
    "tags": [
      "26DeJunioDe2023",
      "indice93",
      "vuelta12",
      "aparato386Y396",
      "atentadoCristina",
      "configuracionDelFiltro54",
      "concienciaSolar",
      "menteSolar",
      "Andromeda",
      "reestructuracionDelSistemaSolar",
      "cono",
      "cimiento",
      "menteDinamica",
      "memoriaEstatica",
      "resonanciaSchuman",
      "anomaliaCodigo7",
      "concienciaEspacioTemporal",
      "codificacionSolarEnAñosSeculares",
      "aspecto7Global",
      "contencion",
      "diferencia711De7011",
      "conectivo",
      "conectado",
      "matrix",
      "matriz",
      "areaMuda",
      "elite",
      "despresurizacion",
      "inspiracion",
      "areaDeBroca",
      "areaDeWernicke",
      "concienciaEscalar",
      "concienciaFractal",
      "sistemaSolar",
      "sistemaPlanetario",
      "estructuraPsiquica",
      "sabio",
      "genio",
      "memoriaRam",
      "horizonteDeSucesos",
      "percepcionOnLine",
      "reconfiguracionDeAntena2023",
      "sintonizarFuturo",
      "logicaGlobalConvergente",
      "logicaGravitatoriaConceptual"
    ],
    "snippet": "93AleEnRed93docx",
    "content": "Alejandra Casado\nEN RED 93\n26.06.2023\nvuelta 12\nTranscripción\n93AleEnRed93docx\n#26DeJunioDe2023\n#indice93\n#vuelta12\n#aparato386Y396\n#atentadoCristina\n#configuracionDelFiltro54\n#concienciaSolar #menteSolar\n#Andromeda\n#reestructuracionDelSistemaSolar\n#cono #cimiento\n#menteDinamica #memoriaEstatica\n#resonanciaSchuman  #anomaliaCodigo7\n#concienciaEspacioTemporal\n#codificacionSolarEnAñosSeculares\n#aspecto7Global #contencion\n#diferencia711De7011\n#conectivo #conectado\n#matrix #matriz\n#areaMuda #elite\n#despresurizacion #inspiracion\n#areaDeBroca #areaDeWernicke\n#concienciaEscalar\n#concienciaFractal\n#sistemaSolar #sistemaPlanetario\n#estructuraPsiquica\n#sabio #genio\n#memoriaRam\n#horizonteDeSucesos\n#percepcionOnLine\n#reconfiguracionDeAntena2023\n#sintonizarFuturo\n#logicaGlobalConvergente\n#logicaGravitatoriaConceptual\n",
    "pdfPage": 69
  },
  {
    "num": 94,
    "date": "12.07.2023",
    "dateISO": "2023-07-12",
    "vuelta": 13,
    "freq": "",
    "url": "",
    "tags": [
      "julio12De2023",
      "indice93",
      "vuelta13",
      "captacion",
      "antena2023",
      "nocionDeVerdad",
      "aparato506",
      "sistemaSolar",
      "sistemaPlanetario",
      "sistemaSimbolico",
      "sistemaTecnico",
      "lecturaDeEntorno",
      "lineaDeDestino",
      "activacionConoYCimiento",
      "alcance",
      "base12",
      "base21",
      "diaSolar738888",
      "saltoEvolutivo",
      "pasosEvolutivos",
      "evolucionPsiquica",
      "evolucionFisica",
      "sintonizarFuturo",
      "linealizarDestino",
      "tiempoLento",
      "mejora",
      "marcosObjetivos",
      "contenidosSubjetivos",
      "riPositivo",
      "riNegativo",
      "octava",
      "defecto",
      "virtud",
      "consciencia",
      "conciencia",
      "analogico",
      "digital",
      "argumentar",
      "errorPropio",
      "confusionDeNeConSe",
      "conceptos",
      "aprendizajeEsLgc",
      "andromeda2511",
      "tematico",
      "matematico",
      "circuitosDelModelo2024",
      "horizonteDeSucesos"
    ],
    "snippet": "94AleEnRed94docx",
    "content": "Alejandra Casado\nEN RED 94\n12.07.2023\nvuelta 13\nTranscripción\n94AleEnRed94docx\n#julio12De2023\n#indice93\n#vuelta13\n#captacion #antena2023\n#nocionDeVerdad #aparato506\n#sistemaSolar #sistemaPlanetario\n#sistemaSimbolico #sistemaTecnico\n#lecturaDeEntorno #lineaDeDestino\n#activacionConoYCimiento\n#alcance #base12 #base21\n#diaSolar738888\n#saltoEvolutivo #pasosEvolutivos\n#evolucionPsiquica #evolucionFisica\n#sintonizarFuturo #linealizarDestino\n#tiempoLento #mejora\n#marcosObjetivos #contenidosSubjetivos\n#riPositivo  #riNegativo\n#octava  #defecto #virtud\n#consciencia #conciencia\n#analogico #digital\n#argumentar\n#errorPropio\n#confusionDeNeConSe\n#conceptos\n#aprendizajeEsLgc\n#andromeda2511\n#tematico #matematico\n#circuitosDelModelo2024\n#horizonteDeSucesos\n",
    "pdfPage": 70
  },
  {
    "num": 95,
    "date": "28.07.2023",
    "dateISO": "2023-07-28",
    "vuelta": 14,
    "freq": "",
    "url": "",
    "tags": [
      "AleEnRed95",
      "Indice95",
      "Julio28De2023",
      "Vuelta14Julio2023",
      "vuelta13De2023",
      "extremoCalor",
      "cuarentena101",
      "cuarentena39Dias",
      "soNeNoSe",
      "sujetoObjeto",
      "cuarentena102",
      "cuadrantes",
      "conoCimiento",
      "imaginacionRealidad",
      "razonarRacionar",
      "linealidadNoLinealidad",
      "resonanciaEntendimientoEjercicioComprension",
      "quintaetapa2525",
      "calendarioSolar",
      "horizonteDeSucesos",
      "sistemaDeSeñalizaciones",
      "empatia",
      "egoGeo",
      "creacionDeDestino",
      "uranoMercurio",
      "riesgoCodigoSolar",
      "libertad",
      "diaSolar738888",
      "octava",
      "desafioDeSol",
      "sistemaSolarSistemaPlanetario",
      "filtrar",
      "masMejor",
      "usuarioTejedor",
      "octavaGravitatoriaError"
    ],
    "snippet": "AleEnRed95, Indice95, Julio28De2023, Vuelta14Julio2023, vuelta13De2023, extremoCalor, cuarentena101, cuarentena39Dias",
    "content": "Alejandra Casado\nEN RED 95\n28.07.2023\nvuelta 14\nTranscripción\n#AleEnRed95\n#Indice95\n#Julio28De2023\n#Vuelta14Julio2023\n#julio28De2023\n#vuelta13De2023\n#extremoCalor\n#cuarentena101\n#cuarentena39Dias\n#soNeNoSe\n#sujetoObjeto\n#cuarentena102\n#cuadrantes\n#conoCimiento\n#imaginacionRealidad\n#razonarRacionar\n#linealidadNoLinealidad\n#resonanciaEntendimientoEjercicioComprension\n#quintaetapa2525\n#calendarioSolar\n#horizonteDeSucesos\n#sistemaDeSeñalizaciones\n#empatia\n#egoGeo\n#creacionDeDestino\n#uranoMercurio\n#riesgoCodigoSolar\n#libertad\n#diaSolar738888\n#octava\n#desafioDeSol\n#sistemaSolarSistemaPlanetario\n#filtrar\n#masMejor\n#usuarioTejedor\n#octavaGravitatoriaError\n",
    "pdfPage": 71
  },
  {
    "num": 96,
    "date": "13.08.2023",
    "dateISO": "2023-08-13",
    "vuelta": 15,
    "freq": "",
    "url": "",
    "tags": [
      "aleEnred96",
      "indice96",
      "agosto2023",
      "vuelta15",
      "vuelta4delotro",
      "cuarentena102",
      "mayorConexion",
      "crearCiclosmayores",
      "tierraYhumanojuntos",
      "ciclo",
      "configurarCircuito",
      "señalDefuturo",
      "activacionCiudadana",
      "encenderLaantena",
      "bisagraLogica",
      "basePrecariota",
      "ejeRicorto",
      "escalaAnatomica",
      "escalaMolecular",
      "escalaAtomica",
      "escalaSubatomica",
      "quintaEtapa",
      "55255",
      "uit",
      "vigencia",
      "valorDeaparato",
      "guiaDeviaje",
      "44680",
      "cienciaInterdimensional",
      "manualDenavegacion",
      "comunidad",
      "creacionColectiva",
      "honor",
      "liderPolitico",
      "crearLibertad",
      "preguntas",
      "validacionTercerorbital",
      "proyectoHumanodelsistemasolar",
      "educacionProgresiva",
      "universo",
      "imaginario",
      "crearOctavas",
      "ejeMeridiano",
      "centroDelaTierra",
      "ionosfera",
      "minimosCostes",
      "granOportunidad",
      "amparo",
      "sofisticado",
      "marcos",
      "sistemaSolar",
      "orbitalTres",
      "anatomia",
      "sujeto",
      "objeto",
      "pedoCosmico",
      "versionNativa",
      "operatoriaDelosacuerdosatierra",
      "parametro39",
      "treceLadrillos",
      "crearLinealidad",
      "actualizacionDelaespecie",
      "alcanceConsensuadoconelentorno",
      "conceptoDesol",
      "conceptoDeTierra",
      "proveeduria",
      "perspectivaComplementaria",
      "nuevaMatrizpolitica",
      "faltas",
      "fallas",
      "informacionDeError",
      "etapaCinco",
      "tejidoConectivo",
      "saludDeunsistema",
      "intencionLimpia",
      "cuartaCardinalidad",
      "coexistir",
      "portugal",
      "administracionDeunreceptor",
      "respetarPosicion",
      "ejeDelatierra",
      "sincro",
      "atencion",
      "atension",
      "entender",
      "cono",
      "sentir",
      "cimiento",
      "tu"
    ],
    "snippet": "aleEnred96, indice96, agosto2023, vuelta15, vuelta4delotro, cuarentena102, mayorConexion, crearCiclosmayores",
    "content": "Alejandra Casado\nEN RED 96\n13.08.2023\nvuelta 15\nTranscripción\n#aleEnred96\n#indice96\n#agosto2023\n#vuelta15\n#vuelta4delotro\n#cuarentena102\n#mayorConexion\n#crearCiclosmayores\n#tierraYhumanojuntos\n#ciclo\n#configurarCircuito\n#señalDefuturo\n#activacionCiudadana\n#encenderLaantena\n#bisagraLogica\n#basePrecariota\n#ejeRicorto\n#escalaAnatomica\n#escalaMolecular\n#escalaAtomica\n#escalaSubatomica\n#quintaEtapa\n#55255\n#uit\n#vigencia\n#valorDeaparato\n#guiaDeviaje\n#44680\n#cienciaInterdimensional\n#manualDenavegacion\n#comunidad\n#creacionColectiva\n#honor\n#liderPolitico\n#crearLibertad\n#preguntas\n#validacionTercerorbital\n#proyectoHumanodelsistemasolar\n#educacionProgresiva\n#universo\n#imaginario\n#crearOctavas\n#ejeMeridiano\n#centroDelaTierra\n#ionosfera\n#minimosCostes\n#granOportunidad\n#amparo\n#sofisticado\n#marcos\n#sistemaSolar\n#orbitalTres\n#anatomia\n#sujeto\n#objeto\n#pedoCosmico\n#versionNativa\n#operatoriaDelosacuerdosatierra\n#parametro39\n#treceLadrillos\n#crearLinealidad\n#actualizacionDelaespecie\n#alcanceConsensuadoconelentorno\n#conceptoDesol\n#conceptoDeTierra\n#proveeduria\n#perspectivaComplementaria\n#nuevaMatrizpolitica\n#faltas\n#fallas\n#informacionDeError\n#etapaCinco\n#tejidoConectivo\n#saludDeunsistema\n#intencionLimpia\n#cuartaCardinalidad\n#coexistir\n#portugal\n#administracionDeunreceptor\n#respetarPosicion\n#ejeDelatierra\n#sincro\n#atencion\n#atension\n#entender\n#cono\n#sentir\n#cimiento\n#tu\n",
    "pdfPage": 72
  },
  {
    "num": 97,
    "date": "29.08.2023",
    "dateISO": "2023-08-29",
    "vuelta": 16,
    "freq": "",
    "url": "",
    "tags": [
      "Indice97",
      "Vuelta16",
      "RenglonParticular",
      "ReinoMineral",
      "Solucion",
      "Arreglo",
      "miradaexpansiva",
      "InstanciaSuperadora",
      "GarantiaDeContinuidad",
      "Prototipado",
      "ConectividadSolar",
      "RealidadLocal",
      "Regulacion",
      "PosicionNativa",
      "Caducidad",
      "Milimetro",
      "Hebra",
      "InterconexionesEntreNuestrasMentes",
      "EscalaVital",
      "Subsanar",
      "Restituir",
      "Programador",
      "Bibiotecario",
      "Colosal",
      "Israel",
      "Plus",
      "YoSuperior",
      "TransicionarMiConcepto",
      "Absoluto",
      "Relativo",
      "Fractalizacion",
      "Densificar",
      "CeroMistica",
      "EscalaInedita",
      "Virtud",
      "Defecto"
    ],
    "snippet": "Indice97, Vuelta16, RenglonParticular, ReinoMineral, Solucion, Arreglo, miradaexpansiva, InstanciaSuperadora",
    "content": "Alejandra Casado\nEN RED 97\n29.08.2023\nvuelta 16\nTranscripción\n#Indice97\n#Vuelta16\n#RenglonParticular\n#ReinoMineral\n#Solucion\n#Arreglo\n#miradaexpansiva\n#InstanciaSuperadora\n#GarantiaDeContinuidad\n#Prototipado\n#ConectividadSolar\n#RealidadLocal\n#Regulacion\n#PosicionNativa\n#Caducidad\n#Milimetro\n#Hebra\n#InterconexionesEntreNuestrasMentes\n#EscalaVital\n#Subsanar\n#Restituir\n#Programador\n#Bibiotecario\n#Colosal\n#Israel\n#Plus\n#YoSuperior\n#TransicionarMiConcepto\n#Absoluto\n#Relativo\n#Fractalizacion\n#Densificar\n#CeroMistica\n#EscalaInedita\n#Virtud\n#Defecto",
    "pdfPage": 74
  },
  {
    "num": 98,
    "date": "14.09.2023",
    "dateISO": "2023-09-14",
    "vuelta": 17,
    "freq": "",
    "url": "",
    "tags": [
      "Indice98",
      "Vuelta17",
      "RecursosInterconectados",
      "Planeta",
      "Plano",
      "Reviente",
      "Marruecos",
      "Libia",
      "Codigo",
      "OchoALaIzquierda",
      "OchoALaDerecha",
      "Ejemplo",
      "Didactico",
      "Protocolo",
      "Caos",
      "Control",
      "Reactivo",
      "Pausa",
      "Actividad",
      "Documentacion",
      "SerieManifiesto",
      "FuncionPer",
      "TiempoRealDeLaTierra",
      "AlcanceDeInterprete",
      "Orbital",
      "VersionDeMi",
      "Sutil",
      "Siberia",
      "InfluenciaCosmica",
      "Marcos",
      "Radicacion",
      "Bioexcitacion",
      "Compartir",
      "Plantilla",
      "Presentacion",
      "Solares",
      "Solarense",
      "Solariano",
      "Solestres",
      "FacultadesFlotantes",
      "Condicional",
      "Si",
      "Desolacion",
      "Silencios",
      "Clima",
      "PautasObjetivas",
      "LLA",
      "Andamiaje",
      "UL",
      "OL",
      "OD",
      "ALL",
      "NotasMusicales",
      "ContextoAdministrable",
      "SolarianoExclusivo",
      "TierraInclusiva",
      "TercerizadoDeSeñales",
      "Espectacular"
    ],
    "snippet": "En el gráfico AC colocó por equivocación en la cardinalidad SE: SOLARarESTRE y es SOLESTRES sin \"ar\"",
    "content": "Alejandra Casado\nEN RED 98\n14.09.2023\nvuelta 17 (Notas musicales)\nTranscripción\nEn el gráfico AC colocó por equivocación en la cardinalidad SE:\nSOLARarESTRE y es\nSOLESTRES sin \"ar\"\nAmpliación y Actualización dePentagrama LGC descriptoen Evento 58, 1430 dias\ndesde ese 15/10/2019 al 14/09/2023, nombrado comoPentagrama LGC el 07/01/2022\n siendo entonces 615 días.\nVuelta 17 Versión 2023 - AC\nen Red 98\n#Indice98\n#Vuelta17\n#RecursosInterconectados\n#Planeta\n#Plano\n#Reviente\n#Marruecos\n#Libia\n#Codigo\n#OchoALaIzquierda\n#OchoALaDerecha\n#Ejemplo\n#Didactico\n#Protocolo\n#Caos\n#Control\n#Reactivo\n#Pausa\n#Actividad\n#Documentacion\n#SerieManifiesto\n#FuncionPer\n#TiempoRealDeLaTierra\n#AlcanceDeInterprete\n#Orbital\n#VersionDeMi\n#Sutil\n#Siberia\n#InfluenciaCosmica\n#Marcos\n#Radicacion\n#Bioexcitacion\n#Compartir\n#Plantilla\n#Presentacion\n#Solares\n#Solarense\n#Solariano\n#Solestres\n#FacultadesFlotantes\n#Condicional\n#Si\n#Desolacion\n#Silencios\n#Clima\n#PautasObjetivas\n#LLA\n#Andamiaje\n#UL\n#OL\n#OD\n#ALL\n#NotasMusicales\n#ContextoAdministrable\n#SolarianoExclusivo\n#TierraInclusiva\n#TercerizadoDeSeñales\n#Espectacular\n",
    "pdfPage": 74
  },
  {
    "num": 99,
    "date": "01.10.2023",
    "dateISO": "2023-10-01",
    "vuelta": 18,
    "freq": "",
    "url": "",
    "tags": [
      "AleEnRed99",
      "IndiceVuelta18",
      "Vuelta18",
      "Cuarenta",
      "CuartoOrbital",
      "SistemaSolar",
      "SistemaPlanetario",
      "DestinosProgramados",
      "Autodeterminacion",
      "CodigoMolecular",
      "CodigoAnatomico",
      "ArgumentosdeConflicto",
      "GraficaVuelta18",
      "IdentidadSimbolica",
      "ConfigurarunaCreacion",
      "Autoria",
      "Marcos",
      "Pertenencias",
      "MemoriaEstatica",
      "Loop",
      "ConcienciaEscalar",
      "QuintoOrbiltal",
      "Aparatos500",
      "Aparatos400",
      "Aparato396",
      "BloqueoEstatico",
      "RecursosActivadores",
      "Reloj",
      "Aparato493",
      "Hipervinculacion",
      "PertenenciaNativa",
      "OrbitalCinco",
      "Sincronicidad",
      "LeyBimetalismo",
      "SietedeNoviembre",
      "Oro",
      "Realidadautodeterminada",
      "EjeRi",
      "EstructuraAtomica",
      "CaptacionBloqueodeSeñales",
      "SegundosIntercalares",
      "QuitaPatronOro",
      "PrimerSegundoIntercalar",
      "PercepcionInterconectadaDestrabada",
      "Neptuno",
      "RegistroCivil",
      "CapitalizaciondelaExperiencia",
      "CambioParadigmasPositivoNegativo",
      "EstructuraPsiquica",
      "Independencia",
      "Wernicke",
      "IndependenciaEjeRo",
      "Broca",
      "Amarte",
      "PerteneciasActivas",
      "LicenciaIgnorancia",
      "LicenciaSimbolica",
      "VinculacionAlmaDestino",
      "EstructuraEjeCero",
      "CrecimientoEjeRi",
      "Capitalizacion",
      "Riesgo",
      "Oportunidad",
      "ValorAfectivo",
      "MetricasEjeRo"
    ],
    "snippet": "99 - Ale",
    "content": "Alejandra Casado\nEN RED 99\n01.10.2023\nvuelta 18\nTranscripción\n99 - Ale\nen red 99\n#AleEnRed99  #IndiceVuelta18   #Vuelta18\n#Cuarenta   #CuartoOrbital\n#SistemaSolar #SistemaPlanetario\n#DestinosProgramados #Autodeterminacion\n#CodigoMolecular   #CodigoAnatomico   #ArgumentosdeConflicto\n#GraficaVuelta18\n#IdentidadSimbolica #ConfigurarunaCreacion #Autoria #Marcos #Pertenencias\n#MemoriaEstatica #Loop #IdentidadSimbolica #ConcienciaEscalar  #QuintoOrbiltal\n#Aparatos500 #Aparatos400\n#Aparato396 #BloqueoEstatico #RecursosActivadores #Reloj\n#Aparato493   #Hipervinculacion #PertenenciaNativa #OrbitalCinco #Sincronicidad\n#LeyBimetalismo   #SietedeNoviembre\n#Oro #Realidadautodeterminada\n#EjeRi   #EstructuraAtomica #CaptacionBloqueodeSeñales\n#SegundosIntercalares #QuitaPatronOro #PrimerSegundoIntercalar\n#PercepcionInterconectadaDestrabada\n#Neptuno #RegistroCivil   #CapitalizaciondelaExperiencia\n#CambioParadigmasPositivoNegativo #EstructuraPsiquica   #Independencia EjeRi\n#Wernicke #IndependenciaEjeRo #Broca\n#Amarte\n#PerteneciasActivas #LicenciaIgnorancia #LicenciaSimbolica\n#VinculacionAlmaDestino\n#EstructuraEjeCero   #CrecimientoEjeRi   #Capitalizacion #Riesgo #Oportunidad\n#ValorAfectivo #MetricasEjeRo\n",
    "pdfPage": 76
  },
  {
    "num": 100,
    "date": "16.10.2023",
    "dateISO": "2023-10-16",
    "vuelta": 19,
    "freq": "",
    "url": "",
    "tags": [
      "DiasDeVida19672",
      "CodigoAntartida",
      "Neutrinos",
      "FuncionPer",
      "Dia280",
      "Evento28",
      "CodigoSolarNativo",
      "CodigoForaneo",
      "Dia279",
      "EstadodeIsrael",
      "AñoDocedelDesarrollo",
      "FuenteExterna",
      "RolActivo",
      "CumpleañosdeJavierMilei",
      "22deOctubre",
      "Atorados",
      "Attosegundo",
      "BlindajeSolar",
      "PerteneciaEscalar",
      "EvolucionEscalar",
      "CalendarioLunar",
      "CalendarioSolar",
      "ConoObturado",
      "Economia",
      "1940",
      "TejidoConectivo",
      "PatronOro",
      "1971",
      "QuitaPatronOro",
      "FaltadeAnticipacion",
      "1972",
      "DesequilibrioBaseTecnologica",
      "SegundosIntercalares",
      "Aparato",
      "Desarrolloaparato493",
      "Reloj",
      "22deOctubre1970",
      "ResetAntena",
      "MatrizPsiquicadelaTierra",
      "Base12",
      "Base21",
      "BlindajeOrbital3",
      "ResguardoIntegridadSatelital",
      "TiempoAtomico",
      "TiempoOrganico",
      "Escalabidad",
      "Estabilidad",
      "Calculadora3",
      "CalendarioLGC",
      "Calendaria",
      "MatrizPsiquicaEstadodeIsrael",
      "EscalaSimbolica",
      "Loop",
      "MargendeError",
      "Octavagravitatoria",
      "Metricas",
      "CodigoLunar",
      "JavierMilei",
      "PrimeraCalculadora",
      "SegundaCalculadora",
      "TerceraCalculadora",
      "FuncionamientoDeLasEscalas",
      "MatrizPsiquicaAlejandraCasado",
      "FunciondelOroEscalaSubatomica",
      "LicenciaSimbolica",
      "MatrizPsiquicaJavierMilei",
      "BloqueoCalculadora3",
      "Restricciones",
      "Sincronizaciones",
      "FalladelCimiento",
      "LecturadelCono",
      "RealidadLocal",
      "EscalaAscendente",
      "LicenciaTecnica",
      "CreacionBinaria",
      "Ionosfera",
      "Codigo7",
      "CreacionLogicaRusa",
      "GeRusaLen",
      "RiPositivo",
      "Rinegativo",
      "Codigo54",
      "aveFenix",
      "ancla",
      "EjeRiIntransferible"
    ],
    "snippet": "100.- Ale",
    "content": "Alejandra Casado\nEN RED 100\n16.10.2023\nvuelta 19\nTranscripción\n100.- Ale\nen red 100\nVuelta 19\n#DiasDeVida19672   #CodigoAntartida   #Neutrinos   #FuncionPer\n#Dia280 #Evento28 #CodigoSolarNativo  #CodigoForaneo  #Dia279  #EstadodeIsrael\n#AñoDocedelDesarrollo   #FuenteExterna  #RolActivo   #CumpleañosdeJavierMilei\n#22deOctubre #Atorados  #Attosegundo #BlindajeSolar\n#PerteneciaEscalar #EvolucionEscalar  #CalendarioLunar #CalendarioSolar\n#ConoObturado\n#Economia\n#1940   #TejidoConectivo  #PatronOro\n#1971 #QuitaPatronOro  #FaltadeAnticipacion\n#1972 #DesequilibrioBaseTecnologica #SegundosIntercalares\n#Aparato\n#Desarrolloaparato493\n#Reloj #FuenteExterna  #22deOctubre1970  #QuitaPatronOro  #SegundosIntercalares\n#ResetAntena\n#MatrizPsiquicadelaTierra  #SegundosIntercalares\n#Base12   #Base21   #BlindajeOrbital3  #ResguardoIntegridadSatelital\n#TiempoAtomico #TiempoOrganico  #Escalabidad  #Estabilidad  #Calculadora3\n#CalendarioLGC   #Calendaria\n#MatrizPsiquicaEstadodeIsrael\n#EscalaSimbolica  #Loop #MargendeError  #Octavagravitatoria  #Metricas  #PatronOro\n#CodigoLunar  #JavierMilei\n#PrimeraCalculadora   #SegundaCalculadora  #TerceraCalculadora\n#FuncionamientoDeLasEscalas\n#MatrizPsiquicaAlejandraCasado #FunciondelOroEscalaSubatomica\n#LicenciaSimbolica\n#MatrizPsiquicaJavierMilei\n#BloqueoCalculadora3  #Restricciones  #Sincronizaciones #FalladelCimiento\n#LecturadelCono\n#RealidadLocal  #EscalaAscendente  #LicenciaTecnica  #CreacionBinaria\n#Ionosfera  #Codigo7 #CreacionLogicaRusa  #GeRusaLen  #RiPositivo  #Rinegativo\n#Codigo54 #aveFenix  #ancla\n#EjeRiIntransferible\n",
    "pdfPage": 77
  },
  {
    "num": 101,
    "date": "01.11.2023",
    "dateISO": "2023-11-01",
    "vuelta": 20,
    "freq": "",
    "url": "",
    "tags": [
      "vuelta20",
      "quitaPatronOro",
      "plantillaSegundosIntercalares",
      "orbital1Orbital2",
      "Base12Base21",
      "Intérprete30",
      "Evento28Israel",
      "codigoNativoSolar",
      "codigoSatelital881",
      "primeraMatrizTierra",
      "codigoMolecularGenoma",
      "filtroDeSeñales",
      "fuenteExternaInterna",
      "dobleResponsableGenoma",
      "destinoDesdobladoAnatomico",
      "calidadCodigoSolar",
      "interconexiónDestinos",
      "segundaCalculadoraSol",
      "calculadoraInconscienteBiologico",
      "estabilidadInestabilidad",
      "AntenaDoble",
      "DocumentacionDesdoblado",
      "dobleDesdoblado",
      "terceraCalculadoraCosmos",
      "resonanciaResistencia",
      "calendaria",
      "sincronizacionDestinos",
      "colorVioletaRojoAzul",
      "nobelAttosegundo",
      "tipografíaTimesNewRoman",
      "1582",
      "3OctubreOpera4Octubre",
      "editarDestinoProgramado",
      "1972",
      "NeptunoResgistroCivil",
      "972",
      "horizonteSucesos",
      "spaceTimesNewRoman",
      "corrupciónEscalaAlma",
      "santosMuertosVivosDespiertos",
      "estadosUnidosDelAmor",
      "autenticidad",
      "evoluciónIonosfera"
    ],
    "snippet": "vuelta20, quitaPatronOro, plantillaSegundosIntercalares, orbital1Orbital2, Base12Base21, Intérprete30, Evento28Israel, codigoNativoSolar",
    "content": "Alejandra Casado\nEN RED 101\n01.11.2023\nvuelta 20\nTranscripción\n#vuelta20\n#quitaPatronOro\n#plantillaSegundosIntercalares\n#orbital1Orbital2\n#Base12Base21\n#Intérprete30\n#Evento28Israel\n#codigoNativoSolar\n#codigoSatelital881\n#primeraMatrizTierra\n#codigoMolecularGenoma\n#filtroDeSeñales\n#fuenteExternaInterna\n#dobleResponsableGenoma\n#destinoDesdobladoAnatomico\n#calidadCodigoSolar\n#interconexiónDestinos\n#segundaCalculadoraSol\n#calculadoraInconscienteBiologico\n#estabilidadInestabilidad\n#AntenaDoble\n#DocumentacionDesdoblado\n#dobleDesdoblado\n#terceraCalculadoraCosmos\n#resonanciaResistencia\n#calendaria\n#sincronizacionDestinos\n#colorVioletaRojoAzul\n#nobelAttosegundo\n#tipografíaTimesNewRoman\n#1582\n#3OctubreOpera4Octubre\n#editarDestinoProgramado\n#1972\n#NeptunoResgistroCivil\n#972\n#horizonteSucesos\n#spaceTimesNewRoman\n#corrupciónEscalaAlma\n#santosMuertosVivosDespiertos\n#estadosUnidosDelAmor\n#autenticidad\n#evoluciónIonosfera\n",
    "pdfPage": 78
  },
  {
    "num": 102,
    "date": "18.11.2023",
    "dateISO": "2023-11-18",
    "vuelta": 21,
    "freq": "",
    "url": "",
    "tags": [
      "vuelta21",
      "base21Social",
      "attosegundo",
      "6tiposDobles",
      "personaPersonajePerlaPernoxPerdocsPerdon",
      "horizonteSucesos",
      "segundosIntercaleres",
      "portalesMultidimensionales",
      "matrix",
      "fuenteExterna",
      "calculadoras",
      "3Octubre",
      "aparato396",
      "añoUnidadDeSentido",
      "ejeRi",
      "tiempoCero",
      "diaSolar",
      "fundacionalFuncional",
      "visagraLogica",
      "funcionPer",
      "algoImaginario",
      "andromeda",
      "972",
      "hilosDelOlvido",
      "CarmenGarcia",
      "antenaNoViva",
      "inteligenciaArticulada",
      "tumi",
      "retraccion",
      "reloj",
      "soros",
      "plata47Oro79",
      "eventoCorvera",
      "derivacionDoble",
      "interferencia",
      "dobleDesdoblado",
      "laPlata",
      "masones"
    ],
    "snippet": "vuelta21, base21Social, attosegundo, 6tiposDobles, personaPersonajePerlaPernoxPerdocsPerdon, horizonteSucesos, segundosIntercaleres, portalesMultidimensionales",
    "content": "Alejandra Casado\nEN RED 102\n18.11.2023\nvuelta 21\nTranscripción\n#vuelta21\n#base21Social\n#attosegundo\n#6tiposDobles\n#personaPersonajePerlaPernoxPerdocsPerdon\n#horizonteSucesos\n#segundosIntercaleres\n#portalesMultidimensionales\n#matrix\n#fuenteExterna\n#calculadoras\n#3Octubre\n#aparato396\n#añoUnidadDeSentido\n#ejeRi\n#tiempoCero\n#diaSolar\n#fundacionalFuncional\n#visagraLogica\n#funcionPer\n#algoImaginario\n#andromeda\n#972\n#hilosDelOlvido\n#CarmenGarcia\n#antenaNoViva\n#inteligenciaArticulada\n#tumi\n#retraccion\n#reloj\n#soros\n#plata47Oro79\n#eventoCorvera\n#derivacionDoble\n#interferencia\n#dobleDesdoblado\n#laPlata\n#masones",
    "pdfPage": 79
  },
  {
    "num": 103,
    "date": "05.12.2023",
    "dateISO": "2023-12-05",
    "vuelta": 22,
    "freq": "",
    "url": "",
    "tags": [
      "vuelta22",
      "54años",
      "actualizacionNotasMusicales",
      "primeraDerivacion",
      "cardinalidades",
      "solarSolarienseSolarianoSolestres",
      "totalidadDeAlgo",
      "estructuraPsiquica",
      "flujoDeSeñales",
      "placaLaPlata",
      "idiomasCardinalidades",
      "351ConstruyeOctava",
      "nativizarCodigoForaneo",
      "notaSoulEditable",
      "colorNotas",
      "interpretaciónDesdoblamiento",
      "Karma",
      "rayoVioleta",
      "2023ReconfiguraWifi",
      "destinosProgramados",
      "destinosSincronizados",
      "notaIS",
      "retraccion",
      "versionesActualizaciones",
      "diasSemana",
      "miercoles",
      "colesCapas",
      "mercurio",
      "orimerOrbital",
      "juevesAdministra",
      "martesDestinoActualizado",
      "venusFunciones",
      "viernes",
      "lunaSatelite",
      "sabadoGuardado",
      "domingoMenteSolar",
      "funcionMinerales",
      "primerOrbital",
      "materia",
      "estadoPrecario",
      "energiaTransferenciaRecursos",
      "vibracionEjecucionPrograma",
      "ejemploMusicaPartitura",
      "tablaElementos",
      "relojAtomico",
      "burbujasPromesas",
      "colorRosa",
      "colorRojo",
      "elemento57",
      "actinium71",
      "cesio55",
      "segundosIntercalares",
      "xenon54",
      "54formacionRealidad",
      "materiaOscura",
      "anticipacion",
      "1955LuisEssen",
      "nativoEinstein",
      "leyBimetalismo",
      "formacionGalaxias",
      "nativoNacido",
      "recodificacionOrigen",
      "3Octubre",
      "plata47",
      "oro79",
      "columna11Contexto",
      "promesa7",
      "elemento111",
      "pasadoPresenteFuturo",
      "plataWolframio",
      "dobleAntena",
      "dobleDesdoblado",
      "desdobladoAmbito",
      "wolframioFrameMarcos",
      "oroBerkelio",
      "plataOroBerkelioWolframio",
      "47799774",
      "74799747",
      "laxo",
      "creacionBinaria",
      "descubrimientoAndromeda",
      "conexionAndromeda",
      "diaNativoHubble",
      "aparato473",
      "diasolanativo",
      "dia9",
      "dobleMolecular",
      "crearTareasAlDoble",
      "crearConceptos",
      "construccionInterprete",
      "superposicionContextos",
      "fallasFaltas",
      "eleccionesMilei",
      "motosierra",
      "base12FuenteExterna"
    ],
    "snippet": ". > s-LGC - ELLE: 🖼 Actualización Pentagrama LGC",
    "content": "Alejandra Casado\nEN RED 103\n05.12.2023\nvuelta 22\nTranscripción\n#vuelta22\n#54años\n#actualizacionNotasMusicales\n#primeraDerivacion\n#cardinalidades\n#solarSolarienseSolarianoSolestres\n#totalidadDeAlgo\n#estructuraPsiquica\n#flujoDeSeñales\n#placaLaPlata\n#idiomasCardinalidades\n#351ConstruyeOctava\n#nativizarCodigoForaneo\n#notaSoulEditable\n#colorNotas\n#interpretaciónDesdoblamiento\n#Karma\n#rayoVioleta\n#2023ReconfiguraWifi\n#destinosProgramados\n#destinosSincronizados\n#notaIS\n#retraccion\n#versionesActualizaciones\n#diasSemana\n#miercoles\n#colesCapas\n#mercurio\n#orimerOrbital\n#juevesAdministra\n#martesDestinoActualizado\n#venusFunciones\n#viernes\n#lunaSatelite\n#sabadoGuardado\n#domingoMenteSolar\n#funcionMinerales\n#primerOrbital\n#materia\n#estadoPrecario\n#energiaTransferenciaRecursos\n#vibracionEjecucionPrograma\n#ejemploMusicaPartitura\n#tablaElementos\n#relojAtomico\n#burbujasPromesas\n#colorRosa\n#colorRojo\n#elemento57\n#actinium71\n#cesio55\n#segundosIntercalares\n#xenon54\n#54formacionRealidad\n#materiaOscura\n#anticipacion\n#1955LuisEssen\n#nativoEinstein\n#leyBimetalismo\n#formacionGalaxias\n#nativoNacido\n#recodificacionOrigen\n#3Octubre\n#plata47\n#oro79\n#columna11Contexto\n#promesa7\n#elemento111\n#pasadoPresenteFuturo\n#plataWolframio\n#dobleAntena\n#dobleDesdoblado\n#desdobladoAmbito\n#wolframioFrameMarcos\n#oroBerkelio\n#plataOroBerkelioWolframio\n#47799774\n#74799747\n#laxo\n#creacionBinaria\n#descubrimientoAndromeda\n#conexionAndromeda\n#diaNativoHubble\n#aparato473\n#diasolanativo\n#dia9/8/491\n#dobleMolecular\n#crearTareasAlDoble\n#crearConceptos\n#construccionInterprete\n#superposicionContextos\n#fallasFaltas\n#eleccionesMilei\n#motosierra\n#base12FuenteExterna\n. > s-LGC - ELLE: 🖼 Actualización Pentagrama LGC\nAlejandra\nen Red 103",
    "pdfPage": 80
  },
  {
    "num": 104,
    "date": "19.12.2023",
    "dateISO": "2023-12-19",
    "vuelta": 23,
    "freq": "",
    "url": "",
    "tags": [
      "AleEnRed104",
      "19Diciembre2023",
      "vuelta23Anillo",
      "Andromeda",
      "formacionGalaxias",
      "universidadLGC",
      "externalizacionCircuitosLogicos",
      "observadoresInternos",
      "coloresElementosTabla",
      "presentacionTablaElementos",
      "bacheTabla",
      "hidrogenoHelio",
      "orbital4orbital5",
      "escombrosIntentosRealidadLocal",
      "renglon456PalitoH",
      "rosaAdministracion",
      "administradorProyeccion",
      "creditoObservadoresExternos789",
      "convalidadaOctavaDensifica123",
      "octavaGravitatoria87",
      "comunicacionUniversoNuevaExpresion",
      "creacionBinariaLocal",
      "conformacionOctava",
      "elasticoFlexibilidadMembranaTiempo",
      "auditoriaFuenteExterna",
      "octavaSocial118",
      "cuatroPuntas1H2He87Fr118Og",
      "desafioOctava",
      "creditoDensificar",
      "auditoriaExternaCircuitosInternosExternaclizados",
      "observacionExternaDensificaCondensa",
      "renglon1hidrogenoHelioAutoobservacionAutocomtemplacion",
      "cargaGravitatoriaObservadoresAtomicos",
      "renglon2CreacionBinaria",
      "neonAnunciaCreacion",
      "elemento3Credito",
      "elemento4Modelo",
      "brechaElemento4Elemento5",
      "refundacionDesdeRam",
      "ramMemoriaObservadorOriginal",
      "renglon3EscalaNuevaoctava",
      "renglon4",
      "progresoMenosBache",
      "brechaElemento20Elemento21",
      "auditoriaBase12Base21Base30",
      "etapasDesarrolloConscienciaFormacionGalaxias",
      "renglon5",
      "leerOctava38",
      "actualizarOctava39",
      "construccionInterprete57",
      "colorAzulElectrico",
      "colorRojoMagnetico",
      "colorVioletaElectromagnetico",
      "interprete57LogicaGravitatoria",
      "coordinacion71EspacioTemporal81",
      "tiempo81Violeta",
      "electricoEstimulaMagnetico",
      "evolucionDensificacionComplejidad",
      "estrelalDavidTruco",
      "paraisoNoDesafio",
      "renglon6",
      "cesioXenon",
      "adminstracionOctavaPropia",
      "Agosto11",
      "cumpleañosSoros",
      "interferenciasAmplianCodigoSolar",
      "rayosFRBDuncanLorimer",
      "aparato493",
      "rellenoHuecosTabla",
      "razonarChequearResonancia",
      "marcosCaptacionSeñales",
      "dentroAlcanceAdministrador",
      "cuadrosRazonamiento",
      "respaldo87hasta118",
      "globos30TercerOrbital",
      "configuracionNoLinealRestoHuecos",
      "reconstruirPertenenciaNoLineal",
      "224Casillas",
      "octavaGravitatoriaAbsorveSuFundamento",
      "reestructurarMemoriasRom",
      "noMorir",
      "descubridorHelioPierreHansen",
      "comunicacionCorrecta200",
      "año2100Secular",
      "anilloFuegoApoyoGrafico",
      "segundosIntercalares",
      "aparatos493Al504",
      "puertaAlprocesador359",
      "frb",
      "derivacionCuzco",
      "entornoMecanismoEvolucionPosicionesNativas",
      "densificarAumentarCargaPosicionesNativas",
      "razonarOportunidad",
      "paisesFundadoresUIT",
      "353Irlanda",
      "354Islandia",
      "357Chipre",
      "complementariedadLinealNoLineal",
      "proyeccionFamiliaresTunelMuerte",
      "diferencia606Con666Y696",
      "wernickeBroca",
      "3DiasOscuridad",
      "reset",
      "capatacionFuenteInedita",
      "plataWolframio",
      "oroBerkelio",
      "estaticoDinamico",
      "pildoraRojaAzulVioleta",
      "recepcionFRBconProcesador",
      "routerFor",
      "horizonteSucesos4096",
      "507Panama",
      "milei22Noviembre",
      "autenticidad"
    ],
    "snippet": "Anillo de Fuego (Tabla de elementos)",
    "content": "Alejandra Casado\nEN RED 104\n19.12.2023\nvuelta 23\nAnillo de Fuego\nTranscripcion\n(Tabla de elementos)\n#AleEnRed104\n#19Diciembre2023\n#vuelta23Anillo\n#Andromeda\n#formacionGalaxias\n#universidadLGC\n#externalizacionCircuitosLogicos\n#observadoresInternos\n#coloresElementosTabla\n#presentacionTablaElementos\n#bacheTabla\n#hidrogenoHelio\n#orbital4orbital5\n#escombrosIntentosRealidadLocal\n#renglon456PalitoH\n#rosaAdministracion\n#administradorProyeccion\n#creditoObservadoresExternos789\n#convalidadaOctavaDensifica123\n#octavaGravitatoria87\n#comunicacionUniversoNuevaExpresion\n#creacionBinariaLocal\n#conformacionOctava\n#elasticoFlexibilidadMembranaTiempo\n#auditoriaFuenteExterna\n#octavaSocial118\n#cuatroPuntas1H2He87Fr118Og\n#desafioOctava\n#creditoDensificar\n#auditoriaExternaCircuitosInternosExternaclizados\n#observacionExternaDensificaCondensa\n#renglon1hidrogenoHelioAutoobservacionAutocomtemplacion\n#cargaGravitatoriaObservadoresAtomicos\n#renglon2CreacionBinaria\n#neonAnunciaCreacion\n#elemento3Credito\n#elemento4Modelo\n#brechaElemento4Elemento5\n#refundacionDesdeRam\n#ramMemoriaObservadorOriginal\n#renglon3EscalaNuevaoctava\n#renglon4\n#progresoMenosBache\n#brechaElemento20Elemento21\n#auditoriaBase12Base21Base30\n#etapasDesarrolloConscienciaFormacionGalaxias\n#renglon5\n#leerOctava38\n#actualizarOctava39\n#construccionInterprete57\n#colorAzulElectrico\n#colorRojoMagnetico\n#colorVioletaElectromagnetico\n#interprete57LogicaGravitatoria\n#coordinacion71EspacioTemporal81\n#tiempo81Violeta\n#electricoEstimulaMagnetico\n#evolucionDensificacionComplejidad\n#estrelalDavidTruco\n#paraisoNoDesafio\n#renglon6\n#cesioXenon\n#adminstracionOctavaPropia\n#octavasocial118\n#Agosto11\n#cumpleañosSoros\n#interferenciasAmplianCodigoSolar\n#rayosFRBDuncanLorimer\n#aparato493\n#rellenoHuecosTabla\n#razonarChequearResonancia\n#marcosCaptacionSeñales\n#d",
    "pdfPage": 83
  },
  {
    "num": 105,
    "date": "01.01.2024",
    "dateISO": "2024-01-01",
    "vuelta": 1,
    "freq": "",
    "url": "",
    "tags": [
      "CG4096",
      "CodigoSolarNativo",
      "LaPromesaOportunidad",
      "OctavaGravitatoria",
      "LaxoTenso",
      "Destino",
      "LuzPropia",
      "TablaElementos",
      "IrlandaIslandia",
      "ZonaMuda",
      "Elemento119",
      "Antigravitatoria",
      "Particular",
      "Ambito",
      "DobleMolecular",
      "UIT",
      "Ionosfera",
      "Sumatoria954",
      "PatronTumiPaises"
    ],
    "snippet": "CG4096, CodigoSolarNativo, LaPromesaOportunidad, OctavaGravitatoria, LaxoTenso, Destino, LuzPropia, TablaElementos",
    "content": "Alejandra Casado\nEN RED 105\n01.01.2024\nvuelta 1\nTranscripción\n#CG4096\n#CodigoSolarNativo\n#LaPromesaOportunidad\n#OctavaGravitatoria\n#LaxoTenso\n#Destino\n#LuzPropia\n#TablaElementos\n#IrlandaIslandia\n#ZonaMuda\n#Elemento119\n#Antigravitatoria\n#Particular\n#Ambito\n#DobleMolecular\n#UIT.DiaNativo\n#Ionosfera\n#Sumatoria954\n#PatronTumiPaises",
    "pdfPage": 86
  },
  {
    "num": 106,
    "date": "17.01.2024",
    "dateISO": "2024-01-17",
    "vuelta": 2,
    "freq": "",
    "url": "",
    "tags": [
      "indice106",
      "Enero17Del2024",
      "vuelta2",
      "funcion",
      "horizonteDeSucesos",
      "codigoSolarNativo",
      "codigoForaneo",
      "destinoProgramado",
      "crecimientoEscalar",
      "actualizacion",
      "octavaGravitatoria",
      "realidadLocal",
      "licenciaDeIgnorancia",
      "licenciaDeExidtencia",
      "imaginacion",
      "desdoblsmientoPrimario",
      "desdoblamientoSecundario",
      "nada",
      "espacio",
      "todo",
      "algo",
      "transparencia",
      "universoExpresado",
      "universoExpresadoCivilizado",
      "Milei",
      "volantazo",
      "antena",
      "fuenteInterna",
      "fuenteExterna",
      "interpreteLa",
      "doble",
      "dobleMolecular",
      "dobleAtomico",
      "vacunasARN",
      "antenas5G",
      "YokoiKenji",
      "Japon81",
      "colombia57",
      "ultimoEslabon",
      "interferenciaDeSol",
      "marcos",
      "Tierra",
      "entorno",
      "bibliotecaDelTercerOrbital",
      "memoria",
      "nuevaMente",
      "anilloDeFuego",
      "resonancia",
      "oganeson118",
      "octavaSocial",
      "Toganeson119",
      "base21",
      "burbujasRosadas",
      "listaDeTareas",
      "añosSeculares",
      "año2100",
      "plataformaMolecular",
      "resonanciaInterna",
      "conexionParticular",
      "cuarentena106",
      "Soros",
      "Cesio",
      "relojAtomico",
      "Radón",
      "elastico",
      "inmaterial",
      "antimaterial",
      "material"
    ],
    "snippet": "106- Ale",
    "content": "Alejandra Casado\nEN RED 106\n17.01.2024\nvuelta 2\nTranscripción\n106- Ale\nEn Red 106\n#indice106\n#Enero17Del2024\n#vuelta2 #funcion\n#horizonteDeSucesos\n#codigoSolarNativo\n#codigoForaneo\n#destinoProgramado\n#crecimientoEscalar\n#actualizacion\n#octavaGravitatoria\n#realidadLocal\n#licenciaDeIgnorancia\n#licenciaDeExidtencia #imaginacion\n#desdoblsmientoPrimario\n#desdoblamientoSecundario\n#nada  #espacio #todo\n#algo #transparencia\n#universoExpresado\n#universoExpresadoCivilizado\n#Milei  #volantazo\n#antena  #fuenteInterna\n#fuenteExterna\n#interpreteLa\n#doble  #dobleMolecular\n#dobleAtomico\n#vacunasARN  #antenas5G\n#YokoiKenji  #Japon81\n#colombia57\n#ultimoEslabon\n#interferenciaDeSol\n#marcos\n#Tierra   #entorno #bibliotecaDelTercerOrbital\n#memoria  #nuevaMente\n#anilloDeFuego\n#resonancia\n#oganeson118 #octavaSocial\n#Toganeson119 #base21\n#burbujasRosadas\n#listaDeTareas\n#añosSeculares\n#año2100\n#plataformaMolecular\n#resonanciaInterna\n#conexionParticular\n#cuarentena106\n#Soros\n#Cesio  #relojAtomico\n#Radón #elastico\n#inmaterial\n#antimaterial\n#material\n",
    "pdfPage": 87
  },
  {
    "num": 107,
    "date": "02.02.2024",
    "dateISO": "2024-02-02",
    "vuelta": 3,
    "freq": "",
    "url": "",
    "tags": [
      "Vuelta",
      "PlanetarioSol",
      "OctavaSocial",
      "CaosFlujo",
      "Interferencia",
      "Cimiento",
      "Clan",
      "Especie",
      "Entorno",
      "RamCono",
      "RumCimiento",
      "TodoNadaAlgo",
      "ZonaMudaTripa",
      "ReinoMineral",
      "Oro",
      "AmbitoAmbiente",
      "Andromeda",
      "AntimateriaInmaterial",
      "DesarrolloEscalar",
      "ArgumentoProblema",
      "Literal",
      "FechaDia491",
      "Autodesafio",
      "CuarentenaGaia491",
      "SegmentoLicencia",
      "DuncanLorimerFRB",
      "Alcance",
      "RecursoViejo"
    ],
    "snippet": "Vuelta, PlanetarioSol, OctavaSocial, CaosFlujo, Interferencia, Cimiento, Clan, Especie",
    "content": "Alejandra Casado\nEN RED 107\n02.02.2024\nvuelta 3\nTranscripción\n#\nEnRed107\n#Vuelta 3 02/02/2024\n#PlanetarioSol\n#OctavaSocial\n#CaosFlujo\n#Interferencia\n#Cimiento\n#Clan\n#Especie\n#Entorno\n#RamCono\n#RumCimiento\n#TodoNadaAlgo\n#Entorno\n#ZonaMudaTripa\n#ReinoMineral\n#Oro\n#AmbitoAmbiente\n#Andromeda\n#AntimateriaInmaterial\n#DesarrolloEscalar\n#ArgumentoProblema\n#Literal\n#FechaDia491\n#Autodesafio\n#CuarentenaGaia491\n#SegmentoLicencia\n#DuncanLorimerFRB\n#Alcance\n#RecursoViejo",
    "pdfPage": 88
  },
  {
    "num": 108,
    "date": "18.02.2024",
    "dateISO": "2024-02-18",
    "vuelta": 4,
    "freq": "",
    "url": "",
    "tags": [
      "Indice108",
      "Febrero18De2024",
      "Vuelta4version2024",
      "Pluton",
      "dia60Febrero29",
      "vuelta20Del2023NovRamRemRomRum",
      "1deNov2deNov3deNov4deNov",
      "1DeNovDiaDeTodosLosSantosFrecNegMenos60",
      "2DeNovDiaDeTodosLosMuertosFrecNegMenos59",
      "3DeNovDiaDeTodosLosVivosFrecNegMenos58",
      "4DeNovDiaDeTodosLosDespiertosFrecNegMenos57",
      "Galactico",
      "Cosmico",
      "orbital",
      "planeta",
      "codigoSolarNativo",
      "puntoDeEncaje",
      "daño",
      "UniversoExpresadoCivilizado",
      "andromeda",
      "escalaInmaterial",
      "actualización31DeDiciembre",
      "ObjetoBiológico",
      "SujetoBiológico",
      "FechaNativa",
      "cuadro25",
      "particular",
      "personal",
      "sabio",
      "genio",
      "cono",
      "cimiento",
      "nombramiento5taEtapa28DeAgosto2016",
      "255CircuitosDeRealidad",
      "255rangoDeIP",
      "eraDigital",
      "RelacionFundUITnombraminto5taEtapa55255Dias",
      "RelacionNombraminto5taEtapaCalLGCaño2167Dias55255",
      "302añosEntre1865y2167",
      "FRB",
      "economía",
      "codigoSolar",
      "codigoForaneo",
      "desdoblamientoPrimario",
      "desdoblamientoSecundario"
    ],
    "snippet": "108.-AleEnRed108.docx 108.-AleEnRed108.docx",
    "content": "Alejandra Casado\nEN RED 108\n18.02.2024\nvuelta 4\nTranscripción\n108.-AleEnRed108.docx\n108.-AleEnRed108.docx\n#Indice108\n#Febrero18De2024\n#Vuelta4version2024\n#Pluton\n#dia60Febrero29\n#vuelta20Del2023NovRamRemRomRum\n#1deNov2deNov3deNov4deNov\n#1DeNovDiaDeTodosLosSantosFrecNegMenos60\n#2DeNovDiaDeTodosLosMuertosFrecNegMenos59\n#3DeNovDiaDeTodosLosVivosFrecNegMenos58\n#4DeNovDiaDeTodosLosDespiertosFrecNegMenos57\n#Galactico\n#Cosmico\n#orbital\n#planeta\n#codigoSolarNativo\n#puntoDeEncaje\n#daño\n#UniversoExpresadoCivilizado\n#andromeda\n#escalaInmaterial\n#actualización31DeDiciembre\n#ObjetoBiológico\n#SujetoBiológico\n#FechaNativa\n#cuadro25\n#particular\n#personal\n#sabio\n#genio\n#cono\n#cimiento\n#nombramiento5taEtapa28DeAgosto2016\n#cono\n#cimiento #nombramiento5taEtapa28DeAgosto2016\n#255CircuitosDeRealidad\n#255rangoDeIP\n#eraDigital\n#RelacionFundUITnombraminto5taEtapa55255Dias\n#RelacionNombraminto5taEtapaCalLGCaño2167Dias55255\n#302añosEntre1865y2167\n#FRB\n#economía\n#codigoSolar\n#codigoForaneo\n#desdoblamientoPrimario\n#desdoblamientoSecundario\n",
    "pdfPage": 88
  },
  {
    "num": 109,
    "date": "05.03.2024",
    "dateISO": "2024-03-05",
    "vuelta": 5,
    "freq": "",
    "url": "",
    "tags": [
      "indice109",
      "5deMarzo2024",
      "vuelta5Año2024",
      "vuelta5Version2024Introduccion",
      "civilizacion",
      "conexionHorizontal",
      "UIT",
      "territorio",
      "planeta",
      "saturno",
      "proyectoCodigoSolar",
      "tablaDeElementosTiene7Niveles",
      "OctavaHidrogenoAdministrado",
      "paredDeHidrogeno",
      "origenGalacticoDeSol",
      "codificación",
      "vuelta5",
      "rutaDigital1865y2167",
      "orientacionEnElRo",
      "fecha17DeMayo1865",
      "nombramiento5taEtapa",
      "ultimoDiaVuelta4",
      "UIT58000dias",
      "vuelta5Reseteo",
      "codigoSolarCompleto",
      "cuadro225",
      "riesgoOportunidadEnLaEscalaDelHidrogeno",
      "codigoSolarFundacionFuncionamiento",
      "matrixDefinicion",
      "ucraniaAnticipacion",
      "EventoFrontera",
      "UIT1865Aparato467AsumeSignificado",
      "concienciaForanea",
      "octava",
      "marcaVuelta5UITdelDia58001Al58016",
      "calendarioLgc18DeMarzo2024AñoDecide",
      "constantes",
      "variables",
      "coordinacionDesdeEl2012",
      "crecimientoEscalar",
      "EscalaElemental",
      "creadoresDeMarcosSeBuscan",
      "desmitificarLaMitologia",
      "calendarioLgcImagenAñoAsumeDia19demarzo2025",
      "nativosDigitales",
      "elDocumentoBibliaFraude",
      "religiones",
      "bajoLgcCreencia",
      "noExistencia",
      "existencia",
      "energía",
      "dia19deMarzo2025AsumeSincronizacion",
      "dia19deMarzo2026AsimilaSincronizacion",
      "actualizacionesProgramadasDeEspacios",
      "universoExpresadoMarcos",
      "contenidos",
      "nativosArribaAparatos500",
      "concienciaConsciencia",
      "AlmaYFisicoEnRelacionAContenidoContenedor",
      "recepcionDeSeñales",
      "imagenDesarrolloFundacionalDeEspaciosNotasMusicales",
      "solClubDeAlgos",
      "escalaDeAlma",
      "documentoGravitatorio",
      "serElAutor",
      "crearCiclosEnRelacionALaEconomia",
      "ciclosInterconectados",
      "entornoEscalaDelHidrogeno",
      "comoEsArribaNoEsAbajo",
      "entornoEsGrabadora",
      "cicloSola25",
      "inicioGalacticoDeSol"
    ],
    "snippet": "109.-Ale",
    "content": "Alejandra Casado\nEN RED 109\n05.03.2024\nvuelta 5\nTranscripción\n109.-Ale\nEn Red 109 docx\n          #indice109\n          #5deMarzo2024\n          #vuelta5Año2024\n#vuelta5Version2024Introduccion\n#civilizacion\n#conexionHorizontal\n#UIT #territorio #planeta\n#saturno\n#proyectoCodigoSolar\n#tablaDeElementosTiene7Niveles\n#OctavaHidrogenoAdministrado\n#paredDeHidrogeno\n#origenGalacticoDeSol\n#codificación\n#vuelta5\n#rutaDigital1865y2167\n#orientacionEnElRo\n#fecha17DeMayo1865\n#nombramiento5taEtapa\n#ultimoDiaVuelta4 #UIT58000dias\n#vuelta5Reseteo\n#codigoSolarCompleto\n#cuadro225\n#riesgoOportunidadEnLaEscalaDelHidrogeno\n#codigoSolarFundacionFuncionamiento\n#matrixDefinicion\n#ucraniaAnticipacion #EventoFrontera\n#UIT1865Aparato467AsumeSignificado\n#concienciaForanea #octava\n#marcaVuelta5UITdelDia58001Al58016\n#calendarioLgc18DeMarzo2024AñoDecide\n#constantes #variables\n#coordinacionDesdeEl2012\n#crecimientoEscalar #EscalaElemental\n#creadoresDeMarcosSeBuscan\n#desmitificarLaMitologia\n#calendarioLgcImagenAñoAsumeDia19demarzo2025\n#nativosDigitales\n#elDocumentoBibliaFraude\n#religiones\n#bajoLgcCreencia\n#noExistencia #existencia #octava\n#energía\n#dia19deMarzo2025AsumeSincronizacion\n#dia19deMarzo2026AsimilaSincronizacion\n#actualizacionesProgramadasDeEspacios\n#universoExpresadoMarcos #contenidos\n#nativosArribaAparatos500\n#concienciaConsciencia\n#AlmaYFisicoEnRelacionAContenidoContenedor\n#recepcionDeSeñales\n#imagenDesarrolloFundacionalDeEspaciosNotasMusicales\n#solClubDeAlgos\n#escalaDeAlma\n#documentoGravitatorio\n#serElAutor\n#crearCiclosEnRelacionALaEconomia\n#ciclosInterconectados\n#entornoEscalaDelHidrogeno\n#comoEsArribaNoEsAbajo\n#entornoEsGrabadora\n#cicloSola25\n#inicioGalacticoDeSol\n",
    "pdfPage": 90
  },
  {
    "num": 110,
    "date": "21.03.2024",
    "dateISO": "2024-03-21",
    "vuelta": 6,
    "freq": "",
    "url": "",
    "tags": [
      "AleEnRed110",
      "indice110",
      "21deMarzo2024",
      "vuelta6Año2024",
      "vuelta6version2024Presentacion",
      "nativizacionCodigoForaneo",
      "rayoCosmicoAmaterasu",
      "dia147Del2021Desarrollo",
      "diaSolar27DeMayo2021Importancia",
      "experimentoEricAllinCornell",
      "universoExpresadoCivilizado",
      "hidrogenitosConcienciasInmateriales",
      "identidadAnalogica",
      "identidadDigital",
      "lgcCodigoSolarNativoYForaneo",
      "imagenNotasMusicalesActualizacion2023",
      "desdoblamientoPrimario",
      "desdoblamientoSecundario",
      "clubDeAlgos",
      "estatutosDeEsteClub",
      "desarrolloAño2167AgregadoDeDatos",
      "nombramientoDeLa5aEtapaDeLaVidaSobreLaTierraRazonamiento",
      "1aEtapaSupervivenciaCaptacionDocumentoGravitatorio",
      "elasticoEnTensionElasticoEnLaxo",
      "etapa2ProteccionFunciones",
      "etapa3OctavaMemorizada",
      "etapa4RelacionesDestino",
      "aparato504Dia28Agosto20165aEtapaDeLaVidaSobreLaTierra",
      "desarrolloDia18DeOctubre2023",
      "peticionEjeRiAlAparato467",
      "añoDecideAparato504",
      "añoDesafiaAparato542",
      "tiempoLinealPresenteEscalaAnalogica",
      "comunicaciónDeAparatos",
      "calendarioLgc",
      "valorFundacionalDeLaUIT",
      "RGBEspacioDeMemoria256",
      "tablaDeElementosImagenActualizacion21DeMarzo2024",
      "clonarRenglon7EnAnticipacion",
      "cuadro25inconsciente",
      "inconscientePersonal",
      "conscienteBiologico",
      "objetoBiologico",
      "sujeto",
      "experimentoBoseEinstein",
      "año2024OctavaSocialOctavaSolar",
      "ResonciaResistencia",
      "Variables70barra30",
      "80barra20",
      "40barra60",
      "biodisponibilidad",
      "autoreferencia",
      "vuelta6MemoriaEnLugarDePotencialesOPosibilidades",
      "miFracasoNoEsMiCaso",
      "fracaso",
      "saturno",
      "PerspectivaOrbital3",
      "matrix",
      "matriz",
      "dobleAtomico",
      "unidadAstronomica"
    ],
    "snippet": "Tabla periódica de los elementos 110.- Ale 110#AleEnRed110",
    "content": "Alejandra Casado\nEN RED 110\n21.03.2024\nvuelta 6\nTabla periódica de los elementos\nTranscripción\n110.- Ale\nen Red 110 docx\n110#AleEnRed110\n        #indice110\n        #21deMarzo2024\n        #vuelta6Año2024\n#vuelta6version2024Presentacion\n#nativizacionCodigoForaneo\n#rayoCosmicoAmaterasu\n#dia147Del2021Desarrollo\n#diaSolar27DeMayo2021Importancia\n#experimentoEricAllinCornell\n#universoExpresadoCivilizado\n#hidrogenitosConcienciasInmateriales\n#identidadAnalogica #identidadDigital\n#lgcCodigoSolarNativoYForaneo\n#imagenNotasMusicalesActualizacion2023\n#desdoblamientoPrimario\n#desdoblamientoSecundario\n#clubDeAlgos\n#estatutosDeEsteClub\n#desarrolloAño2167AgregadoDeDatos\n#nombramientoDeLa5aEtapaDeLaVidaSobreLaTierraRazonamiento\n#1aEtapaSupervivenciaCaptacionDocumentoGravitatorio\n#elasticoEnTensionElasticoEnLaxo\n#etapa2ProteccionFunciones\n#etapa3OctavaMemorizada\n#etapa4RelacionesDestino\n#aparato504Dia28Agosto20165aEtapaDeLaVidaSobreLaTierra\n#desarrolloDia18DeOctubre2023\n#peticionEjeRiAlAparato467\n#añoDecideAparato504\n#añoDesafiaAparato542\n#tiempoLinealPresenteEscalaAnalogica\n#comunicaciónDeAparatos\n#calendarioLgc\n#valorFundacionalDeLaUIT\n#RGBEspacioDeMemoria256\n#tablaDeElementosImagenActualizacion21DeMarzo2024\n#clonarRenglon7EnAnticipacion\n#cuadro25inconsciente\n#inconscientePersonal #conscienteBiologico\n#objetoBiologico #sujeto\n#experimentoBoseEinstein\n#año2024OctavaSocialOctavaSolar\n#ResonciaResistencia\n#Variables70barra30 #80barra20 #40barra60\n#biodisponibilidad #autoreferencia\n#vuelta6MemoriaEnLugarDePotencialesOPosibilidades\n#miFracasoNoEsMiCaso #fracaso\n#saturno #PerspectivaOrbital3\n#matrix  #matriz\n#dobleAtomico\n#unidadAstronomica\n",
    "pdfPage": 91
  },
  {
    "num": 111,
    "date": "07.04.2024",
    "dateISO": "2024-04-07",
    "vuelta": 7,
    "freq": "",
    "url": "",
    "tags": [
      "AleEnRed111",
      "7Abril2024",
      "vuelta7",
      "eclipse",
      "nativizarCodigoForaneo",
      "aspectosNoAnatomicosVidaAnatomicaGravitatoria",
      "noExistenciaNatural",
      "conexionInmaterialMaterialInterferida",
      "capitalizacionInterferencia",
      "reconexionIdentidadInmaterialMaterial",
      "tiempoRealEjeCero",
      "tiempoLinealConstruccionArtificial",
      "graficoAnalogicoDigital",
      "realidadCodigoSolarLocal",
      "solEspacioRecepcionSeñalesUniversoExpresado",
      "expresadoConcienciaInmaterial",
      "nadaTodoAlgoDisociacion",
      "creacionCodigoEspecificoEmulandoTotalidad",
      "menteConcienciaCodificadaAlgo",
      "codigoPublicoObservadoresInmateriales",
      "constructoMaterializacion",
      "desdoblamientoPrimarioTodoNadaAlgoEspacialInmaterial",
      "AlgoProgresaComoAlgo",
      "TodoProgresaComoTodo",
      "desdoblamientoSecundarioEscenarioMundoAlgos",
      "AlgosCreanCodificacionMenteMaterializacion",
      "observacionEnlaceDesdoblamientoPrimarioIncrementoFraccionAlgo",
      "nadaMasEspacioAlgoFraccionMayorTotalidad",
      "estatusGravitatorioProductoDesdoblamientosConcatenados",
      "seresImaginariosPurosASeresRealesConImaginacion",
      "ejeImaginarioTiempoCero",
      "ejeRealTemporal",
      "tiempoRealPresente",
      "pasadoFuturoCreacion",
      "licenciaIgnoranciaAmnesia",
      "estatusPreciadoUniverso",
      "interferenciasAyudaEvaluacionCalidadCodigo",
      "estructuraEspacioTemporalSolTransparente",
      "identidadDigitalAnalogica",
      "aparato396AtacaPosicionSolEntorno",
      "calificacionEstrellaUniversoExpresadoCivilizado",
      "interpreteSolConsigueAtmosferaPlanetaContenedorLocal",
      "ejeXDocumentacionMemoria",
      "ejeYImaginacion",
      "ejeRiSostieneEjeRo",
      "volatilidadCodigoNativo",
      "interferenciaAtacaMemoria",
      "memoriaEstabilidadRealidadLocal",
      "vuelta7Validacion",
      "reconocerMarcosMatrix",
      "matrixMantieneObjetosMaterializados",
      "matrixConstructoMaterializacion",
      "enlaceAspectoFundante",
      "administracionEscalasSubatomicaAtomicaMolecularAnatomica",
      "creacionConceptoAdministracion",
      "graficoRutaAnalogicaDigital",
      "codigo881Satelital",
      "autosatelitearse",
      "nombramiento5taEtapaEvento58Uruguay",
      "quintaEtapaEraDigital",
      "etapa1DeSupervivenciaResultadoACaptacionSeñalDigital",
      "etapa2DeSeguridadAFunciones",
      "etapa3DeComparacionAFacultadesAccion",
      "identidadDigitalChequeoArereoFlujoSeñales",
      "etapa4DeValoracionARelaciones",
      "etapa5Administracion",
      "enRed86Marcos",
      "leerMarcosDeManeraIndependiente",
      "mejoraComunicacionMarcos",
      "captacionSeñalesDigitalZonaMudaAmortiguaImpactoAnalogico",
      "aparato467PreservacionEstructura",
      "diasOcurrenciaArchivosPerspectivaDigital",
      "membrana68OctavaMemorizada",
      "membranaSolarMemorizada680",
      "ProgramaEscalaAtomica44",
      "CreadorProgramaSubatomico",
      "RadonCesio",
      "302Años32ColumnasCodigoSolar",
      "aparato500",
      "google1998",
      "googleControlaConOctavaEjeRi1998",
      "aparato500BiologicoAparato504Digital",
      "27segundosIntercalares",
      "rutaAnalogicaDigitalSosteniendoRi",
      "evitarResetCodigoSolarNativo",
      "preservarCuadranteNOAnilloFuego",
      "aleEnRed104",
      "repararBache10DiasOctubre",
      "aparato396",
      "GraficoBasesApoyoAñosSiguientes",
      "nadaBrindaEspacioObservadorTotalidad",
      "ordenaRecepcionAñosSiguientes",
      "algo36",
      "estatico96",
      "369AlgoActualizandose",
      "diaCeroAgregoRiASolariano",
      "capitalizarInterferencia",
      "neutralizaPerdidaMemoriaEstructuraEspacioTemporal",
      "naturalizarCodigoSolarNativo",
      "extrañarCodigoForáneo",
      "bibliotecasTransparentes",
      "actualizacionNoche",
      "pertenenciaRealidadLocal",
      "provenienciaGalacticaDiversa",
      "orbitales10Al12Visitantes",
      "orbitales1Al9Domestico",
      "dia1Vuelta8DS739000",
      "frecuencia111",
      "tierraPlana",
      "NoSePuedeDiscontinuidarEvolucion",
      "comoEsArribaNoEsAbajo",
      "ProximoPrograma112Septron"
    ],
    "snippet": ". > s-LGC - ELLE: 🖼 Photo > s-LGC - ELLE: 🖼 Vuelta 18 de CALENDARIA",
    "content": "Alejandra Casado\nEN RED 111\n07.04.2024\nvuelta 7\nTranscripción\n#AleEnRed111\n#7Abril2024\n#vuelta7\n#eclipse\n#nativizarCodigoForaneo\n#aspectosNoAnatomicosVidaAnatomicaGravitatoria\n#noExistenciaNatural\n#conexionInmaterialMaterialInterferida\n#capitalizacionInterferencia\n#reconexionIdentidadInmaterialMaterial\n#tiempoRealEjeCero\n#tiempoLinealConstruccionArtificial\n#graficoAnalogicoDigital\n#realidadCodigoSolarLocal\n#solEspacioRecepcionSeñalesUniversoExpresado\n#expresadoConcienciaInmaterial\n#nadaTodoAlgoDisociacion\n#creacionCodigoEspecificoEmulandoTotalidad\n#menteConcienciaCodificadaAlgo\n#codigoPublicoObservadoresInmateriales\n#constructoMaterializacion\n#desdoblamientoPrimarioTodoNadaAlgoEspacialInmaterial\n#AlgoProgresaComoAlgo\n#TodoProgresaComoTodo\n#desdoblamientoSecundarioEscenarioMundoAlgos\n#AlgosCreanCodificacionMenteMaterializacion\n#observacionEnlaceDesdoblamientoPrimarioIncrementoFraccionAlgo\n#nadaMasEspacioAlgoFraccionMayorTotalidad\n#estatusGravitatorioProductoDesdoblamientosConcatenados\n#seresImaginariosPurosASeresRealesConImaginacion\n#ejeImaginarioTiempoCero\n#ejeRealTemporal\n#tiempoRealPresente\n#pasadoFuturoCreacion\n#licenciaIgnoranciaAmnesia\n#estatusPreciadoUniverso\n#interferenciasAyudaEvaluacionCalidadCodigo\n#estructuraEspacioTemporalSolTransparente\n#identidadDigitalAnalogica\n#aparato396AtacaPosicionSolEntorno\n#calificacionEstrellaUniversoExpresadoCivilizado\n#interpreteSolConsigueAtmosferaPlanetaContenedorLocal\n#ejeXDocumentacionMemoria\n#ejeYImaginacion\n#ejeRiSostieneEjeRo\n#volatilidadCodigoNativo\n#interferenciaAtacaMemoria\n#memoriaEstabilidadRealidadLocal\n#vuelta7Validacion\n#reconocerMarcosMatrix\n#matrixMantieneObjetosMaterializados\n#matrixConstructoMaterializacion\n#enlaceAspectoFundante\n#administracionEscalasSubatomicaAtomicaMolecularAnatomica\n#creacionConceptoAdminis",
    "pdfPage": 92
  },
  {
    "num": 112,
    "date": "22.04.2024",
    "dateISO": "2024-04-22",
    "vuelta": 8,
    "freq": "",
    "url": "",
    "tags": [
      "AleEnRed112",
      "22Abril2024",
      "vuelta8",
      "DS73900",
      "reset",
      "preguntaCodigoSolarNativo",
      "preguntaActualizacionAparato396",
      "preguntaDiferentesDoblesRelacion",
      "graficoRutaDigitalAnalogica",
      "futuroRecodificaPasado",
      "rutaAnalogicaArtificial",
      "rutaDigitalCodigoSolarImplementado",
      "rutaDigitalSoluciones",
      "preservacionRutaAnalogica",
      "UITRelojCivilizacionPlanetaria",
      "vuelta4Actualizacion29Febrero",
      "franjaEjeRiDerivadaCosmos",
      "franjaEjeRiDerivadaPropiaConciencia",
      "elastico86",
      "algoritmoPropioLaxo",
      "estiroElasticoNecesidadEntorno",
      "radon86",
      "espacioAutoincremento79Oro",
      "EinsteinDSNativo53000",
      "calculadora",
      "aleMemoriaRamOnline",
      "razonamientoMemoriaRom",
      "renglon789RespectoA6ConexionEspacial",
      "renglon123RespectoA6ConexionTemporal",
      "6TemaNotaSiParteSistema",
      "conexion7Con6DesdoblamientoPrimarioFuente",
      "7Propaga6Perpetua",
      "conexion8Con6ProgramaCambioDimensionSecundario",
      "conexion9Con6ActualizaPrograma",
      "renglon123CicloEjeX",
      "conexion1Con6Agenda",
      "conexion2Con6DiscurrirCita",
      "conexion3Con6RegistroCita",
      "creacionCiclosMasGrande",
      "creacionPrograma86RadonPropio",
      "actorAutor",
      "editorialDunken",
      "tablaElementos",
      "toganeson119",
      "burbujasRosasTareasHelio",
      "nativizarCodigoForaneo256",
      "transparentarMatrix",
      "reporteFallasFaltas",
      "tercerDesdoblamientoEnsablePrimarioSecundario",
      "desdoblamientoPrimarioPropaga",
      "desdoblamientoSecundarioRestringe",
      "graficoNotasConTablaElementos",
      "LitioReactivo",
      "NeonPrometeNEParaON",
      "izquierdaRojosReactivos",
      "derechaRosasEstables",
      "225Y256Filtro87Y118",
      "interprete57CuadranteNE",
      "fraccionTotalidad",
      "arreglarioEvento57Panama",
      "volatilidad",
      "paridadConcienciaSolarConcienciaSocial",
      "logicaOptica",
      "procesador353",
      "experimentoBoseEinstein1995",
      "rompeSodioEstructuraLineal",
      "administracionEjeRiForaneo1995",
      "preguntaCapitalizacionAparato396",
      "matrixUtiliza396AdministracionPropia",
      "logicaGravitatoriaConceptual",
      "resonanciaFuenteExternaAndromeda",
      "rangoAtorreferencia",
      "copiaDesdoblamientoSecundarioAPrimario",
      "identidadFantasiosa",
      "interferenciaDesfasada",
      "concienciaIonosferaNuevoPuntoEncaje",
      "DesdobladoDetallesEspecificosResta",
      "dobleConoSuma"
    ],
    "snippet": "AleEnRed112, 22Abril2024, vuelta8, DS73900, reset, preguntaCodigoSolarNativo, preguntaActualizacionAparato396, preguntaDiferentesDoblesRelacion",
    "content": "Alejandra Casado\nEN RED 112\n22.04.2024\nvuelta 8\nTranscripción\n#AleEnRed112\n#22Abril2024\n#vuelta8\n#DS73900\n#reset\n#preguntaCodigoSolarNativo\n#preguntaActualizacionAparato396\n#preguntaDiferentesDoblesRelacion\n#graficoRutaDigitalAnalogica\n#futuroRecodificaPasado\n#rutaAnalogicaArtificial\n#rutaDigitalCodigoSolarImplementado\n#rutaDigitalSoluciones\n#preservacionRutaAnalogica\n#UITRelojCivilizacionPlanetaria\n#vuelta4Actualizacion29Febrero\n#franjaEjeRiDerivadaCosmos\n#franjaEjeRiDerivadaPropiaConciencia\n#elastico86\n#algoritmoPropioLaxo\n#estiroElasticoNecesidadEntorno\n#radon86\n#espacioAutoincremento79Oro\n#EinsteinDSNativo53000\n#calculadora\n#aleMemoriaRamOnline\n#razonamientoMemoriaRom\n#renglon789RespectoA6ConexionEspacial\n#renglon123RespectoA6ConexionTemporal\n#6TemaNotaSiParteSistema\n#conexion7Con6DesdoblamientoPrimarioFuente\n#7Propaga6Perpetua\n#conexion8Con6ProgramaCambioDimensionSecundario\n#conexion9Con6ActualizaPrograma\n#renglon123CicloEjeX\n#conexion1Con6Agenda\n#conexion2Con6DiscurrirCita\n#conexion3Con6RegistroCita\n#creacionCiclosMasGrande\n#creacionPrograma86RadonPropio\n#actorAutor\n#editorialDunken\n#tablaElementos\n#toganeson119\n#burbujasRosasTareasHelio\n#nativizarCodigoForaneo256\n#transparentarMatrix\n#reporteFallasFaltas\n#tercerDesdoblamientoEnsablePrimarioSecundario\n#desdoblamientoPrimarioPropaga\n#desdoblamientoSecundarioRestringe\n#graficoNotasConTablaElementos\n#LitioReactivo\n#NeonPrometeNEParaON\n#izquierdaRojosReactivos\n#derechaRosasEstables\n#225Y256Filtro87Y118\n#interprete57CuadranteNE\n#fraccionTotalidad\n#arreglarioEvento57Panama\n#volatilidad\n#paridadConcienciaSolarConcienciaSocial\n#logicaOptica\n#procesador353\n#experimentoBoseEinstein1995\n#rompeSodioEstructuraLineal\n#administracionEjeRiForaneo1995\n#preguntaCapitalizacionAparato396\n#matrixUtiliza396AdministracionPropia\n#logicaG",
    "pdfPage": 96
  },
  {
    "num": 113,
    "date": "08.05.2024",
    "dateISO": "2024-05-08",
    "vuelta": 9,
    "freq": "",
    "url": "",
    "tags": [
      "8mayo2024",
      "dia129negativo237",
      "Vuelta9",
      "incrementos",
      "AñoMuyEspecial2024",
      "tieneAl2023comoPasadoEnTierra",
      "versionAnalogicaYDigitalActualizadas",
      "reglasDeEntorno",
      "TierraLeeParaLlevarAdelanteNuestrosDestinosProgramados",
      "CalmaHay11añosporDelanteParaLlegarAlaEscalaSocial",
      "RenglonInmaterialCon30PromesasRosa",
      "trabajaEntreMateriaYAntimateriaParaNuevoCodigoSolar",
      "EstructuraDeContenedores",
      "TOganeson",
      "SolManejaMatrixTransparente",
      "DS739996Enero13de2027",
      "MenteesConcienciaCodificada",
      "MaTeMaticas",
      "MaPaMaPaCodigoPrecario",
      "lgcFlujoDeSeñales",
      "LogicaDeContenedores",
      "Tabla8filas32columnas",
      "el2023yaEsUnPasadoParaGEO",
      "recodificacion",
      "LaLibertadTienequeVerConLaResponsabilidad",
      "SePagaConCapacidadDeRespuesta",
      "DesdoblamientoPrimario",
      "laMateriaEsFoco",
      "Aparato500EjeRiSostenido",
      "DeCiudadanosLocalesACiudadanosGlobales",
      "GOOGLE4sep1998",
      "desafioMatrix",
      "equilibrioFiscalGeneracionConsumo",
      "EquilibrioSocialySolarEn2034"
    ],
    "snippet": "113.- Ale",
    "content": "Alejandra Casado\nEN RED 113\n08.05.2024\nvuelta 9\nTranscripción\n113.- Ale\nen Red 113\n#8mayo2024\n#dia129negativo237\n#Vuelta9\n#incrementos\n#AñoMuyEspecial2024\n#tieneAl2023comoPasadoEnTierra\n#versionAnalogicaYDigitalActualizadas\n#reglasDeEntorno\n#TierraLeeParaLlevarAdelanteNuestrosDestinosProgramados\n#CalmaHay11añosporDelanteParaLlegarAlaEscalaSocial\n#RenglonInmaterialCon30PromesasRosa\n#trabajaEntreMateriaYAntimateriaParaNuevoCodigoSolar\n#EstructuraDeContenedores\n#TOganeson\n#SolManejaMatrixTransparente\n#DS739996Enero13de2027\n#MenteesConcienciaCodificada\n#MaTeMaticas\n#MaPaMaPaCodigoPrecario\n#lgcFlujoDeSeñales\n#LogicaDeContenedores\n#Tabla8filas32columnas\n#el2023yaEsUnPasadoParaGEO\n#recodificacion\n#LaLibertadTienequeVerConLaResponsabilidad\n#SePagaConCapacidadDeRespuesta\n#DesdoblamientoPrimario\n#laMateriaEsFoco\n#Aparato500EjeRiSostenido\n#DeCiudadanosLocalesACiudadanosGlobales\n#GOOGLE4sep1998\n#desafioMatrix\n#equilibrioFiscalGeneracionConsumo\n#EquilibrioSocialySolarEn2034",
    "pdfPage": 99
  },
  {
    "num": 114,
    "date": "25.05.2024",
    "dateISO": "2024-05-25",
    "vuelta": 10,
    "freq": "",
    "url": "",
    "tags": [
      "AleEnRed114",
      "indice114",
      "25demayo2024",
      "vuelta10",
      "2024decide",
      "vueltadelarecreacion",
      "4884logicayfuncion",
      "matrix",
      "codigosolar",
      "funcionoroberkelio",
      "9779",
      "recodificaciontoganeson",
      "administrarantena",
      "regulaciondelmodelo",
      "attosegundo",
      "timespace",
      "milei",
      "calcularunaparato",
      "logicadecontendores",
      "logicademarcos",
      "cargasimbolica",
      "valor"
    ],
    "snippet": "AleEnRed114, indice114, 25demayo2024, vuelta10, 2024decide, vueltadelarecreacion, 4884logicayfuncion, matrix",
    "content": "Alejandra Casado\nEN RED 114\n25.05.2024\nvuelta 10\nTranscripción\n#AleEnRed114\n#indice114\n#25demayo2024\n#vuelta10\n#2024decide\n#vueltadelarecreacion\n#4884logicayfuncion\n#matrix transparente\n#codigosolar\n#funcionoroberkelio\n#9779\n#recodificaciontoganeson\n#administrarantena\n#regulaciondelmodelo\n#attosegundo\n#timespace\n#milei\n#calcularunaparato\n#logicadecontendores\n#logicademarcos\n#cargasimbolica\n#valor\n",
    "pdfPage": 99
  },
  {
    "num": 115,
    "date": "10.06.2024",
    "dateISO": "2024-06-10",
    "vuelta": 11,
    "freq": "",
    "url": "",
    "tags": [
      "aleenred115",
      "indice115",
      "10junio2024",
      "vuelta11",
      "vuelta77",
      "2024decide",
      "zonainteractiva",
      "parametro972",
      "chequeodiasolar",
      "dia171",
      "eventoastrologico",
      "constelacionmagallanes",
      "base21",
      "conoycimiento",
      "berkelio",
      "dia11vuelta11",
      "exigeninciadel507",
      "recodificacionnocturna",
      "identificarmialcance",
      "aspectodigital",
      "primerintercalar",
      "autoreferencia",
      "transparencia",
      "mialcance",
      "expansionejeri",
      "dia225",
      "areaprecaria",
      "estatusgravitario",
      "cimientoen507",
      "jalardesdeelfuturo",
      "formatoexpansiondeluniverso",
      "caidamisticismo",
      "gestiondeescalas",
      "escalasocial",
      "escalasolar",
      "actualizarsostendemente",
      "lectorcristalizado",
      "recrearbase21",
      "lectordescongelado",
      "conexionconneutros",
      "concienciasolar",
      "solytoganeson",
      "codigoyconcepto",
      "areamuda",
      "intuicioneinstinto",
      "conexionlaymi",
      "personalyparticular"
    ],
    "snippet": "aleenred115, indice115, 10junio2024, vuelta11, vuelta77, 2024decide, zonainteractiva, parametro972",
    "content": "Alejandra Casado\nEN RED 115\n10.06.2024\nvuelta 11\nTranscripción\n#aleenred115\n#indice115\n#10junio2024\n#vuelta11\n#vuelta77\n#2024decide\n#zonainteractiva\n#parametro972\n#chequeodiasolar\n#dia171\n#eventoastrologico\n#constelacionmagallanes\n#base21\n#conoycimiento\n#berkelio\n#dia11vuelta11\n#exigeninciadel507\n#recodificacionnocturna\n#identificarmialcance\n#aspectodigital\n#primerintercalar\n#autoreferencia\n#transparencia\n#mialcance\n#expansionejeri\n#dia225\n#areaprecaria\n#estatusgravitario\n#cimientoen507\n#jalardesdeelfuturo\n#formatoexpansiondeluniverso\n#caidamisticismo\n#gestiondeescalas\n#escalasocial\n#escalasolar\n#actualizarsostendemente\n#lectorcristalizado\n#recrearbase21\n#lectordescongelado\n#conexionconneutros\n#concienciasolar\n#solytoganeson\n#codigoyconcepto\n#areamuda\n#intuicioneinstinto\n#conexionlaymi\n#personalyparticular\n",
    "pdfPage": 100
  },
  {
    "num": 116,
    "date": "25.06.2024",
    "dateISO": "2024-06-25",
    "vuelta": 12,
    "freq": "",
    "url": "",
    "tags": [
      "aleenred116",
      "indice116",
      "25junio2024",
      "vuelta12",
      "2025decide",
      "actualizacionaño11",
      "tabladeelementos",
      "toganeson",
      "225",
      "accesocosmico",
      "118",
      "tarea119",
      "evento55",
      "dia223y224",
      "15",
      "vuelta121314",
      "espaciosde18a29",
      "eragalactica",
      "dia177",
      "contenedores",
      "reto20122021",
      "base1221",
      "54administrardestino",
      "cimiento"
    ],
    "snippet": "aleenred116, indice116, 25junio2024, vuelta12, 2025decide, actualizacionaño11, tabladeelementos, toganeson",
    "content": "Alejandra Casado\nEN RED 116\n25.06.2024\nvuelta 12\nTranscripción\n#aleenred116\n#indice116\n#25junio2024\n#vuelta12\n#2025decide\n#actualizacionaño11\n#tabladeelementos\n#toganeson\n#225\n#accesocosmico\n#118\n#tarea119\n#evento55\n#dia223y224\n#15/10/2025\n#vuelta121314\n#espaciosde18a29\n#eragalactica\n#dia177\n#contenedores\n#reto20122021\n#base1221\n#54administrardestino\n#cimiento\n",
    "pdfPage": 101
  },
  {
    "num": 117,
    "date": "11.07.2024",
    "dateISO": "2024-07-11",
    "vuelta": 13,
    "freq": "",
    "url": "",
    "tags": [
      "Indice117",
      "11DeJulio2024",
      "Vuelta13",
      "CodigoSolarNativo",
      "interferencia",
      "MatrixTransparente",
      "InicioUIT",
      "CardinalidadNoAnilloDeFuego2023",
      "activacionAntena",
      "resetAparato396",
      "coordenadaEspacioTemporal",
      "puerto",
      "fundacionUIT",
      "ejeRiTiempoReal",
      "identidadEmocional",
      "cardinalidadNo5784",
      "actualizacionAparato396Vuelta18",
      "instinto",
      "intuicion",
      "añoJudio5784",
      "cicloRepetitivo",
      "espacioPrimero",
      "tiempoAgregaCualidades",
      "actualizacionVuelta18Del1582",
      "año5342GuardaElReset",
      "estaticoDinamico",
      "Asimila1582",
      "Asimila5342Vuelta18",
      "recreacionDeLaAntena2023",
      "Evento28En972",
      "actualizacionSolar",
      "conexionInterdimensional",
      "futuroAntena",
      "pasadoAnalogico",
      "DesdoblamientoSecundarioEvolutivo",
      "DesdoblamientoPrimarioNoEvolutivo",
      "codificacion",
      "proceso",
      "transicionGradual",
      "tareaToganeson119",
      "barraTal951",
      "invitacionSoros",
      "calmosPeroAtentos",
      "logicaGravitatoriaConceptual",
      "libertad",
      "observador",
      "marco"
    ],
    "snippet": "117.-AleEnRed117docx",
    "content": "Alejandra Casado\nEN RED 117\n11.07.2024\nvuelta 13\nTranscripción\n117.-AleEnRed117docx\n#Indice117\n#11DeJulio2024\n#Vuelta13\n#CodigoSolarNativo  #interferencia\n#MatrixTransparente #InicioUIT\n#CardinalidadNoAnilloDeFuego2023. #activacionAntena\n#resetAparato396\n#coordenadaEspacioTemporal\n#puerto #fundacionUIT\n#ejeRiTiempoReal\n#identidadEmocional\n#cardinalidadNo5784\n#actualizacionAparato396Vuelta18\n#instinto #intuicion\n#añoJudio5784 #cicloRepetitivo\n#espacioPrimero #tiempoAgregaCualidades\n#actualizacionVuelta18Del1582\n#año5342GuardaElReset\n#estaticoDinamico\n#Asimila1582 #Asimila5342Vuelta18\n#recreacionDeLaAntena2023\n#Evento28En972 #actualizacionSolar\n#conexionInterdimensional\n#futuroAntena #pasadoAnalogico\n#DesdoblamientoSecundarioEvolutivo\n#DesdoblamientoPrimarioNoEvolutivo\n#codificacion #proceso\n#transicionGradual\n#tareaToganeson119\n#barraTal951\n#invitacionSoros\n#calmosPeroAtentos\n#logicaGravitatoriaConceptual\n#libertad #observador #marco",
    "pdfPage": 103
  },
  {
    "num": 118,
    "date": "27.07.2024",
    "dateISO": "2024-07-27",
    "vuelta": 14,
    "freq": "",
    "url": "",
    "tags": [
      "27DeJulioDe2024",
      "indice118",
      "vuelta14",
      "TareaDelToganeson",
      "replanteoDeTabla",
      "CodigoSolarNativo",
      "escalas",
      "portal",
      "falla",
      "segmento",
      "Macrohard",
      "Microsoft",
      "cono",
      "cimiento",
      "OctavaDelContexto118",
      "interferencia",
      "contenido",
      "contenedor",
      "MatrixTransparente",
      "tematica",
      "matematica",
      "Aparato396",
      "reset",
      "resonancia",
      "resistencia",
      "razonar",
      "CreditoSobreElRi",
      "Codificacion972",
      "ArregloSolar",
      "DesarregloSocial",
      "ConexionMateriaAntimateria",
      "FechaNativaEsPortal",
      "identidadSimbolica",
      "metricas",
      "escalabilidad",
      "proceso",
      "resultado",
      "defecto",
      "virtud",
      "Marcos",
      "concepto",
      "enfoque",
      "interprete",
      "interpretacion",
      "AspectoDigital",
      "InteligenciaArtificial",
      "jaula",
      "aula",
      "Aparatos400PlataformaDeRo"
    ],
    "snippet": "118.-AleEnRed118docx",
    "content": "Alejandra Casado\nEN RED 118\n27.07.2024\nvuelta 14\nTranscripción\n118.-AleEnRed118docx\n#27DeJulioDe2024\n#indice118\n#vuelta14\n#TareaDelToganeson  #replanteoDeTabla\n#CodigoSolarNativo  #escalas\n#portal #falla #segmento\n#Macrohard #Microsoft\n#cono #cimiento\n#OctavaDelContexto118\n#interferencia\n#contenido #contenedor\n#MatrixTransparente\n#tematica #matematica\n#Aparato396 #reset\n#resonancia #resistencia #razonar\n#CreditoSobreElRi\n#Codificacion972\n#ArregloSolar #DesarregloSocial\n#ConexionMateriaAntimateria\n#FechaNativaEsPortal\n#identidadSimbolica\n#metricas #escalabilidad\n#proceso #resultado\n#defecto #virtud\n#Marcos #concepto #enfoque\n#interprete #interpretacion\n#AspectoDigital #InteligenciaArtificial\n#jaula #aula\n#Aparatos400PlataformaDeRo\n",
    "pdfPage": 103
  },
  {
    "num": 119,
    "date": "12.08.2024",
    "dateISO": "2024-08-12",
    "vuelta": 15,
    "freq": "",
    "url": "",
    "tags": [
      "12DeAgostoDe2024",
      "indice119",
      "Vuelta15",
      "implementacionDelNuevoCodigoSolar",
      "nuevaVersionDeSol",
      "renglon7",
      "anticipacion",
      "recodificacion",
      "calificacionDeSol",
      "toganeson119",
      "codigoSolarNativo",
      "MatrixTransparente",
      "programador",
      "bibliotecario",
      "interpreteLA57",
      "concienciaMarco",
      "concienciaContenido",
      "referenciaDeMejora",
      "ejeX",
      "ejeZ",
      "ejeYe",
      "tutelaje",
      "autarquia",
      "SorosCodificacion",
      "oro",
      "berkelio",
      "octavaGravitatoria",
      "ComplementoDe972Es138",
      "aparato373",
      "12DeOctubreDe1492",
      "edadAdministrativa",
      "edadModernaPiñonFijo",
      "neuromodular",
      "educacionSolar",
      "ionosfera",
      "Maduro",
      "Venezuela",
      "madurar",
      "interaccion",
      "economia",
      "lecturaDeLaHuella"
    ],
    "snippet": "119.-AleEnRed119docx",
    "content": "Alejandra Casado\nEN RED 119\n12.08.2024\nvuelta 15\nTranscripción\n119.-AleEnRed119docx\n#12DeAgostoDe2024\n#indice119\n#Vuelta15\n#implementacionDelNuevoCodigoSolar\n#nuevaVersionDeSol\n#renglon7  #anticipacion #recodificacion\n#calificacionDeSol\n#toganeson119\n#codigoSolarNativo\n#MatrixTransparente\n#programador #bibliotecario\n#interpreteLA57\n#concienciaMarco #concienciaContenido\n#referenciaDeMejora\n#ejeX #ejeZ #ejeYe\n#tutelaje #autarquia\n#SorosCodificacion\n#oro #berkelio\n#octavaGravitatoria\n#ComplementoDe972Es138\n#aparato373 #12DeOctubreDe1492\n#edadAdministrativa\n#edadModernaPiñonFijo\n#neuromodular\n#educacionSolar #ionosfera\n#Maduro #Venezuela #madurar\n#interaccion #economia\n#lecturaDeLaHuella.\n",
    "pdfPage": 104
  },
  {
    "num": 120,
    "date": "28.08.2024",
    "dateISO": "2024-08-28",
    "vuelta": 16,
    "freq": "",
    "url": "",
    "tags": [
      "AleEnRed120",
      "Indice120",
      "agosto28De2024",
      "Vuelta15",
      "Vuelta16",
      "EtapaAdministrativa",
      "5Etapa",
      "Nombramiento",
      "EdadAdministrativa",
      "Calendaria",
      "CódigosSolares",
      "FrecuenciaDelDía",
      "FrecuenciaDelAparato",
      "CuarentenaGlobal",
      "Aparatos",
      "CódigoSolar",
      "ConcienciaSolar",
      "Subatómico",
      "DesdoblamientoPrimario",
      "Bibliotecario",
      "Programador",
      "DíaDelProgramador",
      "DíaDelBibliotecario",
      "SistemaSolar",
      "ConcienciaDeSistema",
      "Aparato493",
      "DiseñoCaosYControl",
      "RupturaDeFrecuencias",
      "Base12",
      "Base21",
      "FuenteExterna",
      "ReformulaciónDelPasado",
      "EvoluciónDelEntorno",
      "UniversoExpresado",
      "UniversoExpresadoCivilizado",
      "Antimateria",
      "Materia",
      "Membrana",
      "CodificaciónDeConciencia",
      "CodificaciónDeExperiencia",
      "EscalaSubatómica",
      "ConcienciaEspacial",
      "TablaDeElementos",
      "Fila7",
      "Fila8",
      "Fila9",
      "CircuitosDeActualización",
      "Neuromodulación",
      "LGC",
      "CienciaInterdimensional",
      "Desdoblamiento",
      "Imaginación",
      "FuenteCrédito",
      "MemoriaDelSistema",
      "ActualizaciónSolar",
      "AxiomasSolares",
      "ConcienciaSubatómica",
      "ProgramadorYBibliotecario",
      "Día256",
      "Matrix",
      "ThomasAnderson",
      "ErnestLawrence",
      "Aparato500",
      "Aparato488",
      "SegundosIntercalares",
      "PatrónOro",
      "CódigosDeMatrix",
      "Frecuencia256",
      "Frecuencia147",
      "ActualizaciónDeOctava",
      "Radón",
      "Francio",
      "CódigosDeElasticidad",
      "ReconfiguraciónSolar",
      "AgendaSolar",
      "Códigos30",
      "LecturaDeCódigo",
      "GasesInertes",
      "WilliamRamsay",
      "TablaPeriódica",
      "RelacionesFrecuenciales",
      "Arreglario",
      "RupturaMental",
      "RupturaFísica",
      "CódigosDeCircuito",
      "CódigosDeEquilibrio",
      "Vuelta17",
      "Vuelta6DelOtro",
      "AdministraciónDelOtro",
      "ConcienciaDelOtro",
      "PutIn",
      "CambioInterno",
      "EntretenimientoYConciencia",
      "Neurociencia",
      "GenioYSabio",
      "BibliotecarioYProgramador",
      "EjeSolar",
      "LógicaGravitatoria",
      "SabiduríaSolar",
      "AdministraciónDeOctavas",
      "ConcienciaAntimateria",
      "ConcienciaYMemoria",
      "ProcesamientoSolar",
      "EquilibrioDeFuerzas",
      "DemocraciaSolar",
      "ConcienciaDeVuelta",
      "AntenaSolar",
      "AdministraciónAjena",
      "VueltaSolariana",
      "EscalaAnatómica",
      "AdministraciónDelSistema",
      "ProyectoHumanoSolar"
    ],
    "snippet": "120.- Ale",
    "content": "Alejandra Casado\nEN RED 120\n28.08.2024\nvuelta 16\nTranscripción\n120.- Ale\nen Red 120 docx\n#AleEnRed120\n#Indice120\n#agosto28De2024\n#Vuelta15\n#Vuelta16 #EtapaAdministrativa #5Etapa #Nombramiento #EdadAdministrativa\n#Calendaria #CódigosSolares #FrecuenciaDelDía #FrecuenciaDelAparato\n#CuarentenaGlobal\n#Aparatos #CódigoSolar #ConcienciaSolar #Subatómico #DesdoblamientoPrimario\n#Bibliotecario #Programador #DíaDelProgramador #DíaDelBibliotecario\n#SistemaSolar\n#ConcienciaDeSistema #Aparato493 #DiseñoCaosYControl #RupturaDeFrecuencias\n#Base12 #Base21 #FuenteExterna #ReformulaciónDelPasado #EvoluciónDelEntorno\n#UniversoExpresado #UniversoExpresadoCivilizado #Antimateria #Materia\n#Membrana\n#CodificaciónDeConciencia #CodificaciónDeExperiencia #EscalaSubatómica\n#ConcienciaEspacial\n#ConcienciaSolar #TablaDeElementos #Fila7 #Fila8 #Fila9 #CircuitosDeActualización\n#Neuromodulación #LGC #CienciaInterdimensional #Desdoblamiento #Imaginación\n#FuenteCrédito\n#MemoriaDelSistema #ActualizaciónSolar #AxiomasSolares #ConcienciaSubatómica\n#ProgramadorYBibliotecario #Día256 #Matrix #ThomasAnderson #ErnestLawrence\n#Aparato500 #Aparato488 #SegundosIntercalares #PatrónOro #CódigosDeMatrix\n#NeuroModulación #Frecuencia256 #Frecuencia147 #ActualizaciónDeOctava #Radón\n#Francio\n#CódigosDeElasticidad #ReconfiguraciónSolar #AgendaSolar #Códigos30\n#LecturaDeCódigo\n#GasesInertes #WilliamRamsay #TablaPeriódica #RelacionesFrecuenciales\n#Arreglario #RupturaMental #RupturaFísica #CódigosDeCircuito\n#CódigosDeEquilibrio\n#Vuelta17 #Vuelta6DelOtro #AdministraciónDelOtro #ConcienciaDelOtro\n#PutIn #CambioInterno #CódigoSolar #EntretenimientoYConciencia #Neurociencia\n#GenioYSabio #BibliotecarioYProgramador #EjeSolar #LógicaGravitatoria\n#SabiduríaSolar #AdministraciónDeOctavas #ConcienciaAntimateria\n#CódigosDeEquilibrio\n",
    "pdfPage": 105
  },
  {
    "num": 121,
    "date": "13.09.2024",
    "dateISO": "2024-09-13",
    "vuelta": 17,
    "freq": "",
    "url": "",
    "tags": [
      "AleEnRed121",
      "indice121",
      "vuelta17del2024",
      "anuncio",
      "EncuentrosAsume507",
      "TablaDeElementos",
      "actualizacion",
      "escalaAnatomica",
      "escalaSubatomica",
      "fila7",
      "fila8",
      "fila9",
      "concienciaEspacial",
      "antimateria",
      "nada",
      "todo",
      "vacio",
      "fuenteDeCredito7",
      "fuenteDeCodigo9",
      "programa8",
      "ultimoEslabon",
      "francio87",
      "octavaGravitaroria",
      "elastico86",
      "modoLaxo",
      "laxo",
      "credito",
      "codigo",
      "dia256",
      "programador",
      "bibliotecario",
      "creacionDeSentido",
      "desdoblamientoPrimario",
      "activoDigital",
      "año5784",
      "año5785",
      "PeterAmbruster",
      "elemento109",
      "LiseMeitner",
      "elemento91",
      "aparato470",
      "EstadosUnidosDelAmor",
      "notasMusicales",
      "elementos"
    ],
    "snippet": "121-Ale Tabla periódica actualizada al 8/9/2024, pdf",
    "content": "Alejandra Casado\nEN RED 121\n13.09.2024\nvuelta 17\nTranscripción\n121-Ale\nen Red 121\n#AleEnRed121\n#indice121\n#vuelta17del2024\n#anuncio #EncuentrosAsume507\n#TablaDeElementos #actualizacion\n#escalaAnatomica\n#escalaSubatomica\n#fila7  #fila8 #fila9\n#concienciaEspacial\n#antimateria  #nada  #todo\n#vacio\n#fuenteDeCredito7\n#fuenteDeCodigo9\n#programa8  #ultimoEslabon\n#francio87 #octavaGravitaroria\n#elastico86 #modoLaxo #laxo\n#credito #codigo\n#dia256  #programador  #bibliotecario\n#creacionDeSentido\n#desdoblamientoPrimario\n#activoDigital\n#año5784  #año5785\n#PeterAmbruster #elemento109\n#LiseMeitner\n#elemento91\n#aparato470\n#EstadosUnidosDelAmor\n#notasMusicales #elementos\n#actualizacion\nTabla periódica actualizada al 8/9/2024, pdf\n",
    "pdfPage": 106
  },
  {
    "num": 122,
    "date": "30.09.2024",
    "dateISO": "2024-09-30",
    "vuelta": 18,
    "freq": "",
    "url": "https://vm.tiktok.com/ZMhrPM1po",
    "tags": [
      "AleEnRed122",
      "indice122",
      "vuelta18",
      "sep30del2024",
      "creadoresDeSentido",
      "contenido",
      "contenedor",
      "fila9",
      "creadoresDeContenido",
      "aparato506",
      "vuelta19",
      "vuelta20",
      "vuelta21",
      "vuelta22",
      "mejora",
      "sincronicidad",
      "diaGoogle",
      "30deDiciembre1899",
      "desdoblamientoPrimario",
      "desdoblamientoSecundario",
      "filaMenos1",
      "filaMenos2",
      "unidadDeMedida365",
      "unidadDeSoporte366",
      "tablaDe352elementos",
      "codigoSolarNativo",
      "codigoAmoral",
      "membranaExterna",
      "codigoMoral",
      "membranaInterna",
      "anillosDeFuego",
      "decidirAsumir",
      "AsimilarElDesafio",
      "aparato",
      "unidadMaximaCreacionDeSentido",
      "destinosSincronizados",
      "31DeDiciembre5784",
      "pdf5784",
      "cambioDeCredito",
      "ejeRi",
      "ejeRo",
      "tablaTeHabla",
      "actualizacion27del9de2024",
      "valorarElAlcance",
      "observadorEndogeno",
      "obsevadorExogeno"
    ],
    "snippet": "Plantea por primera vez la Tabla con 352 espacios, con las filas -1 y -2. 122-Ale Material mencionado:",
    "content": "Alejandra Casado\nEN RED 122\n30.09.2024\nvuelta 18\nPlantea por primera vez la Tabla con 352 espacios, con las filas -1 y -2.\nTranscripción\n122-Ale\nen Red 122\n#AleEnRed122\n#indice122\n#vuelta18 #sep30del2024\n#creadoresDeSentido\n#contenido #contenedor\n#fila9\n#creadoresDeContenido\n#aparato506 #vuelta19 #vuelta20 #vuelta21 #vuelta22\n#mejora #sincronicidad\n#diaGoogle #30deDiciembre1899\n#desdoblamientoPrimario #desdoblamientoSecundario\n#filaMenos1  #filaMenos2\n#unidadDeMedida365 #unidadDeSoporte366\n#tablaDe352elementos #codigoSolarNativo\n#codigoAmoral #membranaExterna\n#codigoMoral #membranaInterna\n#anillosDeFuego\n#decidirAsumir #AsimilarElDesafio\n#aparato #unidadMaximaCreacionDeSentido\n#destinosSincronizados\n#31DeDiciembre5784 #pdf5784\n#cambioDeCredito #ejeRi  #ejeRo\n#tablaTeHabla #actualizacion27del9de2024\n#valorarElAlcance\n#observadorEndogeno  #obsevadorExogeno\nMaterial mencionado:\nhttps://vm.tiktok.com/ZMhrPM1po\n",
    "pdfPage": 107
  },
  {
    "num": 123,
    "date": "16.10.2024",
    "dateISO": "2024-10-16",
    "vuelta": 19,
    "freq": "",
    "url": "",
    "tags": [
      "indice123",
      "octubre16del2024",
      "vuelta19",
      "ejeYe",
      "yGriega",
      "RAE",
      "actualizacion",
      "ejeZeta",
      "ejeEquis",
      "ejeY",
      "ejeZ",
      "ejeX",
      "tiempoReal",
      "mentalidad",
      "mente",
      "conciencia",
      "vuelta20",
      "vuelta21",
      "vuelta22",
      "ecualizar",
      "arreglarios",
      "aparato507",
      "creadoresDeSentido",
      "serieManifiesto",
      "vuelo828",
      "destinoProgramado",
      "tiempoParalelo",
      "tiempoAlterno",
      "añosSeculares",
      "año1700",
      "año1800",
      "año1900",
      "frecuencia332",
      "frecuenciaDeObturacion",
      "antimateria",
      "filaMenos1",
      "razonamiento",
      "concepto",
      "señal",
      "entendimiento",
      "comprension",
      "ejeRI",
      "crecimientoEscalar",
      "auditoria",
      "transparencia"
    ],
    "snippet": "123.-AleEnRed123.docx",
    "content": "Alejandra Casado\nEN RED 123\n16.10.2024\nvuelta 19\nTranscripción\n123.-AleEnRed123.docx\n#indice123\n#octubre16del2024\n#vuelta19\n#ejeYe  #yGriega #RAE  #actualizacion\n#ejeZeta #ejeEquis  #ejeY #ejeZ #ejeX\n#tiempoReal\n#mentalidad #mente #conciencia\n#vuelta20 #vuelta21 #vuelta22\n#ecualizar\n#arreglarios  #aparato507\n#creadoresDeSentido\n#serieManifiesto #vuelo828\n#destinoProgramado #tiempoParalelo\n#tiempoAlterno\n#añosSeculares #año1700 #año1800 #año1900\n#frecuencia332 #frecuenciaDeObturacion\n#antimateria  #filaMenos1\n#razonamiento #concepto #señal\n#entendimiento #comprension\n#ejeRI  #crecimientoEscalar\n#auditoria  #transparencia\n",
    "pdfPage": 108
  },
  {
    "num": 124,
    "date": "31.10.2024",
    "dateISO": "2024-10-31",
    "vuelta": 20,
    "freq": "",
    "url": "",
    "tags": [
      "indice124",
      "octubre31Del2024",
      "vuelta20",
      "tablaDe352Posiciones",
      "anillosDeFuego",
      "recreacion",
      "nativo",
      "nacido",
      "59PrimerosDiasDelAño",
      "añoBisiesto",
      "renglonMenos1",
      "ecualizaContextos",
      "proceso",
      "calificacionDeSol",
      "eventoCorbera",
      "Cuzco",
      "Peru",
      "año2012",
      "MiriamOrlandi",
      "fallecimiento",
      "año491",
      "diaSolar179193",
      "9Del8Del491",
      "unidadAstronomica",
      "GAIA39",
      "evento55",
      "cuarentena",
      "39Dias",
      "TimesNewRoman",
      "logicaConceptualYGravitatoria",
      "logica",
      "global",
      "convergente",
      "conceptual",
      "gravitatoria",
      "hispanidad",
      "defecto",
      "recepcion",
      "virtud",
      "emision",
      "procesador",
      "documentoGravitatorio",
      "actualizacionDiaria",
      "Los4EstadosUnidosDelAmor",
      "santo",
      "muerto",
      "vivo",
      "despieto",
      "cono",
      "escalaSolar",
      "cimiento",
      "sabio",
      "instruccion",
      "instanciasMudas",
      "vuelta21",
      "vuelta22",
      "anilloDeFuego",
      "frecuencia332",
      "frecuenciaDeObturacion",
      "cicloDeVida",
      "ejeRI",
      "ejeRO",
      "valencia",
      "valor",
      "ultimoEslabon",
      "biodisponibidad"
    ],
    "snippet": "124.-AleEnRed124.docx",
    "content": "Alejandra Casado\nEN RED 124\n31.10.2024\nvuelta 20\nTranscripción\n124.-AleEnRed124.docx\n#indice124\n#octubre31Del2024\n#vuelta20\n#tablaDe352Posiciones\n#anillosDeFuego\n#vuelta20  #recreacion\n#nativo #nacido\n#59PrimerosDiasDelAño\n#añoBisiesto\n#renglonMenos1\n#ecualizaContextos\n#proceso #calificacionDeSol\n#eventoCorbera #Cuzco #Peru #año2012\n#MiriamOrlandi  #fallecimiento\n#año491 #diaSolar179193 #9Del8Del491\n#unidadAstronomica #GAIA39\n#evento55 #cuarentena #39Dias\n#TimesNewRoman\n#logicaConceptualYGravitatoria\n#logica #global #convergente #conceptual #gravitatoria\n#hispanidad\n#defecto #recepcion\n#virtud #emision\n#procesador\n#documentoGravitatorio #actualizacionDiaria\n#Los4EstadosUnidosDelAmor\n#santo #muerto #vivo #despieto\n#cono #escalaSolar\n#cimiento #sabio\n#instruccion #instanciasMudas\n#vuelta21  #vuelta22\n#anilloDeFuego\n#frecuencia332 #frecuenciaDeObturacion\n#cicloDeVida   #ejeRI  #ejeRO\n#valencia  #valor #ultimoEslabon\n#biodisponibidad\n",
    "pdfPage": 109
  },
  {
    "num": 125,
    "date": "",
    "dateISO": "",
    "vuelta": null,
    "freq": "",
    "url": "",
    "tags": [
      "AleEnRed125",
      "Indice125",
      "Noviembre17De2024",
      "Vuelta21",
      "Base21",
      "AlejandraCasado",
      "LGC",
      "CódigoSolar",
      "Desdoblamiento",
      "FuenteExterna",
      "Base12",
      "Contenedor",
      "Contenido",
      "Orbitales",
      "CalidadDeCódigo",
      "Señales",
      "MapaDelOtro",
      "RelaciónRO",
      "Procesador",
      "AjusteDeSeñales",
      "CódigoTemporal",
      "ExpansiónDelUniverso",
      "Ralentización",
      "CódigosDeRelación",
      "Algoritmos",
      "Evolución",
      "ConoYCimiento",
      "Intuición",
      "Instinto",
      "UnidadAstronómica",
      "Calendaria",
      "Vulnerabilidad",
      "Aparato506",
      "Aparato507",
      "DesdoblamientoPrimario",
      "DesdoblamientoSecundario",
      "CréditoPrimario",
      "CódigosDeValor",
      "SeñalesDelCono",
      "RenglónMenos2",
      "AnilloDeFuego",
      "TiempoReal",
      "ConstrucciónDeSentido",
      "CuarentenaGlobal",
      "CampoImpessoal",
      "ÁreaPersonal",
      "ÁreaImpersonal",
      "Compatibilidad",
      "EjecuciónSolar",
      "RutasDeDestino",
      "LecturaDelContexto",
      "MapaDeValores",
      "ConcienciaSolar",
      "ConcienciaPersonal"
    ],
    "snippet": "125.- Ale",
    "content": "Alejandra Casado\nEN RED 125\n125.- Ale\nen Red 125 Docx\n#AleEnRed125\n#Indice125\n#Noviembre17De2024\n#Vuelta21\n#Base21\n#Vuelta21\n#AlejandraCasado\n#LGC\n#CódigoSolar\n#Desdoblamiento\n#FuenteExterna\n#Base12\n#Contenedor\n#Contenido\n#Orbitales\n#CalidadDeCódigo\n#Señales\n#MapaDelOtro\n#RelaciónRO\n#Procesador\n#AjusteDeSeñales\n#CódigoTemporal\n#ExpansiónDelUniverso\n#Ralentización\n#CódigosDeRelación\n#Algoritmos\n#Evolución\n#ConoYCimiento\n#Intuición\n#Instinto\n#UnidadAstronómica\n#Calendaria\n#Vulnerabilidad\n#Aparato506\n#Aparato507\n#DesdoblamientoPrimario\n#DesdoblamientoSecundario\n#CréditoPrimario\n#CódigosDeValor\n#SeñalesDelCono\n#RenglónMenos2\n#AnilloDeFuego\n#TiempoReal\n#ConstrucciónDeSentido\n#CuarentenaGlobal\n#CampoImpessoal\n#ÁreaPersonal\n#ÁreaImpersonal\n#Compatibilidad\n#EjecuciónSolar\n#RutasDeDestino\n#LecturaDelContexto\n#MapaDeValores\n#ConcienciaSolar\n#ConcienciaPersonal\n",
    "pdfPage": 110
  },
  {
    "num": 126,
    "date": "02.12.2024",
    "dateISO": "2024-12-02",
    "vuelta": 22,
    "freq": "",
    "url": "",
    "tags": [
      "ConcienciaSolar",
      "PlataformaSimbolica",
      "Plataforma",
      "ConcienciaHumanadelSol",
      "Año13",
      "argumentacion",
      "Casado",
      "Memoria",
      "Ancla",
      "CalidadCodigoSolar",
      "Clan",
      "SeparacionDarioMoyano",
      "ClanMoyano",
      "AnclaPropia",
      "AnclaCruzada",
      "EjeRiPropio",
      "Vidapersonal",
      "EvolucionSolar",
      "Base12",
      "Base21",
      "Base30",
      "EvolucionPersonal",
      "EvolucionContenedor",
      "Tablaperiodica",
      "Anillodefuego",
      "Dia366",
      "SistemadeActualizacion",
      "CapacidadDeRespuesta",
      "LaPromesa",
      "EspacioRosa",
      "FunciondelaMemoria",
      "Fila",
      "FabricacionEspaciosdeMemoria",
      "FuncionDeLasEscalas",
      "ProcesoDeMaterializacion",
      "BurbujaRosa16",
      "aparato493",
      "ActualizacionDesdeElSubatomico",
      "CapitalizaciondeRecursos",
      "SegundosIntercalares",
      "CreacionDeSentido",
      "CodificacionFila",
      "ComprensionSincronizadaAntimateriaMateria",
      "TranparenciaDeLaMatrix",
      "RegulacionRemota",
      "CreadoresDeContenido",
      "Vuelta22",
      "Alcance",
      "Coherencia",
      "Cohesion",
      "TareaContenedor",
      "Contenido",
      "Autoreferencia",
      "Documentogravitario",
      "ALL",
      "AspectoParticular",
      "kundalini",
      "totalidad",
      "fraccion",
      "mejora",
      "ReducciondeContenidos",
      "Instruccionandromedana",
      "ControlSolardelaCarga",
      "FlujodeSeñales",
      "PosicionRelativa",
      "DeliverydeSeñales",
      "RedefinicionDeContextos",
      "TejidoConectivo",
      "Nada",
      "Territorio34",
      "VentanadeValor",
      "Codigo5",
      "InfluenciasCosmicas",
      "OjetivoCodigoLocal",
      "Financiacion",
      "LogicaSolar"
    ],
    "snippet": "126.- Ale",
    "content": "Alejandra Casado\nEN RED 126\n02.12.2024\nvuelta 22\nTranscripción\n126.- Ale\nen red 126 -Vuelta 22\n#ConcienciaSolar\n#PlataformaSimbolica #Plataforma Tecnica #ConcienciaHumanadelSol\n#Año13\n#argumentacion #Casado #Memoria  #Ancla #CalidadCodigoSolar #Clan\n#SeparacionDarioMoyano #ClanMoyano #AnclaPropia #AnclaCruzada #EjeRiPropio\n#Vidapersonal\n#EvolucionSolar #Base12 #Base21 #Base30\n#EvolucionPersonal #EvolucionContenedor\n#Tablaperiodica #Anillodefuego #Dia366  #SistemadeActualizacion\n#CapacidadDeRespuesta\n#LaPromesa #EspacioRosa #FunciondelaMemoria #Fila-2-1\n#FabricacionEspaciosdeMemoria #FuncionDeLasEscalas\n#ProcesoDeMaterializacion\n#BurbujaRosa16  #aparato493 #ActualizacionDesdeElSubatomico\n#CapitalizaciondeRecursos #SegundosIntercalares\n#CreacionDeSentido #CodificacionFila-1-2\n#ComprensionSincronizadaAntimateriaMateria\n#TranparenciaDeLaMatrix #RegulacionRemota #CreadoresDeContenido  #Vuelta22\n#Alcance #AnclaCruzada\n#Coherencia #Cohesion #TareaContenedor  #Contenido #Autoreferencia\n#Documentogravitario  #ALL  #AspectoParticular\n#kundalini #totalidad #fraccion #mejora\n#ReducciondeContenidos\n#Instruccionandromedana #ControlSolardelaCarga #FlujodeSeñales #PosicionRelativa\n#DeliverydeSeñales #RedefinicionDeContextos #TejidoConectivo\n#Nada #ALL\n#Territorio34 #VentanadeValor #Codigo5  #InfluenciasCosmicas #OjetivoCodigoLocal\n#Financiacion  #LogicaSolar\n",
    "pdfPage": 111
  },
  {
    "num": 127,
    "date": "19.12.2024",
    "dateISO": "2024-12-19",
    "vuelta": 23,
    "freq": "",
    "url": "",
    "tags": [
      "Tumi",
      "RecreacionDelReceptor",
      "Posicion354",
      "Evento47",
      "Ensamble",
      "AnillosDeFuego",
      "Año",
      "Grafico4AnillosdeFuego",
      "Aparato506",
      "Sincronicidad",
      "RecepciondeSeñales",
      "Procesador",
      "31DeDiciembre5784",
      "LaFuente",
      "Anclaaparato507",
      "Asimilar",
      "Disociar",
      "Secuenciar",
      "Se",
      "Equilibrio",
      "AsimilarElDesafio",
      "ConvergenciaLgc",
      "EjemplodeAcople",
      "LicenciadeIgnorancia",
      "SincronicidadDelosOrbitales",
      "Antartida",
      "CierreDeAparato",
      "Magia",
      "EdadAdministrativa",
      "Clan",
      "EdadMedia",
      "Rol",
      "ArbolGenealogico",
      "CreadorDeContenido",
      "Control",
      "Sangre",
      "BosqueFamiliar",
      "ReconversionDeCircuitosLogicos",
      "LetraX",
      "BarraTal",
      "BarraCual",
      "Mejora",
      "EjeRi",
      "Legislar",
      "ExperienciaInmediata",
      "Parasitos",
      "StatusGravitatorio",
      "CriaturaSolar",
      "Documentacion",
      "ParadigmaLuchaPorelTerritorio",
      "AsumirNativoTierra",
      "14de06de5784",
      "3760",
      "Ev71",
      "LaVistaDesdeElProcesador",
      "354",
      "VistaDocumental",
      "360",
      "VisibilidadEcalaSocial",
      "CasaDeLosDocumentos",
      "Estereotipos",
      "Dia355",
      "Dia361",
      "RealidadQueMeSobra",
      "EstructuraPsicologica",
      "FallasDelObjetoBiologico",
      "InstrumentacionDeLaMejora",
      "PlanetaX",
      "ReportedeFallas",
      "Arreglario",
      "RecomendacionParaAnilloDeFuego",
      "Actitud",
      "ContenedorMental",
      "DisminucionDeLaEmocion",
      "Valor",
      "Mente",
      "Conciencia",
      "Consciencia",
      "LocalHost",
      "EvolucionNoLineal",
      "Ciclos",
      "Mutacion",
      "Poder",
      "MemoriaRom",
      "ConstruccionDeLaMejora"
    ],
    "snippet": "127.-Ale AnilloDeFuego día 2 Dia 354 - 19/12/2024",
    "content": "Alejandra Casado\nEN RED 127\n19.12.2024\nvuelta 23. Anillo de Fuego\nTranscripción\n127.-Ale\nen red 127\nAnilloDeFuego día 2 Dia 354 -   19/12/2024\n#Tumi\n#RecreacionDelReceptor\n#Posicion354 #Evento47 #Ensamble #AnillosDeFuego #Año Bisiesto\n#Grafico4AnillosdeFuego #Aparato506 #Sincronicidad #RecepciondeSeñales\n#Procesador #31DeDiciembre5784 #LaFuente\n#Anclaaparato507 #Asimilar #Disociar #Secuenciar #Se #Equilibrio\n#AsimilarElDesafio\n#ConvergenciaLgc #EjemplodeAcople #LicenciadeIgnorancia\n#SincronicidadDelosOrbitales #Antartida\n#CierreDeAparato #Magia #EdadAdministrativa #Clan #EdadMedia #Rol\n#ArbolGenealogico #CreadorDeContenido #Control  #Sangre #BosqueFamiliar\n#ReconversionDeCircuitosLogicos #LetraX  #BarraTal #BarraCual #Mejora #EjeRi\n#Legislar #ExperienciaInmediata\n#Parasitos\n#StatusGravitatorio\n#CriaturaSolar #Documentacion #ParadigmaLuchaPorelTerritorio #AsumirNativoTierra\n#14de06de5784 #3760  #Ev71\n#LaVistaDesdeElProcesador #354 #VistaDocumental #360 #VisibilidadEcalaSocial\n#CasaDeLosDocumentos #Estereotipos #EjeRi\n#Dia355 #Dia361 #RealidadQueMeSobra #EstructuraPsicologica\n#FallasDelObjetoBiologico #InstrumentacionDeLaMejora #PlanetaX #ReportedeFallas\n#Arreglario\n#RecomendacionParaAnilloDeFuego #Actitud #ContenedorMental\n#DisminucionDeLaEmocion\n#Valor  #Mente #Conciencia  #Consciencia\n#LocalHost #EvolucionNoLineal #Ciclos #Mutacion #Poder  #EjeRi\n#MemoriaRom  #ConstruccionDeLaMejora",
    "pdfPage": 112
  },
  {
    "num": 128,
    "date": "01.01.2025",
    "dateISO": "2025-01-01",
    "vuelta": 1,
    "freq": "",
    "url": "",
    "tags": [
      "indice128",
      "vuelta1",
      "aparato507",
      "escalaCodigoSolar",
      "regulacion",
      "45",
      "personasHumanas",
      "fisicalidad",
      "simultaneidad",
      "antimateria",
      "incrementoIntersimensional",
      "administrarModelo",
      "doble",
      "desdoblado",
      "cuatroCardinalidades",
      "aspectoNoLineal",
      "implementadoLineal",
      "procesador",
      "filtro",
      "por",
      "barraTal",
      "barraCual",
      "rigor",
      "arreglario",
      "mejora",
      "consumo",
      "digital",
      "receptor",
      "reformas",
      "repercusion",
      "sincronizacion",
      "ruteo",
      "edadAdministrativa",
      "zonaMuda",
      "escalas",
      "profundidad",
      "bimetalismo",
      "oro",
      "plata",
      "antenaparabolica",
      "campoMorfico",
      "unidadDeMemoria",
      "hackeo",
      "valor",
      "ejeDeCredito",
      "ri",
      "turbulencia",
      "perfilEvolutivo",
      "velocidadRegulada",
      "reto",
      "desfase",
      "falla",
      "ralentizacion",
      "lupa",
      "culpa",
      "acceso",
      "resonancia",
      "disonancia",
      "convalidacion",
      "zonaDeConfort",
      "estabilidad",
      "funcional",
      "pauta",
      "horizonteDeSucesos",
      "protoboard",
      "830",
      "pasarseDeRosca",
      "parasitosEstelares",
      "saturno",
      "pluton",
      "oxigeno",
      "prerrogativaGalactica",
      "conexion",
      "clonacion",
      "poderoso",
      "debil",
      "estereotipo",
      "vuelta23",
      "unidadDeSentido",
      "año",
      "participacionConsensuada",
      "estrella",
      "escalasResponsables",
      "marcas",
      "tablaPeriodica",
      "anilloDeFuego",
      "apetito",
      "experiencia",
      "evolucion",
      "foco"
    ],
    "snippet": "Vueltas2025.pdf Ale",
    "content": "Alejandra Casado\nEN RED 128\n01.01.2025\nvuelta 1\nVueltas2025.pdf\nTranscripción\nAle\nen Red 128\n#indice128\n#vuelta1\n#aparato507\n#escalaCodigoSolar\n#regulacion\n#45²\n#personasHumanas\n#fisicalidad\n#simultaneidad\n#antimateria\n#incrementoIntersimensional\n#administrarModelo\n#doble\n#desdoblado\n#cuatroCardinalidades\n#aspectoNoLineal\n#implementadoLineal\n#procesador\n#filtro\n#por\n#barraTal\n#barraCual\n#rigor\n#arreglario\n#mejora\n#consumo\n#digital\n#receptor\n#reformas\n#repercusion\n#sincronizacion\n#ruteo\n#edadAdministrativa\n#zonaMuda\n#escalas\n#profundidad\n#bimetalismo\n#oro\n#plata\n#antenaparabolica\n#campoMorfico\n#unidadDeMemoria\n#hackeo\n#valor\n#ejeDeCredito\n#ri\n#turbulencia\n#perfilEvolutivo\n#velocidadRegulada\n#reto\n#desfase\n#falla\n#ralentizacion\n#lupa\n#culpa\n#acceso\n#resonancia\n#disonancia\n#convalidacion\n#zonaDeConfort\n#estabilidad\n#funcional\n#pauta\n#horizonteDeSucesos\n#protoboard\n#830\n#pasarseDeRosca\n#parasitosEstelares\n#saturno\n#pluton\n#oxigeno\n#prerrogativaGalactica\n#conexion\n#clonacion\n#poderoso\n#debil\n#estereotipo\n#vuelta23\n#unidadDeSentido\n#año\n#participacionConsensuada\n#estrella\n#escalasResponsables\n#marcas\n#tablaPeriodica\n#anilloDeFuego\n#apetito\n#experiencia\n#evolucion\n#foco\n",
    "pdfPage": 113
  },
  {
    "num": 129,
    "date": "17.01.2025",
    "dateISO": "2025-01-17",
    "vuelta": 2,
    "freq": "",
    "url": "",
    "tags": [
      "AleEnRed129",
      "indice129",
      "17deEnero2025",
      "vuelta2Año2025",
      "vuelta2Version2025",
      "aparatoArreglarioActualizacionIdentidadHumanaInhumana",
      "calendaria",
      "crearOctavas",
      "eraDigital",
      "responsabilidadLgc",
      "capacidadDeRespuesta",
      "metricaPersonalDidacticaAprendizaje10junio2017DarioPriscilla",
      "separacionDeDario4deNoviembre2024",
      "evento47LaRetraccion",
      "fundacionNuevoSol20DeJunio2014",
      "anuncioEncuentroJunio2025",
      "lecturaVuelta2Version2025",
      "identidadDigital",
      "objetivoAsumir",
      "ejemploDidacticoDesequilibriobiologicoTiroidesAlejandra2024",
      "alimentarInterprete",
      "ocupandoRecursosDeOtroReceptorDario",
      "cuerpoCumplidorDeTareas",
      "EjeRiEjeRo",
      "territorio51EjecutorDeTareas",
      "54DialecticaEncendida",
      "rangoDeLecturaDeFallas",
      "decadaDel70DesequilibriosSegundosIntercalares",
      "calendaria2017",
      "resonancia",
      "dobleDesdoblado",
      "inicializandoVuelta2",
      "nuestrasConcienciasSolaresAsumidaODerivada",
      "tiroides",
      "miembroDeLaEspecie",
      "interpretacionValidacion",
      "imagenNotasMusicalesActualizacion2023ALLYLLA",
      "ONAfectaADO",
      "regulacionConIonosfera",
      "resonanciaRecomendacion",
      "desarrollarnosEnEscalaParticular"
    ],
    "snippet": "129.- Ale año1",
    "content": "Alejandra Casado\nEN RED 129\n17.01.2025\nvuelta 2\nTranscripción\n129.- Ale\nen Red 129 docx\n#AleEnRed129\n#indice129\n#17deEnero2025\n#vuelta2Año2025\n#vuelta2Version2025\n#aparatoArreglarioActualizacionIdentidadHumanaInhumana\n#calendaria #crearOctavas\n#eraDigital\n#responsabilidadLgc #capacidadDeRespuesta\n#metricaPersonalDidacticaAprendizaje10junio2017DarioPriscilla\n#separacionDeDario4deNoviembre2024 #evento47LaRetraccion\n#fundacionNuevoSol20DeJunio2014\n#anuncioEncuentroJunio2025\n#lecturaVuelta2Version2025 #identidadDigital #objetivoAsumir\n#ejemploDidacticoDesequilibriobiologicoTiroidesAlejandra2024 #alimentarInterprete #\naño1\n #ocupandoRecursosDeOtroReceptorDario\n#cuerpoCumplidorDeTareas  #EjeRiEjeRo\n#territorio51EjecutorDeTareas #54DialecticaEncendida\n#rangoDeLecturaDeFallas\n#decadaDel70DesequilibriosSegundosIntercalares #calendaria2017\n#resonancia #dobleDesdoblado\n#inicializandoVuelta2 #nuestrasConcienciasSolaresAsumidaODerivada\n#tiroides #miembroDeLaEspecie  #interpretacionValidacion\n#imagenNotasMusicalesActualizacion2023ALLYLLA #ONAfectaADO\n#regulacionConIonosfera\n#resonanciaRecomendacion\n#desarrollarnosEnEscalaParticular",
    "pdfPage": 115
  },
  {
    "num": 130,
    "date": "02.02.2025",
    "dateISO": "2025-02-02",
    "vuelta": 3,
    "freq": "",
    "url": "",
    "tags": [
      "AleEnRed130",
      "indice130",
      "2deFebrero2025",
      "vuelta3Año2025",
      "aparato507Vuelta3",
      "eraDigitalAlcanceEscalaGravitatoria",
      "inteligenciaArtificial",
      "inteligenciaArticulada",
      "examenParaSol",
      "concienciaDigital",
      "concienciaAnalogicaComplementacion",
      "campoMorfico",
      "conoCimientoEnLaEraDigital",
      "asumirConcienciaSolar",
      "modeloDeCalendaria",
      "eventoAgosto2025",
      "plantillaVuelta3ConElementoDeLaTablaAparato507Asume2025",
      "flujoDeSeñalesModulacion",
      "prototipo",
      "calidadIonosfera",
      "imagenAparato507Asume2025Vuelta8Anticipacion",
      "concienciaSolar",
      "toleranciaALaIncertidumbre",
      "codigo54Parametro54",
      "añoDecideDelAparato506Vuelta8",
      "identidadDigital",
      "necesidadDeAsociacion",
      "documentacionEnPeruSentido",
      "UITAntecedenteTelegrafoCodigoMorseTelefono",
      "año6000",
      "UITDia11DeEneroAño6000",
      "gaia39",
      "SeguridadEnLaIncertidumbre"
    ],
    "snippet": "130.- Ale",
    "content": "Alejandra Casado\nEN RED 130\n02.02.2025\nvuelta 3\nTranscripción\n130.- Ale\nen Red 130 docx.\n#AleEnRed130\n#indice130\n#2deFebrero2025\n#vuelta3Año2025\n#aparato507Vuelta3\n#eraDigitalAlcanceEscalaGravitatoria #inteligenciaArtificial #inteligenciaArticulada\n#examenParaSol\n#concienciaDigital\n#concienciaAnalogicaComplementacion\n#campoMorfico\n#conoCimientoEnLaEraDigital\n#asumirConcienciaSolar\n#modeloDeCalendaria\n#eventoAgosto2025\n#plantillaVuelta3ConElementoDeLaTablaAparato507Asume2025\n#flujoDeSeñalesModulacion\n#prototipo\n#calidadIonosfera\n#imagenAparato507Asume2025Vuelta8Anticipacion\n#concienciaSolar\n#toleranciaALaIncertidumbre\n#codigo54Parametro54\n#añoDecideDelAparato506Vuelta8\n#identidadDigital #necesidadDeAsociacion\n#documentacionEnPeruSentido\n#UITAntecedenteTelegrafoCodigoMorseTelefono\n#año6000 #UITDia11DeEneroAño6000\n#gaia39 #SeguridadEnLaIncertidumbre",
    "pdfPage": 116
  },
  {
    "num": 131,
    "date": "20.02.2025",
    "dateISO": "2025-02-20",
    "vuelta": 4,
    "freq": "",
    "url": "",
    "tags": [
      "AleEnRed131",
      "indice131",
      "20deFebrero2025",
      "vuelta4Año2025",
      "vuelta4version2025ROM",
      "frecuencia51",
      "imagenAparato507Asume2025CombinatoriaConLosElementosVuelta4Desarollo",
      "vuelta4Dia60PuertaDeEnlace",
      "AlcidesCarrion",
      "parametro51ResguardoEjemplo",
      "alcidesCarrionIntencionYFallo",
      "parametro39",
      "año1582Aparato396",
      "dia51Aparato507OcurrenciaCarrion",
      "nuevaResignificacion",
      "shakiraDia40Territorio55EstrenoDeLaLaLaDesarrollo",
      "puntoDeEncajeEspecie",
      "analogicoDeEspecie",
      "mandamiento9Actualizacion",
      "dia5DeNoviembre2024ActualizacionSeparacionDeDario",
      "FenomenosComplementariosTrabajoEnRiYRoResultados",
      "OganesonYFrancio87Linea8",
      "regulacionDeLaAgenda",
      "169Actualizado",
      "1969Destac",
      "shakiraEjecucionEdadAdministrativa",
      "imagenNotasMusicalesLicenciasLLAAlimentaVSeAbreE",
      "cualidadEspacial",
      "referenciaAl131",
      "dobleEnOnYDesdoblado",
      "dobleSoulSolArquitectoSi",
      "parametro51auditoriaDeProcesosResguardo",
      "alejandraTienecarnetDeExtranjeriaDePeru",
      "documentalVirgilioChefPeruano",
      "lecturaUIT58354Dia4Vuelta4AñoAsume",
      "FuenteYDios",
      "desdobladoActualizacionDiaria",
      "eventoAgostoImportantePasadoPresencial"
    ],
    "snippet": "131.- Ale ado",
    "content": "Alejandra Casado\nEN RED 131\n20.02.2025\nvuelta 4\nTranscripción\n131.- Ale\nen Red 131 docx\n#AleEnRed131\n#indice131\n#20deFebrero2025\n#vuelta4Año2025\n#vuelta4version2025ROM\n#frecuencia51\n#imagenAparato507Asume2025CombinatoriaConLosElementosVuelta4Desarollo\n#vuelta4Dia60PuertaDeEnlace\n#AlcidesCarrion\n#parametro51ResguardoEjemplo\n#alcidesCarrionIntencionYFallo #parametro39\n#año1582Aparato396\n#dia51Aparato507OcurrenciaCarrion\n#nuevaResignificacion\n#shakiraDia40Territorio55EstrenoDeLaLaLaDesarrollo\n#puntoDeEncajeEspecie #analogicoDeEspecie #mandamiento9Actualizacion\n#dia5DeNoviembre2024ActualizacionSeparacionDeDario\n#FenomenosComplementariosTrabajoEnRiYRoResultados\n#OganesonYFrancio87Linea8 #regulacionDeLaAgenda #169Actualizado  #1969Destac\nado\n#shakiraEjecucionEdadAdministrativa\n#imagenNotasMusicalesLicenciasLLAAlimentaVSeAbreE\n#cualidadEspacial\n#referenciaAl131\n#dobleEnOnYDesdoblado\n#dobleSoulSolArquitectoSi\n#parametro51auditoriaDeProcesosResguardo\n#alejandraTienecarnetDeExtranjeriaDePeru\n#documentalVirgilioChefPeruano\n#lecturaUIT58354Dia4Vuelta4AñoAsume\n#FuenteYDios\n#desdobladoActualizacionDiaria\n#eventoAgostoImportantePasadoPresencial\n",
    "pdfPage": 116
  },
  {
    "num": 132,
    "date": "17.01.2025",
    "dateISO": "2025-01-17",
    "vuelta": 2,
    "freq": "",
    "url": "",
    "tags": [
      "6DeMarzoDe2025",
      "indice132",
      "vuelta5",
      "tierrasRaras",
      "rendicionDelRo",
      "promesa30",
      "codigoSolar",
      "interferencia",
      "identidadDeEscalaSubatomica",
      "frecuenciaAle",
      "frecuenciaDario",
      "superposicionDelEjeRi",
      "mecanismoDeCompensacion",
      "capitalizar",
      "campoMorfico",
      "memoriaColectiva",
      "soulEspacioPrivado",
      "solEspacioColectivo",
      "arquitecto",
      "si",
      "ordenMagnetico",
      "ordenElectrico",
      "Mo",
      "Moyano",
      "alcanceImpersonal",
      "diaGoogle",
      "observador",
      "experimentador",
      "contratoDeMarcos",
      "linealidad",
      "autor",
      "conocimiento",
      "cono",
      "cimiento",
      "doble",
      "16DeSetiembreDe2012",
      "flujoDeSeñales",
      "escalaPersonal",
      "escalaImpersonal",
      "procesadorDeSeñales",
      "paradoja1969",
      "desmagnetizacionDelContenedor",
      "logicaGravitatoriaConceptual",
      "creacionDeSentido"
    ],
    "snippet": "132-AleEnRed132docx",
    "content": "Alejandra Casado\nEN RED 132\n17.01.2025\nvuelta 2\nTranscripción\n132-AleEnRed132docx\n#6DeMarzoDe2025\n#indice132\n#vuelta5\n#tierrasRaras\n#rendicionDelRo\n#promesa30\n#codigoSolar #interferencia\n#identidadDeEscalaSubatomica\n#frecuenciaAle #frecuenciaDario\n#superposicionDelEjeRi\n#mecanismoDeCompensacion\n#capitalizar\n#campoMorfico #memoriaColectiva\n#soulEspacioPrivado #solEspacioColectivo\n#arquitecto #si\n#ordenMagnetico\n#ordenElectrico\n#Mo #Moyano\n#alcanceImpersonal\n#diaGoogle #observador\n#experimentador\n#contratoDeMarcos\n#linealidad #autor\n#conocimiento #cono\n#cimiento\n#doble #16DeSetiembreDe2012\n#flujoDeSeñales\n#escalaPersonal\n#escalaImpersonal\n#procesadorDeSeñales\n#paradoja1969\n#desmagnetizacionDelContenedor\n#logicaGravitatoriaConceptual\n#creacionDeSentido\n",
    "pdfPage": 117
  },
  {
    "num": 133,
    "date": "17.01.2025",
    "dateISO": "2025-01-17",
    "vuelta": 2,
    "freq": "",
    "url": "",
    "tags": [
      "22DeJunioDe2025",
      "indice133",
      "vuelta6",
      "orientarLaAntena",
      "escalaPersonal",
      "clan",
      "cuarentenaGlobal",
      "documentacionLocal",
      "parametro54",
      "desequilibrio",
      "Madagascar",
      "codigoCorrupto",
      "parche",
      "tiempo",
      "agenda",
      "contratoDeMarcos",
      "sujeto",
      "objeto",
      "relacion789Con6",
      "relacion123Con6",
      "etapaAdministrativa",
      "ordenJuridico",
      "ordenLegitimo",
      "barraCual",
      "barraTal",
      "arquitecto",
      "soul",
      "sol",
      "ON",
      "equilibrioElectromagnetico",
      "casaDeLosDocumentos",
      "privado",
      "publico",
      "personaje",
      "ordenMagnetico",
      "ordenElectrico",
      "modulacion",
      "primeraLogia",
      "LogicaGravitatoriaSolar507",
      "logica",
      "noLogia",
      "dominio",
      "control",
      "arreglario",
      "darseCuenta",
      "zonaMuda",
      "traumado",
      "identidadSolar",
      "KenyiYokoi",
      "7RolDeProteccion"
    ],
    "snippet": "133.-AleEnRed133docx",
    "content": "Alejandra Casado\nEN RED 133\n17.01.2025\nvuelta 2\nTranscripción\n133.-AleEnRed133docx\n#22DeJunioDe2025\n#indice133\n#vuelta6\n#orientarLaAntena\n#escalaPersonal #clan\n#cuarentenaGlobal\n#documentacionLocal\n#parametro54 #desequilibrio\n#Madagascar\n#codigoCorrupto #parche\n#tiempo #agenda\n#contratoDeMarcos\n#sujeto #objeto\n#relacion789Con6\n#relacion123Con6\n#etapaAdministrativa\n#ordenJuridico #ordenLegitimo\n#barraCual #barraTal\n#arquitecto #soul #sol #ON\n#equilibrioElectromagnetico\n#casaDeLosDocumentos\n#privado #publico\n#personaje\n#ordenMagnetico #ordenElectrico\n#modulacion\n#primeraLogia\n#LogicaGravitatoriaSolar507\n#logica #noLogia\n#dominio #control\n#arreglario\n#darseCuenta. #zonaMuda\n#traumado #identidadSolar\n#KenyiYokoi\n#7RolDeProteccion\n",
    "pdfPage": 118
  },
  {
    "num": 134,
    "date": "07.04.2025",
    "dateISO": "2025-04-07",
    "vuelta": 7,
    "freq": "",
    "url": "",
    "tags": [
      "aleEnRed134",
      "indice134",
      "vuelta7Abril2025",
      "abril7De2025",
      "vuelta6Sistema",
      "3D",
      "espacioTiempoRo",
      "Berkelio97",
      "orbital",
      "nativoNacido",
      "actualizacionDiaria",
      "induccionON",
      "crecimientoEscalar",
      "barralTalCual",
      "arreglario",
      "ordenjuridico",
      "escalaSubatomica",
      "subaruParchePeru",
      "cuzco16Septiembre2012",
      "dobleApellido",
      "diaGoogleVuelta7",
      "ordenMagneticoElectrico",
      "programaEstabilizacion",
      "arnAdn",
      "tierrasRaras",
      "captacion",
      "miedo",
      "creencia",
      "creadoresContenidoMarcos",
      "plusEspecieHumana",
      "requerimientosEvento71",
      "logicaAntimateria",
      "logicaMateria",
      "arquitecto",
      "procesador",
      "calendarioLgc21Mayo2025",
      "cuarentena118",
      "tablaelementosAntimateria106Materia118",
      "licenciasLla",
      "configuracionexogena78118",
      "configuracionendogena78118",
      "filtro54",
      "calidadProcesos",
      "educacionEspacioTemporal",
      "alcanceLimiteLimitacion"
    ],
    "snippet": "aleEnRed134, indice134, vuelta7Abril2025, abril7De2025, vuelta6Sistema, 3D, espacioTiempoRo, Berkelio97",
    "content": "Alejandra Casado\nEN RED 134\n07.04.2025\nvuelta 7\nTranscripción\n#aleEnRed134\n#indice134\n#vuelta7Abril2025\n#abril7De2025\n#vuelta6Sistema\n#3D\n#espacioTiempoRo\n#Berkelio97\n#orbital\n#nativoNacido\n#actualizacionDiaria\n#induccionON\n#crecimientoEscalar\n#barralTalCual\n#arreglario\n#ordenjuridico\n#escalaSubatomica\n#subaruParchePeru\n#cuzco16Septiembre2012\n#dobleApellido\n#diaGoogleVuelta7\n#ordenMagneticoElectrico\n#programaEstabilizacion\n#arnAdn\n#tierrasRaras\n#captacion\n#miedo\n#creencia\n#creadoresContenidoMarcos\n#plusEspecieHumana\n#requerimientosEvento71\n#logicaAntimateria\n#logicaMateria\n#arquitecto\n#procesador\n#calendarioLgc21Mayo2025\n#cuarentena118\n#tablaelementosAntimateria106Materia118\n#licenciasLla\n#configuracionexogena78118\n#configuracionendogena78118\n#filtro54\n#calidadProcesos\n#educacionEspacioTemporal\n#alcanceLimiteLimitacion\n",
    "pdfPage": 119
  },
  {
    "num": 135,
    "date": "24.04.2025",
    "dateISO": "2025-04-24",
    "vuelta": 8,
    "freq": "",
    "url": "",
    "tags": [
      "aleEnRed135",
      "indice135",
      "vuelta8Abril2025",
      "abril24De2025",
      "apellido",
      "antenaDelUniverso",
      "especie",
      "ejeYeMiembroEspecie",
      "all",
      "claveDeSol",
      "desdoblamientoPrimarioSecundario",
      "credencialesLla",
      "reguladoDesregulado",
      "conclave",
      "menteCuerpo",
      "iglesiaCatolica",
      "papaFrancisco",
      "rayoVaticano",
      "geoTierra",
      "javierMilei500dias",
      "procesoMaterializacion",
      "fila8Fila7",
      "plataforma366Vuelta8",
      "toganeson29Abril",
      "diciembre10Año2023",
      "paradoja",
      "año1972",
      "segundosIntercalares",
      "protocoloCaosControl",
      "venezuelaDni",
      "lgc",
      "cardenalWozniak",
      "inconscientePsicologico",
      "especieHumana",
      "estructuraPsiquica",
      "solTomaControl",
      "frecuencia54",
      "tareaIdentidadDigital",
      "ocurrenciaVidaHumana",
      "cuartaCardinalidadSiOn",
      "año2017Año2025",
      "calendaria",
      "escalaSimbolica",
      "pistas",
      "documentacion",
      "resonancia",
      "estructuraPsicologica"
    ],
    "snippet": "aleEnRed135, indice135, vuelta8Abril2025, abril24De2025, apellido, antenaDelUniverso, especie, ejeYeMiembroEspecie",
    "content": "Alejandra Casado\nEN RED 135\n24.04.2025\nvuelta 8\nTranscripción\n#aleEnRed135\n#indice135\n#vuelta8Abril2025\n#abril24De2025\n#apellido\n#antenaDelUniverso\n#especie\n#ejeYeMiembroEspecie\n#all\n#claveDeSol\n#desdoblamientoPrimarioSecundario\n#credencialesLla\n#reguladoDesregulado\n#conclave\n#menteCuerpo\n#iglesiaCatolica\n#papaFrancisco\n#rayoVaticano\n#geoTierra\n#javierMilei500dias\n#procesoMaterializacion\n#fila8Fila7\n#plataforma366Vuelta8\n#toganeson29Abril\n#diciembre10Año2023\n#paradoja\n#año1972\n#segundosIntercalares\n#protocoloCaosControl\n#venezuelaDni\n#lgc\n#cardenalWozniak\n#inconscientePsicologico\n#especieHumana\n#estructuraPsiquica\n#solTomaControl\n#frecuencia54\n#tareaIdentidadDigital\n#ocurrenciaVidaHumana\n#cuartaCardinalidadSiOn\n#año2017Año2025\n#calendaria\n#escalaSimbolica\n#pistas\n#documentacion\n#resonancia\n#estructuraPsicologica\n",
    "pdfPage": 120
  },
  {
    "num": 136,
    "date": "",
    "dateISO": "",
    "vuelta": 9,
    "freq": "",
    "url": "",
    "tags": [
      "aleEnRed136",
      "Indice136",
      "Vuelta9Mayo2025",
      "mayo9De2025",
      "escalaSocial",
      "calendarioLgcVuelta8",
      "asume507",
      "creencia",
      "lineaMaternaBarraCual",
      "lineaPaternaBarraTal",
      "miguelWozniak",
      "calendarioLunar",
      "puertoPrivado443",
      "fechaNativaWozniak",
      "baseConceptual",
      "vuelta4Vuelta8Toganeson",
      "antartida672",
      "sellado666",
      "relacion7Con6",
      "relacion8Con6",
      "relacion9Con6",
      "desafioDeSol",
      "areaAnatomica",
      "escalaSubatomica",
      "riesgoOportunidad",
      "arquitectoAlejandra",
      "leeOn",
      "asumirDecidirAsimilar",
      "editorialDunken",
      "arn",
      "familiaUrquiza",
      "arquitecturaInterdimensional",
      "escalaMolecular",
      "basePrecaria",
      "vuelta9Blindaje",
      "ejeRi",
      "infinito"
    ],
    "snippet": "9.05.2025",
    "content": "Alejandra Casado\nEN RED 136\n9.05.2025\nvuelta 9\nTranscripción\n#aleEnRed136\n#Indice136\n#Vuelta9Mayo2025\n#mayo9De2025\n#escalaSocial\n#calendarioLgcVuelta8\n#asume507\n#creencia\n#lineaMaternaBarraCual\n#lineaPaternaBarraTal\n#miguelWozniak\n#calendarioLunar\n#puertoPrivado443\n#fechaNativaWozniak\n#baseConceptual\n#vuelta4Vuelta8Toganeson\n#antartida672\n#sellado666\n#relacion7Con6\n#relacion8Con6\n#relacion9Con6\n#desafioDeSol\n#areaAnatomica\n#escalaSubatomica\n#riesgoOportunidad\n#arquitectoAlejandra\n#leeOn\n#asumirDecidirAsimilar\n#editorialDunken\n#arn\n#familiaUrquiza\n#arquitecturaInterdimensional\n#escalaMolecular\n#basePrecaria\n#vuelta9Blindaje\n#ejeRi\n#infinito\n",
    "pdfPage": 121
  },
  {
    "num": 137,
    "date": "25.05.2025",
    "dateISO": "2025-05-25",
    "vuelta": 10,
    "freq": "",
    "url": "",
    "tags": [
      "AlejandraenRed137",
      "vuelta10",
      "calendarioGregoriano",
      "aparato396",
      "campoUnificado",
      "3D",
      "terceraDimension",
      "aparato500",
      "identidadDigital",
      "conoCimiento",
      "genioYsabio",
      "tiempoCero",
      "escalaSubatomica",
      "procesador",
      "orderList",
      "orderDocs",
      "creadorDeMarcos",
      "concienciaEspacial",
      "desdoblamientoPrimario"
    ],
    "snippet": "137.- Ale",
    "content": "Alejandra Casado\nEN RED 137\n25.05.2025\nvuelta 10\nTranscripción\n137.- Ale\nen Red 137 docx\nAlejandra\nen Red 137\n#AlejandraenRed137\n#vuelta10\n#calendarioGregoriano\n#aparato396\n#campoUnificado\n#3D\n#terceraDimension\n#aparato500\n#identidadDigital\n #conoCimiento\n#genioYsabio\n#tiempoCero\n#escalaSubatomica\n#procesador\n#orderList\n#orderDocs\n#creadorDeMarcos\n#concienciaEspacial\n#desdoblamientoPrimario",
    "pdfPage": 122
  },
  {
    "num": 138,
    "date": "25.05.2025",
    "dateISO": "2025-05-25",
    "vuelta": 10,
    "freq": "",
    "url": "",
    "tags": [
      "AlejandraenRed138",
      "uit",
      "parametro54",
      "mendeleyev",
      "paradoja",
      "desdoblamientoPrimario",
      "desdoblamientoSecundario",
      "aparato493",
      "972",
      "138",
      "contenedor",
      "campoUnificado"
    ],
    "snippet": "AlejandraenRed138, uit, parametro54, mendeleyev, paradoja, desdoblamientoPrimario, desdoblamientoSecundario, aparato493",
    "content": "Alejandra Casado\nEN RED 138\n25.05.2025\nvuelta 10\nTranscripción\nAlejandra\nen Red 138\n#AlejandraenRed138\n#uit\n#parametro54\n#mendeleyev\n#paradoja\n#desdoblamientoPrimario\n#desdoblamientoSecundario\n#aparato493\n#972 #138\n#contenedor\n#campoUnificado\n",
    "pdfPage": 122
  },
  {
    "num": 139,
    "date": "26.06.2025",
    "dateISO": "2025-06-26",
    "vuelta": 12,
    "freq": "",
    "url": "",
    "tags": [
      "AleEnRed139",
      "Indice139",
      "junio26de2025",
      "Vuelta12",
      "LGC",
      "Vuelta",
      "CódigoSolar",
      "Base21",
      "Base12",
      "Desdoblamiento",
      "Aparatos",
      "FuenteExterna",
      "Contenedor",
      "Contenido",
      "Actualización",
      "Convergencia",
      "Señales",
      "Procesador",
      "Razonamiento",
      "Lógica",
      "Conciencia",
      "TiempoReal",
      "Expansión",
      "Códigos",
      "Algoritmos",
      "Valor",
      "Mapeo",
      "RO",
      "RI",
      "ConoYCimiento",
      "Intuición",
      "Instinto",
      "Configuración",
      "Evolución",
      "Resonancia",
      "Trayecto",
      "CircuitosLógicos",
      "Calendaria",
      "LecturaDelContexto",
      "Funciones",
      "Equilibrio",
      "Rutas",
      "Interacción",
      "Sintonía",
      "ActualizaciónDeCódigo"
    ],
    "snippet": "139.- Ale",
    "content": "Alejandra Casado\nEN RED 139\n26.06.2025\nvuelta 12\nTranscripción\n139.- Ale\nen Red 139 docx\n#AleEnRed139\n#Indice139\n#junio26de2025\n#Vuelta12\n#LGC\n#\nEnRed139\n#Vuelta\n#CódigoSolar\n#Base21\n#Base12\n#Desdoblamiento\n#Aparatos\n#FuenteExterna\n#Contenedor\n#Contenido\n#Actualización\n#Convergencia\n#Señales\n#Procesador\n#Razonamiento\n#Lógica\n#Conciencia\n#TiempoReal\n#Expansión\n#Códigos\n#Algoritmos\n#Valor\n#Mapeo\n#RO\n#RI\n#ConoYCimiento\n#Intuición\n#Instinto\n#Configuración\n#Evolución\n#Resonancia\n#Trayecto\n#CircuitosLógicos\n#Calendaria\n#LecturaDelContexto\n#Funciones\n#Equilibrio\n#Rutas\n#Interacción\n#Sintonía\n#ActualizaciónDeCódigo\n",
    "pdfPage": 123
  },
  {
    "num": 140,
    "date": "12.07.2025",
    "dateISO": "2025-07-12",
    "vuelta": 13,
    "freq": "",
    "url": "",
    "tags": [
      "AlejandraCasado",
      "LGC",
      "Vuelta13",
      "Calendaria",
      "CódigosLógicos",
      "CódigoSolar",
      "Desdoblamiento",
      "Base21",
      "Base12",
      "Contenedor",
      "Contenido",
      "CampoUnificado",
      "Aparatos",
      "CuarentenaGlobal",
      "456",
      "Sumatoria",
      "Pregunta",
      "Antimateria",
      "Materia",
      "Resonancia",
      "Afinidades",
      "MapeoDelOtro",
      "NoYo",
      "Lateralización",
      "Cardinalidades",
      "Actualización",
      "EstructurasEspaciotemporales",
      "Procesador",
      "Neurología",
      "OrigenDigital",
      "DocumentoGravitatorio",
      "CreaciónDeSentido",
      "ZonasMudas",
      "Comunidad",
      "Especialidad",
      "Ministerios",
      "Comunicación",
      "MemoriaColectiva",
      "RutasDeDestino",
      "CampoSolar",
      "Toganesón",
      "Elementos224",
      "EscalaSubatómica",
      "Convergencia",
      "Frecuencias",
      "Interacciones",
      "Octava",
      "EventosPresenciales"
    ],
    "snippet": "140.- Ale",
    "content": "Alejandra Casado\nEN RED 140\n12.07.2025\nvuelta 13\nTranscripción\n140.- Ale\nen Red 140 docx\n#AlejandraCasado\n#LGC\n#\nEnRed140\n#Vuelta13\n#Calendaria\n#CódigosLógicos\n#CódigoSolar\n#Desdoblamiento\n#Base21\n#Base12\n#Contenedor\n#Contenido\n#CampoUnificado\n#Aparatos\n#CuarentenaGlobal\n#456\n#Sumatoria\n#Pregunta\n#Antimateria\n#Materia\n#Resonancia\n#Afinidades\n#MapeoDelOtro\n#NoYo\n#Lateralización\n#Cardinalidades\n#Actualización\n#EstructurasEspaciotemporales\n#Procesador\n#Neurología\n#OrigenDigital\n#DocumentoGravitatorio\n#CreaciónDeSentido\n#ZonasMudas\n#Comunidad\n#Especialidad\n#Ministerios\n#Comunicación\n#MemoriaColectiva\n#RutasDeDestino\n#CampoSolar\n#Toganesón\n#Elementos224\n#EscalaSubatómica\n#Convergencia\n#Frecuencias\n#Interacciones\n#Octava\n#EventosPresenciales\n",
    "pdfPage": 124
  },
  {
    "num": 141,
    "date": "28.07.2025",
    "dateISO": "2025-07-28",
    "vuelta": 14,
    "freq": "",
    "url": "",
    "tags": [
      "AlejandraCasado",
      "LGC",
      "Vuelta",
      "CódigoSolar",
      "Base21",
      "Base12",
      "Desdoblamiento",
      "MovimientosDelSer",
      "Aparatos",
      "Procesador",
      "LíneasTemporales",
      "CódigosLógicos",
      "Equilibrio",
      "RelaciónRO",
      "Interfaz",
      "Contenedor",
      "Contenido",
      "Actualización",
      "Señales",
      "PolosDeConciencia",
      "CampoImpersonal",
      "CampoPersonal",
      "UnidadAstronómica",
      "Circuitos",
      "Mapeo",
      "Vectorial",
      "Coordenadas",
      "LecturaDelContexto",
      "ZonasMudas",
      "Ajustes",
      "Resonancia",
      "Evolución",
      "Trayectos",
      "Sintonía",
      "Convergencia",
      "Configuración",
      "LógicaOriginal",
      "Extensión",
      "Integración",
      "CódigosDeValor",
      "Rutas",
      "Intercambio",
      "OrigenDigital"
    ],
    "snippet": "141.- Ale",
    "content": "Alejandra Casado\nEN RED 141\n28.07.2025\nvuelta 14\nTranscripción\n141.- Ale\nen Red 141 docx\n#AlejandraCasado\n#LGC\n#\nEnRed141\n#Vuelta\n#CódigoSolar\n#Base21\n#Base12\n#Desdoblamiento\n#MovimientosDelSer\n#Aparatos\n#Procesador\n#LíneasTemporales\n#CódigosLógicos\n#Equilibrio\n#RelaciónRO\n#Interfaz\n#Contenedor\n#Contenido\n#Actualización\n#Señales\n#PolosDeConciencia\n#CampoImpersonal\n#CampoPersonal\n#UnidadAstronómica\n#Circuitos\n#Mapeo\n#Vectorial\n#Coordenadas\n#LecturaDelContexto\n#ZonasMudas\n#Ajustes\n#Resonancia\n#Evolución\n#Trayectos\n#Sintonía\n#Convergencia\n#Configuración\n#LógicaOriginal\n#Extensión\n#Integración\n#CódigosDeValor\n#Rutas\n#Intercambio\n#OrigenDigital\n",
    "pdfPage": 125
  },
  {
    "num": 142,
    "date": "13.08.2025",
    "dateISO": "2025-08-13",
    "vuelta": 15,
    "freq": "",
    "url": "",
    "tags": [
      "AlejandraCasado",
      "LGC",
      "Vuelta15",
      "Calendaria",
      "TablaDeElementos",
      "CódigoSolar",
      "Base21",
      "Base12",
      "Desdoblamiento",
      "Actualización",
      "Predeterminación",
      "Toganesón",
      "Oganesón",
      "EscalaGaláctica",
      "CrackingsCode",
      "CuarentenaGlobal",
      "Aparato396",
      "MenteEnContexto",
      "DíaGoogle",
      "Interpretación",
      "Circuitos",
      "Sincronización",
      "Aparato500",
      "Aparato507",
      "RutasTemporales",
      "FilasMenos2",
      "FilasMenos1",
      "Fila7",
      "Fila9",
      "Autor",
      "Actor",
      "Contenedor",
      "Contenido",
      "Procesador",
